1	0.000000	10.0.1.5	10.0.1.2	TCP	74	44282 → 9999 [SYN] Seq=0 Win=42340 Len=0 MSS=1460 SACK_PERM=1 TSval=4216855027 TSecr=0 WS=512
2	0.002562	10.0.1.2	10.0.1.5	TCP	74	9999 → 44282 [SYN, ACK] Seq=0 Ack=1 Win=43440 Len=0 MSS=1460 SACK_PERM=1 TSval=763679217 TSecr=4216855027 WS=512
3	0.002580	10.0.1.5	10.0.1.2	TCP	66	44282 → 9999 [ACK] Seq=1 Ack=1 Win=42496 Len=0 TSval=4216855029 TSecr=763679217
4	0.002602	10.0.1.5	10.0.1.2	TCP	96	44282 → 9999 [PSH, ACK] Seq=1 Ack=1 Win=42496 Len=30 TSval=4216855029 TSecr=763679217 [TCP segment of a reassembled PDU]
5	0.003999	10.0.1.2	10.0.1.5	TCP	66	9999 → 44282 [ACK] Seq=1 Ack=31 Win=43520 Len=0 TSval=763679218 TSecr=4216855029
6	0.004019	10.0.1.2	10.0.1.5	TCP	117	9999 → 44282 [PSH, ACK] Seq=1 Ack=31 Win=43520 Len=51 TSval=763679219 TSecr=4216855029 [TCP segment of a reassembled PDU]
7	0.004023	10.0.1.5	10.0.1.2	TCP	66	44282 → 9999 [ACK] Seq=31 Ack=52 Win=42496 Len=0 TSval=4216855031 TSecr=763679219
8	1.005292	10.0.1.5	10.0.1.2	TCP	96	44282 → 9999 [PSH, ACK] Seq=31 Ack=52 Win=42496 Len=30 TSval=4216856032 TSecr=763679219 [TCP segment of a reassembled PDU]
9	1.005864	10.0.1.2	10.0.1.5	TCP	117	9999 → 44282 [PSH, ACK] Seq=52 Ack=61 Win=43520 Len=51 TSval=763680221 TSecr=4216856032 [TCP segment of a reassembled PDU]
10	1.005876	10.0.1.5	10.0.1.2	TCP	66	44282 → 9999 [ACK] Seq=61 Ack=103 Win=42496 Len=0 TSval=4216856033 TSecr=763680221
11	2.007235	10.0.1.5	10.0.1.2	TCP	96	44282 → 9999 [PSH, ACK] Seq=61 Ack=103 Win=42496 Len=30 TSval=4216857034 TSecr=763680221 [TCP segment of a reassembled PDU]
12	2.007427	10.0.1.2	10.0.1.5	TCP	117	9999 → 44282 [PSH, ACK] Seq=103 Ack=91 Win=43520 Len=51 TSval=763681223 TSecr=4216857034 [TCP segment of a reassembled PDU]
13	2.007434	10.0.1.5	10.0.1.2	TCP	66	44282 → 9999 [ACK] Seq=91 Ack=154 Win=42496 Len=0 TSval=4216857034 TSecr=763681223
14	3.008603	10.0.1.5	10.0.1.2	TCP	96	44282 → 9999 [PSH, ACK] Seq=91 Ack=154 Win=42496 Len=30 TSval=4216858035 TSecr=763681223 [TCP segment of a reassembled PDU]
15	3.008703	10.0.1.2	10.0.1.5	TCP	117	9999 → 44282 [PSH, ACK] Seq=154 Ack=121 Win=43520 Len=51 TSval=763682224 TSecr=4216858035 [TCP segment of a reassembled PDU]
16	3.008708	10.0.1.5	10.0.1.2	TCP	66	44282 → 9999 [ACK] Seq=121 Ack=205 Win=42496 Len=0 TSval=4216858035 TSecr=763682224
17	4.010175	10.0.1.5	10.0.1.2	TCP	96	44282 → 9999 [PSH, ACK] Seq=121 Ack=205 Win=42496 Len=30 TSval=4216859037 TSecr=763682224 [TCP segment of a reassembled PDU]
18	4.010461	10.0.1.2	10.0.1.5	TCP	117	9999 → 44282 [PSH, ACK] Seq=205 Ack=151 Win=43520 Len=51 TSval=763683226 TSecr=4216859037 [TCP segment of a reassembled PDU]
19	4.010474	10.0.1.5	10.0.1.2	TCP	66	44282 → 9999 [ACK] Seq=151 Ack=256 Win=42496 Len=0 TSval=4216859037 TSecr=763683226
20	5.011057	10.0.1.5	10.0.1.2	TCP	96	44282 → 9999 [PSH, ACK] Seq=151 Ack=256 Win=42496 Len=30 TSval=4216860038 TSecr=763683226 [TCP segment of a reassembled PDU]
21	5.011252	10.0.1.2	10.0.1.5	TCP	117	9999 → 44282 [PSH, ACK] Seq=256 Ack=181 Win=43520 Len=51 TSval=763684227 TSecr=4216860038 [TCP segment of a reassembled PDU]
22	5.011263	10.0.1.5	10.0.1.2	TCP	66	44282 → 9999 [ACK] Seq=181 Ack=307 Win=42496 Len=0 TSval=4216860038 TSecr=763684227
23	6.012844	10.0.1.5	10.0.1.2	TCP	96	44282 → 9999 [PSH, ACK] Seq=181 Ack=307 Win=42496 Len=30 TSval=4216861039 TSecr=763684227 [TCP segment of a reassembled PDU]
24	6.014137	10.0.1.2	10.0.1.5	TCP	117	9999 → 44282 [PSH, ACK] Seq=307 Ack=211 Win=43520 Len=51 TSval=763685230 TSecr=4216861039 [TCP segment of a reassembled PDU]
25	6.014150	10.0.1.5	10.0.1.2	TCP	66	44282 → 9999 [ACK] Seq=211 Ack=358 Win=42496 Len=0 TSval=4216861041 TSecr=763685230
26	7.015490	10.0.1.5	10.0.1.2	TCP	96	44282 → 9999 [PSH, ACK] Seq=211 Ack=358 Win=42496 Len=30 TSval=4216862042 TSecr=763685230 [TCP segment of a reassembled PDU]
27	7.015572	10.0.1.2	10.0.1.5	TCP	117	9999 → 44282 [PSH, ACK] Seq=358 Ack=241 Win=43520 Len=51 TSval=763686231 TSecr=4216862042 [TCP segment of a reassembled PDU]
28	7.015577	10.0.1.5	10.0.1.2	TCP	66	44282 → 9999 [ACK] Seq=241 Ack=409 Win=42496 Len=0 TSval=4216862042 TSecr=763686231
29	8.016839	10.0.1.5	10.0.1.2	TCP	96	44282 → 9999 [PSH, ACK] Seq=241 Ack=409 Win=42496 Len=30 TSval=4216863043 TSecr=763686231 [TCP segment of a reassembled PDU]
30	8.016987	10.0.1.2	10.0.1.5	TCP	117	9999 → 44282 [PSH, ACK] Seq=409 Ack=271 Win=43520 Len=51 TSval=763687233 TSecr=4216863043 [TCP segment of a reassembled PDU]
31	8.016992	10.0.1.5	10.0.1.2	TCP	66	44282 → 9999 [ACK] Seq=271 Ack=460 Win=42496 Len=0 TSval=4216863044 TSecr=763687233
32	9.018089	10.0.1.5	10.0.1.2	TCP	96	44282 → 9999 [PSH, ACK] Seq=271 Ack=460 Win=42496 Len=30 TSval=4216864045 TSecr=763687233 [TCP segment of a reassembled PDU]
33	9.018194	10.0.1.2	10.0.1.5	TCP	117	9999 → 44282 [PSH, ACK] Seq=460 Ack=301 Win=43520 Len=51 TSval=763688234 TSecr=4216864045 [TCP segment of a reassembled PDU]
34	9.018200	10.0.1.5	10.0.1.2	TCP	66	44282 → 9999 [ACK] Seq=301 Ack=511 Win=42496 Len=0 TSval=4216864045 TSecr=763688234
35	10.019433	10.0.1.5	10.0.1.2	TCP	97	44282 → 9999 [PSH, ACK] Seq=301 Ack=511 Win=42496 Len=31 TSval=4216865046 TSecr=763688234 [TCP segment of a reassembled PDU]
36	10.019706	10.0.1.2	10.0.1.5	TCP	117	9999 → 44282 [PSH, ACK] Seq=511 Ack=332 Win=43520 Len=51 TSval=763689235 TSecr=4216865046 [TCP segment of a reassembled PDU]
37	10.019711	10.0.1.5	10.0.1.2	TCP	66	44282 → 9999 [ACK] Seq=332 Ack=562 Win=42496 Len=0 TSval=4216865046 TSecr=763689235
38	11.021387	10.0.1.5	10.0.1.2	TCP	97	44282 → 9999 [PSH, ACK] Seq=332 Ack=562 Win=42496 Len=31 TSval=4216866048 TSecr=763689235 [TCP segment of a reassembled PDU]
39	11.021627	10.0.1.2	10.0.1.5	TCP	117	9999 → 44282 [PSH, ACK] Seq=562 Ack=363 Win=43520 Len=51 TSval=763690237 TSecr=4216866048 [TCP segment of a reassembled PDU]
40	11.021639	10.0.1.5	10.0.1.2	TCP	66	44282 → 9999 [ACK] Seq=363 Ack=613 Win=42496 Len=0 TSval=4216866048 TSecr=763690237
41	12.022141	10.0.1.5	10.0.1.2	TCP	97	44282 → 9999 [PSH, ACK] Seq=363 Ack=613 Win=42496 Len=31 TSval=4216867049 TSecr=763690237 [TCP segment of a reassembled PDU]
42	12.022293	10.0.1.2	10.0.1.5	TCP	117	9999 → 44282 [PSH, ACK] Seq=613 Ack=394 Win=43520 Len=51 TSval=763691238 TSecr=4216867049 [TCP segment of a reassembled PDU]
43	12.022301	10.0.1.5	10.0.1.2	TCP	66	44282 → 9999 [ACK] Seq=394 Ack=664 Win=42496 Len=0 TSval=4216867049 TSecr=763691238
44	13.023593	10.0.1.5	10.0.1.2	TCP	97	44282 → 9999 [PSH, ACK] Seq=394 Ack=664 Win=42496 Len=31 TSval=4216868050 TSecr=763691238 [TCP segment of a reassembled PDU]
45	13.024211	10.0.1.2	10.0.1.5	TCP	117	9999 → 44282 [PSH, ACK] Seq=664 Ack=425 Win=43520 Len=51 TSval=763692240 TSecr=4216868050 [TCP segment of a reassembled PDU]
46	13.024226	10.0.1.5	10.0.1.2	TCP	66	44282 → 9999 [ACK] Seq=425 Ack=715 Win=42496 Len=0 TSval=4216868051 TSecr=763692240
47	14.025548	10.0.1.5	10.0.1.2	TCP	97	44282 → 9999 [PSH, ACK] Seq=425 Ack=715 Win=42496 Len=31 TSval=4216869052 TSecr=763692240 [TCP segment of a reassembled PDU]
48	14.025931	10.0.1.2	10.0.1.5	TCP	117	9999 → 44282 [PSH, ACK] Seq=715 Ack=456 Win=43520 Len=51 TSval=763693242 TSecr=4216869052 [TCP segment of a reassembled PDU]
49	14.025944	10.0.1.5	10.0.1.2	TCP	66	44282 → 9999 [ACK] Seq=456 Ack=766 Win=42496 Len=0 TSval=4216869053 TSecr=763693242
50	15.027195	10.0.1.5	10.0.1.2	TCP	97	44282 → 9999 [PSH, ACK] Seq=456 Ack=766 Win=42496 Len=31 TSval=4216870054 TSecr=763693242 [TCP segment of a reassembled PDU]
51	15.027479	10.0.1.2	10.0.1.5	TCP	117	9999 → 44282 [PSH, ACK] Seq=766 Ack=487 Win=43520 Len=51 TSval=763694243 TSecr=4216870054 [TCP segment of a reassembled PDU]
52	15.027491	10.0.1.5	10.0.1.2	TCP	66	44282 → 9999 [ACK] Seq=487 Ack=817 Win=42496 Len=0 TSval=4216870054 TSecr=763694243
53	16.028927	10.0.1.5	10.0.1.2	TCP	97	44282 → 9999 [PSH, ACK] Seq=487 Ack=817 Win=42496 Len=31 TSval=4216871056 TSecr=763694243 [TCP segment of a reassembled PDU]
54	16.029093	10.0.1.2	10.0.1.5	TCP	117	9999 → 44282 [PSH, ACK] Seq=817 Ack=518 Win=43520 Len=51 TSval=763695245 TSecr=4216871056 [TCP segment of a reassembled PDU]
55	16.029098	10.0.1.5	10.0.1.2	TCP	66	44282 → 9999 [ACK] Seq=518 Ack=868 Win=42496 Len=0 TSval=4216871056 TSecr=763695245