1	0.000000	10.0.1.5	10.0.1.2	TCP	74	47028 → 9999 [SYN] Seq=0 Win=42340 Len=0 MSS=1460 SACK_PERM=1 TSval=4217175813 TSecr=0 WS=512
2	0.002736	10.0.1.2	10.0.1.5	TCP	74	9999 → 47028 [SYN, ACK] Seq=0 Ack=1 Win=43440 Len=0 MSS=1460 SACK_PERM=1 TSval=764000004 TSecr=4217175813 WS=512
3	0.002755	10.0.1.5	10.0.1.2	TCP	66	47028 → 9999 [ACK] Seq=1 Ack=1 Win=42496 Len=0 TSval=4217175816 TSecr=764000004
4	0.002878	10.0.1.5	10.0.1.2	TCP	96	47028 → 9999 [PSH, ACK] Seq=1 Ack=1 Win=42496 Len=30 TSval=4217175816 TSecr=764000004 [TCP segment of a reassembled PDU]
5	0.004186	10.0.1.2	10.0.1.5	TCP	66	9999 → 47028 [ACK] Seq=1 Ack=31 Win=43520 Len=0 TSval=764000006 TSecr=4217175816
6	0.004204	10.0.1.2	10.0.1.5	TCP	117	9999 → 47028 [PSH, ACK] Seq=1 Ack=31 Win=43520 Len=51 TSval=764000006 TSecr=4217175816 [TCP segment of a reassembled PDU]
7	0.004227	10.0.1.5	10.0.1.2	TCP	66	47028 → 9999 [ACK] Seq=31 Ack=52 Win=42496 Len=0 TSval=4217175818 TSecr=764000006
8	1.005551	10.0.1.5	10.0.1.2	TCP	96	47028 → 9999 [PSH, ACK] Seq=31 Ack=52 Win=42496 Len=30 TSval=4217176819 TSecr=764000006 [TCP segment of a reassembled PDU]
9	1.006183	10.0.1.2	10.0.1.5	TCP	117	9999 → 47028 [PSH, ACK] Seq=52 Ack=61 Win=43520 Len=51 TSval=764001008 TSecr=4217176819 [TCP segment of a reassembled PDU]
10	1.006201	10.0.1.5	10.0.1.2	TCP	66	47028 → 9999 [ACK] Seq=61 Ack=103 Win=42496 Len=0 TSval=4217176820 TSecr=764001008
11	2.007598	10.0.1.5	10.0.1.2	TCP	96	47028 → 9999 [PSH, ACK] Seq=61 Ack=103 Win=42496 Len=30 TSval=4217177821 TSecr=764001008 [TCP segment of a reassembled PDU]
12	2.007731	10.0.1.2	10.0.1.5	TCP	117	9999 → 47028 [PSH, ACK] Seq=103 Ack=91 Win=43520 Len=51 TSval=764002010 TSecr=4217177821 [TCP segment of a reassembled PDU]
13	2.007738	10.0.1.5	10.0.1.2	TCP	66	47028 → 9999 [ACK] Seq=91 Ack=154 Win=42496 Len=0 TSval=4217177821 TSecr=764002010
14	3.008910	10.0.1.5	10.0.1.2	TCP	96	47028 → 9999 [PSH, ACK] Seq=91 Ack=154 Win=42496 Len=30 TSval=4217178822 TSecr=764002010 [TCP segment of a reassembled PDU]
15	3.009115	10.0.1.2	10.0.1.5	TCP	117	9999 → 47028 [PSH, ACK] Seq=154 Ack=121 Win=43520 Len=51 TSval=764003012 TSecr=4217178822 [TCP segment of a reassembled PDU]
16	3.009123	10.0.1.5	10.0.1.2	TCP	66	47028 → 9999 [ACK] Seq=121 Ack=205 Win=42496 Len=0 TSval=4217178823 TSecr=764003012
17	4.010671	10.0.1.5	10.0.1.2	TCP	96	47028 → 9999 [PSH, ACK] Seq=121 Ack=205 Win=42496 Len=30 TSval=4217179824 TSecr=764003012 [TCP segment of a reassembled PDU]
18	4.010974	10.0.1.2	10.0.1.5	TCP	117	9999 → 47028 [PSH, ACK] Seq=205 Ack=151 Win=43520 Len=51 TSval=764004013 TSecr=4217179824 [TCP segment of a reassembled PDU]
19	4.011027	10.0.1.5	10.0.1.2	TCP	66	47028 → 9999 [ACK] Seq=151 Ack=256 Win=42496 Len=0 TSval=4217179824 TSecr=764004013
20	5.012300	10.0.1.5	10.0.1.2	TCP	96	47028 → 9999 [PSH, ACK] Seq=151 Ack=256 Win=42496 Len=30 TSval=4217180826 TSecr=764004013 [TCP segment of a reassembled PDU]
21	5.012367	10.0.1.2	10.0.1.5	TCP	117	9999 → 47028 [PSH, ACK] Seq=256 Ack=181 Win=43520 Len=51 TSval=764005015 TSecr=4217180826 [TCP segment of a reassembled PDU]
22	5.012371	10.0.1.5	10.0.1.2	TCP	66	47028 → 9999 [ACK] Seq=181 Ack=307 Win=42496 Len=0 TSval=4217180826 TSecr=764005015
23	6.013607	10.0.1.5	10.0.1.2	TCP	96	47028 → 9999 [PSH, ACK] Seq=181 Ack=307 Win=42496 Len=30 TSval=4217181827 TSecr=764005015 [TCP segment of a reassembled PDU]
24	6.013732	10.0.1.2	10.0.1.5	TCP	117	9999 → 47028 [PSH, ACK] Seq=307 Ack=211 Win=43520 Len=51 TSval=764006016 TSecr=4217181827 [TCP segment of a reassembled PDU]
25	6.013737	10.0.1.5	10.0.1.2	TCP	66	47028 → 9999 [ACK] Seq=211 Ack=358 Win=42496 Len=0 TSval=4217181827 TSecr=764006016
26	7.015043	10.0.1.5	10.0.1.2	TCP	96	47028 → 9999 [PSH, ACK] Seq=211 Ack=358 Win=42496 Len=30 TSval=4217182829 TSecr=764006016 [TCP segment of a reassembled PDU]
27	7.015169	10.0.1.2	10.0.1.5	TCP	117	9999 → 47028 [PSH, ACK] Seq=358 Ack=241 Win=43520 Len=51 TSval=764007018 TSecr=4217182829 [TCP segment of a reassembled PDU]
28	7.015173	10.0.1.5	10.0.1.2	TCP	66	47028 → 9999 [ACK] Seq=241 Ack=409 Win=42496 Len=0 TSval=4217182829 TSecr=764007018
29	8.016428	10.0.1.5	10.0.1.2	TCP	96	47028 → 9999 [PSH, ACK] Seq=241 Ack=409 Win=42496 Len=30 TSval=4217183830 TSecr=764007018 [TCP segment of a reassembled PDU]
30	8.016526	10.0.1.2	10.0.1.5	TCP	117	9999 → 47028 [PSH, ACK] Seq=409 Ack=271 Win=43520 Len=51 TSval=764008019 TSecr=4217183830 [TCP segment of a reassembled PDU]
31	8.016530	10.0.1.5	10.0.1.2	TCP	66	47028 → 9999 [ACK] Seq=271 Ack=460 Win=42496 Len=0 TSval=4217183830 TSecr=764008019
32	9.017731	10.0.1.5	10.0.1.2	TCP	96	47028 → 9999 [PSH, ACK] Seq=271 Ack=460 Win=42496 Len=30 TSval=4217184831 TSecr=764008019 [TCP segment of a reassembled PDU]
33	9.017821	10.0.1.2	10.0.1.5	TCP	117	9999 → 47028 [PSH, ACK] Seq=460 Ack=301 Win=43520 Len=51 TSval=764009020 TSecr=4217184831 [TCP segment of a reassembled PDU]
34	9.017826	10.0.1.5	10.0.1.2	TCP	66	47028 → 9999 [ACK] Seq=301 Ack=511 Win=42496 Len=0 TSval=4217184831 TSecr=764009020
35	10.019797	10.0.1.5	10.0.1.2	TCP	97	47028 → 9999 [PSH, ACK] Seq=301 Ack=511 Win=42496 Len=31 TSval=4217185833 TSecr=764009020 [TCP segment of a reassembled PDU]
36	10.020228	10.0.1.2	10.0.1.5	TCP	117	9999 → 47028 [PSH, ACK] Seq=511 Ack=332 Win=43520 Len=51 TSval=764010023 TSecr=4217185833 [TCP segment of a reassembled PDU]
37	10.020245	10.0.1.5	10.0.1.2	TCP	66	47028 → 9999 [ACK] Seq=332 Ack=562 Win=42496 Len=0 TSval=4217185834 TSecr=764010023
38	11.021488	10.0.1.5	10.0.1.2	TCP	97	47028 → 9999 [PSH, ACK] Seq=332 Ack=562 Win=42496 Len=31 TSval=4217186835 TSecr=764010023 [TCP segment of a reassembled PDU]
39	11.021587	10.0.1.2	10.0.1.5	TCP	117	9999 → 47028 [PSH, ACK] Seq=562 Ack=363 Win=43520 Len=51 TSval=764011024 TSecr=4217186835 [TCP segment of a reassembled PDU]
40	11.021593	10.0.1.5	10.0.1.2	TCP	66	47028 → 9999 [ACK] Seq=363 Ack=613 Win=42496 Len=0 TSval=4217186835 TSecr=764011024
41	12.022832	10.0.1.5	10.0.1.2	TCP	97	47028 → 9999 [PSH, ACK] Seq=363 Ack=613 Win=42496 Len=31 TSval=4217187836 TSecr=764011024 [TCP segment of a reassembled PDU]
42	12.023674	10.0.1.2	10.0.1.5	TCP	117	9999 → 47028 [PSH, ACK] Seq=613 Ack=394 Win=43520 Len=51 TSval=764012026 TSecr=4217187836 [TCP segment of a reassembled PDU]
43	12.023694	10.0.1.5	10.0.1.2	TCP	66	47028 → 9999 [ACK] Seq=394 Ack=664 Win=42496 Len=0 TSval=4217187837 TSecr=764012026
44	13.025215	10.0.1.5	10.0.1.2	TCP	97	47028 → 9999 [PSH, ACK] Seq=394 Ack=664 Win=42496 Len=31 TSval=4217188839 TSecr=764012026 [TCP segment of a reassembled PDU]
45	13.026571	10.0.1.2	10.0.1.5	TCP	117	9999 → 47028 [PSH, ACK] Seq=664 Ack=425 Win=43520 Len=51 TSval=764013029 TSecr=4217188839 [TCP segment of a reassembled PDU]
46	13.026579	10.0.1.5	10.0.1.2	TCP	66	47028 → 9999 [ACK] Seq=425 Ack=715 Win=42496 Len=0 TSval=4217188840 TSecr=764013029
47	14.028654	10.0.1.5	10.0.1.2	TCP	97	47028 → 9999 [PSH, ACK] Seq=425 Ack=715 Win=42496 Len=31 TSval=4217189842 TSecr=764013029 [TCP segment of a reassembled PDU]
48	14.028761	10.0.1.2	10.0.1.5	TCP	117	9999 → 47028 [PSH, ACK] Seq=715 Ack=456 Win=43520 Len=51 TSval=764014031 TSecr=4217189842 [TCP segment of a reassembled PDU]
49	14.028766	10.0.1.5	10.0.1.2	TCP	66	47028 → 9999 [ACK] Seq=456 Ack=766 Win=42496 Len=0 TSval=4217189842 TSecr=764014031
50	15.030983	10.0.1.5	10.0.1.2	TCP	97	47028 → 9999 [PSH, ACK] Seq=456 Ack=766 Win=42496 Len=31 TSval=4217190844 TSecr=764014031 [TCP segment of a reassembled PDU]
51	15.031079	10.0.1.2	10.0.1.5	TCP	117	9999 → 47028 [PSH, ACK] Seq=766 Ack=487 Win=43520 Len=51 TSval=764015034 TSecr=4217190844 [TCP segment of a reassembled PDU]
52	15.031083	10.0.1.5	10.0.1.2	TCP	66	47028 → 9999 [ACK] Seq=487 Ack=817 Win=42496 Len=0 TSval=4217190845 TSecr=764015034
53	16.032473	10.0.1.5	10.0.1.2	TCP	97	47028 → 9999 [PSH, ACK] Seq=487 Ack=817 Win=42496 Len=31 TSval=4217191846 TSecr=764015034 [TCP segment of a reassembled PDU]
54	16.032619	10.0.1.2	10.0.1.5	TCP	117	9999 → 47028 [PSH, ACK] Seq=817 Ack=518 Win=43520 Len=51 TSval=764016035 TSecr=4217191846 [TCP segment of a reassembled PDU]
55	16.032626	10.0.1.5	10.0.1.2	TCP	66	47028 → 9999 [ACK] Seq=518 Ack=868 Win=42496 Len=0 TSval=4217191846 TSecr=764016035
56	17.033735	10.0.1.5	10.0.1.2	TCP	97	47028 → 9999 [PSH, ACK] Seq=518 Ack=868 Win=42496 Len=31 TSval=4217192847 TSecr=764016035 [TCP segment of a reassembled PDU]
57	17.033819	10.0.1.2	10.0.1.5	TCP	117	9999 → 47028 [PSH, ACK] Seq=868 Ack=549 Win=43520 Len=51 TSval=764017036 TSecr=4217192847 [TCP segment of a reassembled PDU]
58	17.033824	10.0.1.5	10.0.1.2	TCP	66	47028 → 9999 [ACK] Seq=549 Ack=919 Win=42496 Len=0 TSval=4217192847 TSecr=764017036
59	18.035386	10.0.1.5	10.0.1.2	TCP	97	47028 → 9999 [PSH, ACK] Seq=549 Ack=919 Win=42496 Len=31 TSval=4217193849 TSecr=764017036 [TCP segment of a reassembled PDU]
60	18.035481	10.0.1.2	10.0.1.5	TCP	117	9999 → 47028 [PSH, ACK] Seq=919 Ack=580 Win=43520 Len=51 TSval=764018038 TSecr=4217193849 [TCP segment of a reassembled PDU]
61	18.035487	10.0.1.5	10.0.1.2	TCP	66	47028 → 9999 [ACK] Seq=580 Ack=970 Win=42496 Len=0 TSval=4217193849 TSecr=764018038
62	18.214688	10.0.1.5	10.0.1.2	TCP	66	47028 → 9999 [FIN, ACK] Seq=580 Ack=970 Win=42496 Len=0 TSval=4217194028 TSecr=764018038
63	18.214978	10.0.1.2	10.0.1.5	TCP	66	9999 → 47028 [FIN, ACK] Seq=970 Ack=581 Win=43520 Len=0 TSval=764018217 TSecr=4217194028
64	18.214988	10.0.1.5	10.0.1.2	TCP	66	47028 → 9999 [ACK] Seq=581 Ack=971 Win=42496 Len=0 TSval=4217194028 TSecr=764018217
65	19.971218	fe80::6823:42ff:fe1f:a67f	ff02::fb	MDNS	107	Standard query 0x0000 PTR _ipps._tcp.local, "QM" question PTR _ipp._tcp.local, "QM" question