1	0.000000	10.0.1.5	10.0.1.2	TCP	74	45522 → 9999 [SYN] Seq=0 Win=42340 Len=0 MSS=1460 SACK_PERM=1 TSval=4217984369 TSecr=0 WS=512
2	0.002504	10.0.1.2	10.0.1.5	TCP	74	9999 → 45522 [SYN, ACK] Seq=0 Ack=1 Win=43440 Len=0 MSS=1460 SACK_PERM=1 TSval=764808559 TSecr=4217984369 WS=512
3	0.002520	10.0.1.5	10.0.1.2	TCP	66	45522 → 9999 [ACK] Seq=1 Ack=1 Win=42496 Len=0 TSval=4217984372 TSecr=764808559
4	0.002543	10.0.1.5	10.0.1.2	TCP	96	45522 → 9999 [PSH, ACK] Seq=1 Ack=1 Win=42496 Len=30 TSval=4217984372 TSecr=764808559 [TCP segment of a reassembled PDU]
5	0.003247	10.0.1.2	10.0.1.5	TCP	66	9999 → 45522 [ACK] Seq=1 Ack=31 Win=43520 Len=0 TSval=764808561 TSecr=4217984372
6	0.004170	10.0.1.2	10.0.1.5	TCP	117	9999 → 45522 [PSH, ACK] Seq=1 Ack=31 Win=43520 Len=51 TSval=764808561 TSecr=4217984372 [TCP segment of a reassembled PDU]
7	0.004224	10.0.1.5	10.0.1.2	TCP	66	45522 → 9999 [ACK] Seq=31 Ack=52 Win=42496 Len=0 TSval=4217984373 TSecr=764808561
8	1.005506	10.0.1.5	10.0.1.2	TCP	96	45522 → 9999 [PSH, ACK] Seq=31 Ack=52 Win=42496 Len=30 TSval=4217985375 TSecr=764808561 [TCP segment of a reassembled PDU]
9	1.005946	10.0.1.2	10.0.1.5	TCP	117	9999 → 45522 [PSH, ACK] Seq=52 Ack=61 Win=43520 Len=51 TSval=764809564 TSecr=4217985375 [TCP segment of a reassembled PDU]
10	1.005954	10.0.1.5	10.0.1.2	TCP	66	45522 → 9999 [ACK] Seq=61 Ack=103 Win=42496 Len=0 TSval=4217985375 TSecr=764809564
11	2.006536	10.0.1.5	10.0.1.2	TCP	96	45522 → 9999 [PSH, ACK] Seq=61 Ack=103 Win=42496 Len=30 TSval=4217986376 TSecr=764809564 [TCP segment of a reassembled PDU]
12	2.006672	10.0.1.2	10.0.1.5	TCP	117	9999 → 45522 [PSH, ACK] Seq=103 Ack=91 Win=43520 Len=51 TSval=764810565 TSecr=4217986376 [TCP segment of a reassembled PDU]
13	2.006679	10.0.1.5	10.0.1.2	TCP	66	45522 → 9999 [ACK] Seq=91 Ack=154 Win=42496 Len=0 TSval=4217986376 TSecr=764810565
14	3.007900	10.0.1.5	10.0.1.2	TCP	96	45522 → 9999 [PSH, ACK] Seq=91 Ack=154 Win=42496 Len=30 TSval=4217987377 TSecr=764810565 [TCP segment of a reassembled PDU]
15	3.008215	10.0.1.2	10.0.1.5	TCP	117	9999 → 45522 [PSH, ACK] Seq=154 Ack=121 Win=43520 Len=51 TSval=764811566 TSecr=4217987377 [TCP segment of a reassembled PDU]
16	3.008227	10.0.1.5	10.0.1.2	TCP	66	45522 → 9999 [ACK] Seq=121 Ack=205 Win=42496 Len=0 TSval=4217987377 TSecr=764811566
17	4.009577	10.0.1.5	10.0.1.2	TCP	96	45522 → 9999 [PSH, ACK] Seq=121 Ack=205 Win=42496 Len=30 TSval=4217988379 TSecr=764811566 [TCP segment of a reassembled PDU]
18	4.009828	10.0.1.2	10.0.1.5	TCP	117	9999 → 45522 [PSH, ACK] Seq=205 Ack=151 Win=43520 Len=51 TSval=764812568 TSecr=4217988379 [TCP segment of a reassembled PDU]
19	4.009841	10.0.1.5	10.0.1.2	TCP	66	45522 → 9999 [ACK] Seq=151 Ack=256 Win=42496 Len=0 TSval=4217988379 TSecr=764812568
20	5.011129	10.0.1.5	10.0.1.2	TCP	96	45522 → 9999 [PSH, ACK] Seq=151 Ack=256 Win=42496 Len=30 TSval=4217989380 TSecr=764812568 [TCP segment of a reassembled PDU]
21	5.011292	10.0.1.2	10.0.1.5	TCP	117	9999 → 45522 [PSH, ACK] Seq=256 Ack=181 Win=43520 Len=51 TSval=764813569 TSecr=4217989380 [TCP segment of a reassembled PDU]
22	5.011299	10.0.1.5	10.0.1.2	TCP	66	45522 → 9999 [ACK] Seq=181 Ack=307 Win=42496 Len=0 TSval=4217989380 TSecr=764813569
23	6.012452	10.0.1.5	10.0.1.2	TCP	96	45522 → 9999 [PSH, ACK] Seq=181 Ack=307 Win=42496 Len=30 TSval=4217990382 TSecr=764813569 [TCP segment of a reassembled PDU]
24	6.012575	10.0.1.2	10.0.1.5	TCP	117	9999 → 45522 [PSH, ACK] Seq=307 Ack=211 Win=43520 Len=51 TSval=764814571 TSecr=4217990382 [TCP segment of a reassembled PDU]
25	6.012581	10.0.1.5	10.0.1.2	TCP	66	45522 → 9999 [ACK] Seq=211 Ack=358 Win=42496 Len=0 TSval=4217990382 TSecr=764814571
26	7.013750	10.0.1.5	10.0.1.2	TCP	96	45522 → 9999 [PSH, ACK] Seq=211 Ack=358 Win=42496 Len=30 TSval=4217991383 TSecr=764814571 [TCP segment of a reassembled PDU]
27	7.014126	10.0.1.2	10.0.1.5	TCP	117	9999 → 45522 [PSH, ACK] Seq=358 Ack=241 Win=43520 Len=51 TSval=764815572 TSecr=4217991383 [TCP segment of a reassembled PDU]
28	7.014137	10.0.1.5	10.0.1.2	TCP	66	45522 → 9999 [ACK] Seq=241 Ack=409 Win=42496 Len=0 TSval=4217991383 TSecr=764815572
29	8.015409	10.0.1.5	10.0.1.2	TCP	96	45522 → 9999 [PSH, ACK] Seq=241 Ack=409 Win=42496 Len=30 TSval=4217992384 TSecr=764815572 [TCP segment of a reassembled PDU]
30	8.015637	10.0.1.2	10.0.1.5	TCP	117	9999 → 45522 [PSH, ACK] Seq=409 Ack=271 Win=43520 Len=51 TSval=764816574 TSecr=4217992384 [TCP segment of a reassembled PDU]
31	8.015647	10.0.1.5	10.0.1.2	TCP	66	45522 → 9999 [ACK] Seq=271 Ack=460 Win=42496 Len=0 TSval=4217992385 TSecr=764816574
32	9.017016	10.0.1.5	10.0.1.2	TCP	96	45522 → 9999 [PSH, ACK] Seq=271 Ack=460 Win=42496 Len=30 TSval=4217993386 TSecr=764816574 [TCP segment of a reassembled PDU]
33	9.017182	10.0.1.2	10.0.1.5	TCP	117	9999 → 45522 [PSH, ACK] Seq=460 Ack=301 Win=43520 Len=51 TSval=764817575 TSecr=4217993386 [TCP segment of a reassembled PDU]
34	9.017188	10.0.1.5	10.0.1.2	TCP	66	45522 → 9999 [ACK] Seq=301 Ack=511 Win=42496 Len=0 TSval=4217993386 TSecr=764817575
35	10.018639	10.0.1.5	10.0.1.2	TCP	97	45522 → 9999 [PSH, ACK] Seq=301 Ack=511 Win=42496 Len=31 TSval=4217994388 TSecr=764817575 [TCP segment of a reassembled PDU]
36	10.018773	10.0.1.2	10.0.1.5	TCP	117	9999 → 45522 [PSH, ACK] Seq=511 Ack=332 Win=43520 Len=51 TSval=764818577 TSecr=4217994388 [TCP segment of a reassembled PDU]
37	10.018780	10.0.1.5	10.0.1.2	TCP	66	45522 → 9999 [ACK] Seq=332 Ack=562 Win=42496 Len=0 TSval=4217994388 TSecr=764818577
38	11.020141	10.0.1.5	10.0.1.2	TCP	97	45522 → 9999 [PSH, ACK] Seq=332 Ack=562 Win=42496 Len=31 TSval=4217995389 TSecr=764818577 [TCP segment of a reassembled PDU]
39	11.020217	10.0.1.2	10.0.1.5	TCP	117	9999 → 45522 [PSH, ACK] Seq=562 Ack=363 Win=43520 Len=51 TSval=764819578 TSecr=4217995389 [TCP segment of a reassembled PDU]
40	11.020221	10.0.1.5	10.0.1.2	TCP	66	45522 → 9999 [ACK] Seq=363 Ack=613 Win=42496 Len=0 TSval=4217995389 TSecr=764819578
41	12.021662	10.0.1.5	10.0.1.2	TCP	97	45522 → 9999 [PSH, ACK] Seq=363 Ack=613 Win=42496 Len=31 TSval=4217996391 TSecr=764819578 [TCP segment of a reassembled PDU]
42	12.021774	10.0.1.2	10.0.1.5	TCP	117	9999 → 45522 [PSH, ACK] Seq=613 Ack=394 Win=43520 Len=51 TSval=764820580 TSecr=4217996391 [TCP segment of a reassembled PDU]
43	12.021779	10.0.1.5	10.0.1.2	TCP	66	45522 → 9999 [ACK] Seq=394 Ack=664 Win=42496 Len=0 TSval=4217996391 TSecr=764820580
44	13.023068	10.0.1.5	10.0.1.2	TCP	97	45522 → 9999 [PSH, ACK] Seq=394 Ack=664 Win=42496 Len=31 TSval=4217997392 TSecr=764820580 [TCP segment of a reassembled PDU]
45	13.023218	10.0.1.2	10.0.1.5	TCP	117	9999 → 45522 [PSH, ACK] Seq=664 Ack=425 Win=43520 Len=51 TSval=764821581 TSecr=4217997392 [TCP segment of a reassembled PDU]
46	13.023231	10.0.1.5	10.0.1.2	TCP	66	45522 → 9999 [ACK] Seq=425 Ack=715 Win=42496 Len=0 TSval=4217997392 TSecr=764821581
47	13.575678	10.0.1.5	10.0.1.2	TCP	66	45522 → 9999 [FIN, ACK] Seq=425 Ack=715 Win=42496 Len=0 TSval=4217997945 TSecr=764821581
48	13.575949	10.0.1.2	10.0.1.5	TCP	66	9999 → 45522 [FIN, ACK] Seq=715 Ack=426 Win=43520 Len=0 TSval=764822134 TSecr=4217997945
49	13.575957	10.0.1.5	10.0.1.2	TCP	66	45522 → 9999 [ACK] Seq=426 Ack=716 Win=42496 Len=0 TSval=4217997945 TSecr=764822134