1	0.000000	fe80::60d5:c2ff:fed6:3b1d	ff02::fb	MDNS	107	Standard query 0x0000 PTR _ipps._tcp.local, "QM" question PTR _ipp._tcp.local, "QM" question
2	2.972595	10.0.1.5	10.0.1.2	TCP	74	38882 → 9999 [SYN] Seq=0 Win=42340 Len=0 MSS=1460 SACK_PERM=1 TSval=4221945014 TSecr=0 WS=512
3	2.975366	10.0.1.2	10.0.1.5	TCP	74	9999 → 38882 [SYN, ACK] Seq=0 Ack=1 Win=43440 Len=0 MSS=1460 SACK_PERM=1 TSval=768769204 TSecr=4221945014 WS=512
4	2.975389	10.0.1.5	10.0.1.2	TCP	66	38882 → 9999 [ACK] Seq=1 Ack=1 Win=42496 Len=0 TSval=4221945016 TSecr=768769204
5	2.975422	10.0.1.5	10.0.1.2	TCP	96	38882 → 9999 [PSH, ACK] Seq=1 Ack=1 Win=42496 Len=30 TSval=4221945016 TSecr=768769204 [TCP segment of a reassembled PDU]
6	2.976391	10.0.1.2	10.0.1.5	TCP	66	9999 → 38882 [ACK] Seq=1 Ack=31 Win=43520 Len=0 TSval=768769206 TSecr=4221945016
7	2.976446	10.0.1.2	10.0.1.5	TCP	117	9999 → 38882 [PSH, ACK] Seq=1 Ack=31 Win=43520 Len=51 TSval=768769206 TSecr=4221945016 [TCP segment of a reassembled PDU]
8	2.976462	10.0.1.5	10.0.1.2	TCP	66	38882 → 9999 [ACK] Seq=31 Ack=52 Win=42496 Len=0 TSval=4221945017 TSecr=768769206
9	3.978124	10.0.1.5	10.0.1.2	TCP	96	38882 → 9999 [PSH, ACK] Seq=31 Ack=52 Win=42496 Len=30 TSval=4221946019 TSecr=768769206 [TCP segment of a reassembled PDU]
10	3.979775	10.0.1.2	10.0.1.5	TCP	117	9999 → 38882 [PSH, ACK] Seq=52 Ack=61 Win=43520 Len=51 TSval=768770209 TSecr=4221946019 [TCP segment of a reassembled PDU]
11	3.979795	10.0.1.5	10.0.1.2	TCP	66	38882 → 9999 [ACK] Seq=61 Ack=103 Win=42496 Len=0 TSval=4221946021 TSecr=768770209
12	4.981537	10.0.1.5	10.0.1.2	TCP	96	38882 → 9999 [PSH, ACK] Seq=61 Ack=103 Win=42496 Len=30 TSval=4221947023 TSecr=768770209 [TCP segment of a reassembled PDU]
13	4.982136	10.0.1.2	10.0.1.5	TCP	117	9999 → 38882 [PSH, ACK] Seq=103 Ack=91 Win=43520 Len=51 TSval=768771212 TSecr=4221947023 [TCP segment of a reassembled PDU]
14	4.982150	10.0.1.5	10.0.1.2	TCP	66	38882 → 9999 [ACK] Seq=91 Ack=154 Win=42496 Len=0 TSval=4221947023 TSecr=768771212
15	5.984143	10.0.1.5	10.0.1.2	TCP	96	38882 → 9999 [PSH, ACK] Seq=91 Ack=154 Win=42496 Len=30 TSval=4221948025 TSecr=768771212 [TCP segment of a reassembled PDU]
16	5.984304	10.0.1.2	10.0.1.5	TCP	117	9999 → 38882 [PSH, ACK] Seq=154 Ack=121 Win=43520 Len=51 TSval=768772214 TSecr=4221948025 [TCP segment of a reassembled PDU]
17	5.984310	10.0.1.5	10.0.1.2	TCP	66	38882 → 9999 [ACK] Seq=121 Ack=205 Win=42496 Len=0 TSval=4221948025 TSecr=768772214
18	6.985462	10.0.1.5	10.0.1.2	TCP	96	38882 → 9999 [PSH, ACK] Seq=121 Ack=205 Win=42496 Len=30 TSval=4221949026 TSecr=768772214 [TCP segment of a reassembled PDU]
19	6.985734	10.0.1.2	10.0.1.5	TCP	117	9999 → 38882 [PSH, ACK] Seq=205 Ack=151 Win=43520 Len=51 TSval=768773216 TSecr=4221949026 [TCP segment of a reassembled PDU]
20	6.985742	10.0.1.5	10.0.1.2	TCP	66	38882 → 9999 [ACK] Seq=151 Ack=256 Win=42496 Len=0 TSval=4221949027 TSecr=768773216
21	7.986620	10.0.1.5	10.0.1.2	TCP	96	38882 → 9999 [PSH, ACK] Seq=151 Ack=256 Win=42496 Len=30 TSval=4221950028 TSecr=768773216 [TCP segment of a reassembled PDU]
22	7.986737	10.0.1.2	10.0.1.5	TCP	117	9999 → 38882 [PSH, ACK] Seq=256 Ack=181 Win=43520 Len=51 TSval=768774217 TSecr=4221950028 [TCP segment of a reassembled PDU]
23	7.986742	10.0.1.5	10.0.1.2	TCP	66	38882 → 9999 [ACK] Seq=181 Ack=307 Win=42496 Len=0 TSval=4221950028 TSecr=768774217
24	8.988695	10.0.1.5	10.0.1.2	TCP	96	38882 → 9999 [PSH, ACK] Seq=181 Ack=307 Win=42496 Len=30 TSval=4221951030 TSecr=768774217 [TCP segment of a reassembled PDU]
25	8.988938	10.0.1.2	10.0.1.5	TCP	117	9999 → 38882 [PSH, ACK] Seq=307 Ack=211 Win=43520 Len=51 TSval=768775219 TSecr=4221951030 [TCP segment of a reassembled PDU]
26	8.988942	10.0.1.5	10.0.1.2	TCP	66	38882 → 9999 [ACK] Seq=211 Ack=358 Win=42496 Len=0 TSval=4221951030 TSecr=768775219
27	9.990236	10.0.1.5	10.0.1.2	TCP	96	38882 → 9999 [PSH, ACK] Seq=211 Ack=358 Win=42496 Len=30 TSval=4221952031 TSecr=768775219 [TCP segment of a reassembled PDU]
28	9.990766	10.0.1.2	10.0.1.5	TCP	117	9999 → 38882 [PSH, ACK] Seq=358 Ack=241 Win=43520 Len=51 TSval=768776221 TSecr=4221952031 [TCP segment of a reassembled PDU]
29	9.990781	10.0.1.5	10.0.1.2	TCP	66	38882 → 9999 [ACK] Seq=241 Ack=409 Win=42496 Len=0 TSval=4221952032 TSecr=768776221
30	10.993248	10.0.1.5	10.0.1.2	TCP	96	38882 → 9999 [PSH, ACK] Seq=241 Ack=409 Win=42496 Len=30 TSval=4221953034 TSecr=768776221 [TCP segment of a reassembled PDU]
31	10.994394	10.0.1.2	10.0.1.5	TCP	117	9999 → 38882 [PSH, ACK] Seq=409 Ack=271 Win=43520 Len=51 TSval=768777224 TSecr=4221953034 [TCP segment of a reassembled PDU]
32	10.994411	10.0.1.5	10.0.1.2	TCP	66	38882 → 9999 [ACK] Seq=271 Ack=460 Win=42496 Len=0 TSval=4221953035 TSecr=768777224
33	11.996186	10.0.1.5	10.0.1.2	TCP	96	38882 → 9999 [PSH, ACK] Seq=271 Ack=460 Win=42496 Len=30 TSval=4221954037 TSecr=768777224 [TCP segment of a reassembled PDU]
34	11.996699	10.0.1.2	10.0.1.5	TCP	117	9999 → 38882 [PSH, ACK] Seq=460 Ack=301 Win=43520 Len=51 TSval=768778227 TSecr=4221954037 [TCP segment of a reassembled PDU]
35	11.996716	10.0.1.5	10.0.1.2	TCP	66	38882 → 9999 [ACK] Seq=301 Ack=511 Win=42496 Len=0 TSval=4221954038 TSecr=768778227
36	12.997632	10.0.1.5	10.0.1.2	TCP	97	38882 → 9999 [PSH, ACK] Seq=301 Ack=511 Win=42496 Len=31 TSval=4221955039 TSecr=768778227 [TCP segment of a reassembled PDU]
37	12.997890	10.0.1.2	10.0.1.5	TCP	117	9999 → 38882 [PSH, ACK] Seq=511 Ack=332 Win=43520 Len=51 TSval=768779228 TSecr=4221955039 [TCP segment of a reassembled PDU]
38	12.997897	10.0.1.5	10.0.1.2	TCP	66	38882 → 9999 [ACK] Seq=332 Ack=562 Win=42496 Len=0 TSval=4221955039 TSecr=768779228
39	13.999363	10.0.1.5	10.0.1.2	TCP	97	38882 → 9999 [PSH, ACK] Seq=332 Ack=562 Win=42496 Len=31 TSval=4221956040 TSecr=768779228 [TCP segment of a reassembled PDU]
40	13.999890	10.0.1.2	10.0.1.5	TCP	117	9999 → 38882 [PSH, ACK] Seq=562 Ack=363 Win=43520 Len=51 TSval=768780230 TSecr=4221956040 [TCP segment of a reassembled PDU]
41	13.999909	10.0.1.5	10.0.1.2	TCP	66	38882 → 9999 [ACK] Seq=363 Ack=613 Win=42496 Len=0 TSval=4221956041 TSecr=768780230
42	15.001961	10.0.1.5	10.0.1.2	TCP	97	38882 → 9999 [PSH, ACK] Seq=363 Ack=613 Win=42496 Len=31 TSval=4221957043 TSecr=768780230 [TCP segment of a reassembled PDU]
43	15.002331	10.0.1.2	10.0.1.5	TCP	117	9999 → 38882 [PSH, ACK] Seq=613 Ack=394 Win=43520 Len=51 TSval=768781232 TSecr=4221957043 [TCP segment of a reassembled PDU]
44	15.002344	10.0.1.5	10.0.1.2	TCP	66	38882 → 9999 [ACK] Seq=394 Ack=664 Win=42496 Len=0 TSval=4221957043 TSecr=768781232
45	16.004037	10.0.1.5	10.0.1.2	TCP	97	38882 → 9999 [PSH, ACK] Seq=394 Ack=664 Win=42496 Len=31 TSval=4221958045 TSecr=768781232 [TCP segment of a reassembled PDU]
46	16.004680	10.0.1.2	10.0.1.5	TCP	117	9999 → 38882 [PSH, ACK] Seq=664 Ack=425 Win=43520 Len=51 TSval=768782235 TSecr=4221958045 [TCP segment of a reassembled PDU]
47	16.004699	10.0.1.5	10.0.1.2	TCP	66	38882 → 9999 [ACK] Seq=425 Ack=715 Win=42496 Len=0 TSval=4221958046 TSecr=768782235
48	17.006689	10.0.1.5	10.0.1.2	TCP	97	38882 → 9999 [PSH, ACK] Seq=425 Ack=715 Win=42496 Len=31 TSval=4221959048 TSecr=768782235 [TCP segment of a reassembled PDU]
49	17.007266	10.0.1.2	10.0.1.5	TCP	117	9999 → 38882 [PSH, ACK] Seq=715 Ack=456 Win=43520 Len=51 TSval=768783237 TSecr=4221959048 [TCP segment of a reassembled PDU]
50	17.007271	10.0.1.5	10.0.1.2	TCP	66	38882 → 9999 [ACK] Seq=456 Ack=766 Win=42496 Len=0 TSval=4221959048 TSecr=768783237
51	18.008944	10.0.1.5	10.0.1.2	TCP	97	38882 → 9999 [PSH, ACK] Seq=456 Ack=766 Win=42496 Len=31 TSval=4221960050 TSecr=768783237 [TCP segment of a reassembled PDU]
52	18.009372	10.0.1.2	10.0.1.5	TCP	117	9999 → 38882 [PSH, ACK] Seq=766 Ack=487 Win=43520 Len=51 TSval=768784239 TSecr=4221960050 [TCP segment of a reassembled PDU]
53	18.009387	10.0.1.5	10.0.1.2	TCP	66	38882 → 9999 [ACK] Seq=487 Ack=817 Win=42496 Len=0 TSval=4221960050 TSecr=768784239
54	19.011140	10.0.1.5	10.0.1.2	TCP	97	38882 → 9999 [PSH, ACK] Seq=487 Ack=817 Win=42496 Len=31 TSval=4221961052 TSecr=768784239 [TCP segment of a reassembled PDU]
55	19.011637	10.0.1.2	10.0.1.5	TCP	117	9999 → 38882 [PSH, ACK] Seq=817 Ack=518 Win=43520 Len=51 TSval=768785242 TSecr=4221961052 [TCP segment of a reassembled PDU]
56	19.011651	10.0.1.5	10.0.1.2	TCP	66	38882 → 9999 [ACK] Seq=518 Ack=868 Win=42496 Len=0 TSval=4221961053 TSecr=768785242
57	20.013530	10.0.1.5	10.0.1.2	TCP	97	38882 → 9999 [PSH, ACK] Seq=518 Ack=868 Win=42496 Len=31 TSval=4221962055 TSecr=768785242 [TCP segment of a reassembled PDU]
58	20.013965	10.0.1.2	10.0.1.5	TCP	117	9999 → 38882 [PSH, ACK] Seq=868 Ack=549 Win=43520 Len=51 TSval=768786244 TSecr=4221962055 [TCP segment of a reassembled PDU]
59	20.013974	10.0.1.5	10.0.1.2	TCP	66	38882 → 9999 [ACK] Seq=549 Ack=919 Win=42496 Len=0 TSval=4221962055 TSecr=768786244
60	21.015869	10.0.1.5	10.0.1.2	TCP	97	38882 → 9999 [PSH, ACK] Seq=549 Ack=919 Win=42496 Len=31 TSval=4221963057 TSecr=768786244 [TCP segment of a reassembled PDU]
61	21.015989	10.0.1.2	10.0.1.5	TCP	117	9999 → 38882 [PSH, ACK] Seq=919 Ack=580 Win=43520 Len=51 TSval=768787246 TSecr=4221963057 [TCP segment of a reassembled PDU]
62	21.015996	10.0.1.5	10.0.1.2	TCP	66	38882 → 9999 [ACK] Seq=580 Ack=970 Win=42496 Len=0 TSval=4221963057 TSecr=768787246
63	22.016710	10.0.1.5	10.0.1.2	TCP	97	38882 → 9999 [PSH, ACK] Seq=580 Ack=970 Win=42496 Len=31 TSval=4221964058 TSecr=768787246 [TCP segment of a reassembled PDU]
64	22.017268	10.0.1.2	10.0.1.5	TCP	117	9999 → 38882 [PSH, ACK] Seq=970 Ack=611 Win=43520 Len=51 TSval=768788247 TSecr=4221964058 [TCP segment of a reassembled PDU]
65	22.017276	10.0.1.5	10.0.1.2	TCP	66	38882 → 9999 [ACK] Seq=611 Ack=1021 Win=42496 Len=0 TSval=4221964058 TSecr=768788247
66	23.018780	10.0.1.5	10.0.1.2	TCP	97	38882 → 9999 [PSH, ACK] Seq=611 Ack=1021 Win=42496 Len=31 TSval=4221965060 TSecr=768788247 [TCP segment of a reassembled PDU]
67	23.019920	10.0.1.2	10.0.1.5	TCP	117	9999 → 38882 [PSH, ACK] Seq=1021 Ack=642 Win=43520 Len=51 TSval=768789250 TSecr=4221965060 [TCP segment of a reassembled PDU]
68	23.019933	10.0.1.5	10.0.1.2	TCP	66	38882 → 9999 [ACK] Seq=642 Ack=1072 Win=42496 Len=0 TSval=4221965061 TSecr=768789250
69	24.021681	10.0.1.5	10.0.1.2	TCP	97	38882 → 9999 [PSH, ACK] Seq=642 Ack=1072 Win=42496 Len=31 TSval=4221966063 TSecr=768789250 [TCP segment of a reassembled PDU]
70	24.021884	10.0.1.2	10.0.1.5	TCP	117	9999 → 38882 [PSH, ACK] Seq=1072 Ack=673 Win=43520 Len=51 TSval=768790252 TSecr=4221966063 [TCP segment of a reassembled PDU]
71	24.021891	10.0.1.5	10.0.1.2	TCP	66	38882 → 9999 [ACK] Seq=673 Ack=1123 Win=42496 Len=0 TSval=4221966063 TSecr=768790252
72	25.024068	10.0.1.5	10.0.1.2	TCP	97	38882 → 9999 [PSH, ACK] Seq=673 Ack=1123 Win=42496 Len=31 TSval=4221967065 TSecr=768790252 [TCP segment of a reassembled PDU]
73	25.024319	10.0.1.2	10.0.1.5	TCP	117	9999 → 38882 [PSH, ACK] Seq=1123 Ack=704 Win=43520 Len=51 TSval=768791254 TSecr=4221967065 [TCP segment of a reassembled PDU]
74	25.024325	10.0.1.5	10.0.1.2	TCP	66	38882 → 9999 [ACK] Seq=704 Ack=1174 Win=42496 Len=0 TSval=4221967065 TSecr=768791254
75	26.026372	10.0.1.5	10.0.1.2	TCP	97	38882 → 9999 [PSH, ACK] Seq=704 Ack=1174 Win=42496 Len=31 TSval=4221968067 TSecr=768791254 [TCP segment of a reassembled PDU]
76	26.027408	10.0.1.2	10.0.1.5	TCP	117	9999 → 38882 [PSH, ACK] Seq=1174 Ack=735 Win=43520 Len=51 TSval=768792257 TSecr=4221968067 [TCP segment of a reassembled PDU]
77	26.027429	10.0.1.5	10.0.1.2	TCP	66	38882 → 9999 [ACK] Seq=735 Ack=1225 Win=42496 Len=0 TSval=4221968068 TSecr=768792257
78	27.029077	10.0.1.5	10.0.1.2	TCP	97	38882 → 9999 [PSH, ACK] Seq=735 Ack=1225 Win=42496 Len=31 TSval=4221969070 TSecr=768792257 [TCP segment of a reassembled PDU]
79	27.030164	10.0.1.2	10.0.1.5	TCP	117	9999 → 38882 [PSH, ACK] Seq=1225 Ack=766 Win=43520 Len=51 TSval=768793260 TSecr=4221969070 [TCP segment of a reassembled PDU]
80	27.030170	10.0.1.5	10.0.1.2	TCP	66	38882 → 9999 [ACK] Seq=766 Ack=1276 Win=42496 Len=0 TSval=4221969071 TSecr=768793260
81	28.032757	10.0.1.5	10.0.1.2	TCP	97	38882 → 9999 [PSH, ACK] Seq=766 Ack=1276 Win=42496 Len=31 TSval=4221970074 TSecr=768793260 [TCP segment of a reassembled PDU]
82	28.033240	10.0.1.2	10.0.1.5	TCP	117	9999 → 38882 [PSH, ACK] Seq=1276 Ack=797 Win=43520 Len=51 TSval=768794263 TSecr=4221970074 [TCP segment of a reassembled PDU]
83	28.033250	10.0.1.5	10.0.1.2	TCP	66	38882 → 9999 [ACK] Seq=797 Ack=1327 Win=42496 Len=0 TSval=4221970074 TSecr=768794263
84	29.035399	10.0.1.5	10.0.1.2	TCP	97	38882 → 9999 [PSH, ACK] Seq=797 Ack=1327 Win=42496 Len=31 TSval=4221971076 TSecr=768794263 [TCP segment of a reassembled PDU]
85	29.035685	10.0.1.2	10.0.1.5	TCP	117	9999 → 38882 [PSH, ACK] Seq=1327 Ack=828 Win=43520 Len=51 TSval=768795266 TSecr=4221971076 [TCP segment of a reassembled PDU]
86	29.035695	10.0.1.5	10.0.1.2	TCP	66	38882 → 9999 [ACK] Seq=828 Ack=1378 Win=42496 Len=0 TSval=4221971077 TSecr=768795266
87	30.039043	10.0.1.5	10.0.1.2	TCP	97	38882 → 9999 [PSH, ACK] Seq=828 Ack=1378 Win=42496 Len=31 TSval=4221972080 TSecr=768795266 [TCP segment of a reassembled PDU]
88	30.039217	10.0.1.2	10.0.1.5	TCP	117	9999 → 38882 [PSH, ACK] Seq=1378 Ack=859 Win=43520 Len=51 TSval=768796269 TSecr=4221972080 [TCP segment of a reassembled PDU]
89	30.039226	10.0.1.5	10.0.1.2	TCP	66	38882 → 9999 [ACK] Seq=859 Ack=1429 Win=42496 Len=0 TSval=4221972080 TSecr=768796269
90	31.040658	10.0.1.5	10.0.1.2	TCP	97	38882 → 9999 [PSH, ACK] Seq=859 Ack=1429 Win=42496 Len=31 TSval=4221973082 TSecr=768796269 [TCP segment of a reassembled PDU]
91	31.040811	10.0.1.2	10.0.1.5	TCP	117	9999 → 38882 [PSH, ACK] Seq=1429 Ack=890 Win=43520 Len=51 TSval=768797271 TSecr=4221973082 [TCP segment of a reassembled PDU]
92	31.040821	10.0.1.5	10.0.1.2	TCP	66	38882 → 9999 [ACK] Seq=890 Ack=1480 Win=42496 Len=0 TSval=4221973082 TSecr=768797271
93	32.043220	10.0.1.5	10.0.1.2	TCP	97	38882 → 9999 [PSH, ACK] Seq=890 Ack=1480 Win=42496 Len=31 TSval=4221974084 TSecr=768797271 [TCP segment of a reassembled PDU]
94	32.043627	10.0.1.2	10.0.1.5	TCP	117	9999 → 38882 [PSH, ACK] Seq=1480 Ack=921 Win=43520 Len=51 TSval=768798274 TSecr=4221974084 [TCP segment of a reassembled PDU]
95	32.043636	10.0.1.5	10.0.1.2	TCP	66	38882 → 9999 [ACK] Seq=921 Ack=1531 Win=42496 Len=0 TSval=4221974085 TSecr=768798274
96	33.047832	10.0.1.5	10.0.1.2	TCP	97	38882 → 9999 [PSH, ACK] Seq=921 Ack=1531 Win=42496 Len=31 TSval=4221975089 TSecr=768798274 [TCP segment of a reassembled PDU]
97	33.048066	10.0.1.2	10.0.1.5	TCP	117	9999 → 38882 [PSH, ACK] Seq=1531 Ack=952 Win=43520 Len=51 TSval=768799278 TSecr=4221975089 [TCP segment of a reassembled PDU]
98	33.048076	10.0.1.5	10.0.1.2	TCP	66	38882 → 9999 [ACK] Seq=952 Ack=1582 Win=42496 Len=0 TSval=4221975089 TSecr=768799278
99	34.049823	10.0.1.5	10.0.1.2	TCP	97	38882 → 9999 [PSH, ACK] Seq=952 Ack=1582 Win=42496 Len=31 TSval=4221976091 TSecr=768799278 [TCP segment of a reassembled PDU]
100	34.050049	10.0.1.2	10.0.1.5	TCP	117	9999 → 38882 [PSH, ACK] Seq=1582 Ack=983 Win=43520 Len=51 TSval=768800280 TSecr=4221976091 [TCP segment of a reassembled PDU]
101	34.050062	10.0.1.5	10.0.1.2	TCP	66	38882 → 9999 [ACK] Seq=983 Ack=1633 Win=42496 Len=0 TSval=4221976091 TSecr=768800280
102	35.051648	10.0.1.5	10.0.1.2	TCP	97	38882 → 9999 [PSH, ACK] Seq=983 Ack=1633 Win=42496 Len=31 TSval=4221977093 TSecr=768800280 [TCP segment of a reassembled PDU]
103	35.051917	10.0.1.2	10.0.1.5	TCP	117	9999 → 38882 [PSH, ACK] Seq=1633 Ack=1014 Win=43520 Len=51 TSval=768801282 TSecr=4221977093 [TCP segment of a reassembled PDU]
104	35.051931	10.0.1.5	10.0.1.2	TCP	66	38882 → 9999 [ACK] Seq=1014 Ack=1684 Win=42496 Len=0 TSval=4221977093 TSecr=768801282
105	36.053652	10.0.1.5	10.0.1.2	TCP	97	38882 → 9999 [PSH, ACK] Seq=1014 Ack=1684 Win=42496 Len=31 TSval=4221978095 TSecr=768801282 [TCP segment of a reassembled PDU]
106	36.053927	10.0.1.2	10.0.1.5	TCP	117	9999 → 38882 [PSH, ACK] Seq=1684 Ack=1045 Win=43520 Len=51 TSval=768802284 TSecr=4221978095 [TCP segment of a reassembled PDU]
107	36.053941	10.0.1.5	10.0.1.2	TCP	66	38882 → 9999 [ACK] Seq=1045 Ack=1735 Win=42496 Len=0 TSval=4221978095 TSecr=768802284
108	37.056456	10.0.1.5	10.0.1.2	TCP	97	38882 → 9999 [PSH, ACK] Seq=1045 Ack=1735 Win=42496 Len=31 TSval=4221979097 TSecr=768802284 [TCP segment of a reassembled PDU]
109	37.056829	10.0.1.2	10.0.1.5	TCP	117	9999 → 38882 [PSH, ACK] Seq=1735 Ack=1076 Win=43520 Len=51 TSval=768803287 TSecr=4221979097 [TCP segment of a reassembled PDU]
110	37.056846	10.0.1.5	10.0.1.2	TCP	66	38882 → 9999 [ACK] Seq=1076 Ack=1786 Win=42496 Len=0 TSval=4221979098 TSecr=768803287
111	38.058564	10.0.1.5	10.0.1.2	TCP	97	38882 → 9999 [PSH, ACK] Seq=1076 Ack=1786 Win=42496 Len=31 TSval=4221980099 TSecr=768803287 [TCP segment of a reassembled PDU]
112	38.060155	10.0.1.2	10.0.1.5	TCP	117	9999 → 38882 [PSH, ACK] Seq=1786 Ack=1107 Win=43520 Len=51 TSval=768804290 TSecr=4221980099 [TCP segment of a reassembled PDU]
113	38.060175	10.0.1.5	10.0.1.2	TCP	66	38882 → 9999 [ACK] Seq=1107 Ack=1837 Win=42496 Len=0 TSval=4221980101 TSecr=768804290
114	39.061929	10.0.1.5	10.0.1.2	TCP	97	38882 → 9999 [PSH, ACK] Seq=1107 Ack=1837 Win=42496 Len=31 TSval=4221981103 TSecr=768804290 [TCP segment of a reassembled PDU]
115	39.062238	10.0.1.2	10.0.1.5	TCP	117	9999 → 38882 [PSH, ACK] Seq=1837 Ack=1138 Win=43520 Len=51 TSval=768805292 TSecr=4221981103 [TCP segment of a reassembled PDU]
116	39.062250	10.0.1.5	10.0.1.2	TCP	66	38882 → 9999 [ACK] Seq=1138 Ack=1888 Win=42496 Len=0 TSval=4221981103 TSecr=768805292
117	40.064905	10.0.1.5	10.0.1.2	TCP	97	38882 → 9999 [PSH, ACK] Seq=1138 Ack=1888 Win=42496 Len=31 TSval=4221982106 TSecr=768805292 [TCP segment of a reassembled PDU]
118	40.064985	10.0.1.2	10.0.1.5	TCP	117	9999 → 38882 [PSH, ACK] Seq=1888 Ack=1169 Win=43520 Len=51 TSval=768806295 TSecr=4221982106 [TCP segment of a reassembled PDU]
119	40.064989	10.0.1.5	10.0.1.2	TCP	66	38882 → 9999 [ACK] Seq=1169 Ack=1939 Win=42496 Len=0 TSval=4221982106 TSecr=768806295
120	41.066606	10.0.1.5	10.0.1.2	TCP	97	38882 → 9999 [PSH, ACK] Seq=1169 Ack=1939 Win=42496 Len=31 TSval=4221983108 TSecr=768806295 [TCP segment of a reassembled PDU]
121	41.066859	10.0.1.2	10.0.1.5	TCP	117	9999 → 38882 [PSH, ACK] Seq=1939 Ack=1200 Win=43520 Len=51 TSval=768807297 TSecr=4221983108 [TCP segment of a reassembled PDU]
122	41.066870	10.0.1.5	10.0.1.2	TCP	66	38882 → 9999 [ACK] Seq=1200 Ack=1990 Win=42496 Len=0 TSval=4221983108 TSecr=768807297
123	42.068765	10.0.1.5	10.0.1.2	TCP	97	38882 → 9999 [PSH, ACK] Seq=1200 Ack=1990 Win=42496 Len=31 TSval=4221984110 TSecr=768807297 [TCP segment of a reassembled PDU]
124	42.069078	10.0.1.2	10.0.1.5	TCP	117	9999 → 38882 [PSH, ACK] Seq=1990 Ack=1231 Win=43520 Len=51 TSval=768808299 TSecr=4221984110 [TCP segment of a reassembled PDU]
125	42.069091	10.0.1.5	10.0.1.2	TCP	66	38882 → 9999 [ACK] Seq=1231 Ack=2041 Win=42496 Len=0 TSval=4221984110 TSecr=768808299
126	43.070218	10.0.1.5	10.0.1.2	TCP	97	38882 → 9999 [PSH, ACK] Seq=1231 Ack=2041 Win=42496 Len=31 TSval=4221985111 TSecr=768808299 [TCP segment of a reassembled PDU]
127	43.070394	10.0.1.2	10.0.1.5	TCP	117	9999 → 38882 [PSH, ACK] Seq=2041 Ack=1262 Win=43520 Len=51 TSval=768809300 TSecr=4221985111 [TCP segment of a reassembled PDU]
128	43.070401	10.0.1.5	10.0.1.2	TCP	66	38882 → 9999 [ACK] Seq=1262 Ack=2092 Win=42496 Len=0 TSval=4221985111 TSecr=768809300
129	43.745229	10.0.1.2	10.0.1.5	TCP	66	9999 → 38882 [FIN, ACK] Seq=2092 Ack=1262 Win=43520 Len=0 TSval=768809975 TSecr=4221985111
130	43.786015	10.0.1.5	10.0.1.2	TCP	66	38882 → 9999 [ACK] Seq=1262 Ack=2093 Win=42496 Len=0 TSval=4221985827 TSecr=768809975
131	44.072197	10.0.1.5	10.0.1.2	TCP	97	38882 → 9999 [PSH, ACK] Seq=1262 Ack=2093 Win=42496 Len=31 TSval=4221986113 TSecr=768809975 [TCP segment of a reassembled PDU]
132	44.072240	10.0.1.2	10.0.1.5	TCP	54	9999 → 38882 [RST] Seq=2093 Win=0 Len=0