1	0.000000	10.0.1.5	10.0.1.2	TCP	74	52884 → 9999 [SYN] Seq=0 Win=42340 Len=0 MSS=1460 SACK_PERM=1 TSval=4217050727 TSecr=0 WS=512
2	0.002767	10.0.1.2	10.0.1.5	TCP	74	9999 → 52884 [SYN, ACK] Seq=0 Ack=1 Win=43440 Len=0 MSS=1460 SACK_PERM=1 TSval=763874918 TSecr=4217050727 WS=512
3	0.002786	10.0.1.5	10.0.1.2	TCP	66	52884 → 9999 [ACK] Seq=1 Ack=1 Win=42496 Len=0 TSval=4217050730 TSecr=763874918
4	0.002825	10.0.1.5	10.0.1.2	TCP	96	52884 → 9999 [PSH, ACK] Seq=1 Ack=1 Win=42496 Len=30 TSval=4217050730 TSecr=763874918 [TCP segment of a reassembled PDU]
5	0.004088	10.0.1.2	10.0.1.5	TCP	66	9999 → 52884 [ACK] Seq=1 Ack=31 Win=43520 Len=0 TSval=763874919 TSecr=4217050730
6	0.004111	10.0.1.2	10.0.1.5	TCP	66	[TCP Dup ACK 5#1] 9999 → 52884 [ACK] Seq=1 Ack=31 Win=43520 Len=0 TSval=763874919 TSecr=4217050730
7	0.004457	10.0.1.2	10.0.1.5	TCP	117	9999 → 52884 [PSH, ACK] Seq=1 Ack=31 Win=43520 Len=51 TSval=763874919 TSecr=4217050730 [TCP segment of a reassembled PDU]
8	0.004477	10.0.1.5	10.0.1.2	TCP	66	52884 → 9999 [ACK] Seq=31 Ack=52 Win=42496 Len=0 TSval=4217050731 TSecr=763874919
9	1.005724	10.0.1.5	10.0.1.2	TCP	96	52884 → 9999 [PSH, ACK] Seq=31 Ack=52 Win=42496 Len=30 TSval=4217051733 TSecr=763874919 [TCP segment of a reassembled PDU]
10	1.006192	10.0.1.2	10.0.1.5	TCP	117	9999 → 52884 [PSH, ACK] Seq=52 Ack=61 Win=43520 Len=51 TSval=763875922 TSecr=4217051733 [TCP segment of a reassembled PDU]
11	1.006200	10.0.1.5	10.0.1.2	TCP	66	52884 → 9999 [ACK] Seq=61 Ack=103 Win=42496 Len=0 TSval=4217051733 TSecr=763875922
12	2.007522	10.0.1.5	10.0.1.2	TCP	96	52884 → 9999 [PSH, ACK] Seq=61 Ack=103 Win=42496 Len=30 TSval=4217052734 TSecr=763875922 [TCP segment of a reassembled PDU]
13	2.007916	10.0.1.2	10.0.1.5	TCP	117	9999 → 52884 [PSH, ACK] Seq=103 Ack=91 Win=43520 Len=51 TSval=763876924 TSecr=4217052734 [TCP segment of a reassembled PDU]
14	2.007928	10.0.1.5	10.0.1.2	TCP	66	52884 → 9999 [ACK] Seq=91 Ack=154 Win=42496 Len=0 TSval=4217052735 TSecr=763876924
15	3.009701	10.0.1.5	10.0.1.2	TCP	96	52884 → 9999 [PSH, ACK] Seq=91 Ack=154 Win=42496 Len=30 TSval=4217053737 TSecr=763876924 [TCP segment of a reassembled PDU]
16	3.009848	10.0.1.2	10.0.1.5	TCP	117	9999 → 52884 [PSH, ACK] Seq=154 Ack=121 Win=43520 Len=51 TSval=763877926 TSecr=4217053737 [TCP segment of a reassembled PDU]
17	3.009855	10.0.1.5	10.0.1.2	TCP	66	52884 → 9999 [ACK] Seq=121 Ack=205 Win=42496 Len=0 TSval=4217053737 TSecr=763877926
18	4.011177	10.0.1.5	10.0.1.2	TCP	96	52884 → 9999 [PSH, ACK] Seq=121 Ack=205 Win=42496 Len=30 TSval=4217054738 TSecr=763877926 [TCP segment of a reassembled PDU]
19	4.011422	10.0.1.2	10.0.1.5	TCP	117	9999 → 52884 [PSH, ACK] Seq=205 Ack=151 Win=43520 Len=51 TSval=763878927 TSecr=4217054738 [TCP segment of a reassembled PDU]
20	4.011428	10.0.1.5	10.0.1.2	TCP	66	52884 → 9999 [ACK] Seq=151 Ack=256 Win=42496 Len=0 TSval=4217054738 TSecr=763878927
21	5.012745	10.0.1.5	10.0.1.2	TCP	96	52884 → 9999 [PSH, ACK] Seq=151 Ack=256 Win=42496 Len=30 TSval=4217055740 TSecr=763878927 [TCP segment of a reassembled PDU]
22	5.012987	10.0.1.2	10.0.1.5	TCP	117	9999 → 52884 [PSH, ACK] Seq=256 Ack=181 Win=43520 Len=51 TSval=763879929 TSecr=4217055740 [TCP segment of a reassembled PDU]
23	5.012992	10.0.1.5	10.0.1.2	TCP	66	52884 → 9999 [ACK] Seq=181 Ack=307 Win=42496 Len=0 TSval=4217055740 TSecr=763879929
24	6.014195	10.0.1.5	10.0.1.2	TCP	96	52884 → 9999 [PSH, ACK] Seq=181 Ack=307 Win=42496 Len=30 TSval=4217056741 TSecr=763879929 [TCP segment of a reassembled PDU]
25	6.014338	10.0.1.2	10.0.1.5	TCP	117	9999 → 52884 [PSH, ACK] Seq=307 Ack=211 Win=43520 Len=51 TSval=763880930 TSecr=4217056741 [TCP segment of a reassembled PDU]
26	6.014345	10.0.1.5	10.0.1.2	TCP	66	52884 → 9999 [ACK] Seq=211 Ack=358 Win=42496 Len=0 TSval=4217056741 TSecr=763880930
27	7.015885	10.0.1.5	10.0.1.2	TCP	96	52884 → 9999 [PSH, ACK] Seq=211 Ack=358 Win=42496 Len=30 TSval=4217057743 TSecr=763880930 [TCP segment of a reassembled PDU]
28	7.016037	10.0.1.2	10.0.1.5	TCP	117	9999 → 52884 [PSH, ACK] Seq=358 Ack=241 Win=43520 Len=51 TSval=763881932 TSecr=4217057743 [TCP segment of a reassembled PDU]
29	7.016042	10.0.1.5	10.0.1.2	TCP	66	52884 → 9999 [ACK] Seq=241 Ack=409 Win=42496 Len=0 TSval=4217057743 TSecr=763881932
30	8.017463	10.0.1.5	10.0.1.2	TCP	96	52884 → 9999 [PSH, ACK] Seq=241 Ack=409 Win=42496 Len=30 TSval=4217058744 TSecr=763881932 [TCP segment of a reassembled PDU]
31	8.018161	10.0.1.2	10.0.1.5	TCP	117	9999 → 52884 [PSH, ACK] Seq=409 Ack=271 Win=43520 Len=51 TSval=763882934 TSecr=4217058744 [TCP segment of a reassembled PDU]
32	8.018173	10.0.1.5	10.0.1.2	TCP	66	52884 → 9999 [ACK] Seq=271 Ack=460 Win=42496 Len=0 TSval=4217058745 TSecr=763882934
33	9.020018	10.0.1.5	10.0.1.2	TCP	96	52884 → 9999 [PSH, ACK] Seq=271 Ack=460 Win=42496 Len=30 TSval=4217059747 TSecr=763882934 [TCP segment of a reassembled PDU]
34	9.020278	10.0.1.2	10.0.1.5	TCP	117	9999 → 52884 [PSH, ACK] Seq=460 Ack=301 Win=43520 Len=51 TSval=763883936 TSecr=4217059747 [TCP segment of a reassembled PDU]
35	9.020289	10.0.1.5	10.0.1.2	TCP	66	52884 → 9999 [ACK] Seq=301 Ack=511 Win=42496 Len=0 TSval=4217059747 TSecr=763883936
36	10.021699	10.0.1.5	10.0.1.2	TCP	97	52884 → 9999 [PSH, ACK] Seq=301 Ack=511 Win=42496 Len=31 TSval=4217060749 TSecr=763883936 [TCP segment of a reassembled PDU]
37	10.021843	10.0.1.2	10.0.1.5	TCP	117	9999 → 52884 [PSH, ACK] Seq=511 Ack=332 Win=43520 Len=51 TSval=763884938 TSecr=4217060749 [TCP segment of a reassembled PDU]
38	10.021849	10.0.1.5	10.0.1.2	TCP	66	52884 → 9999 [ACK] Seq=332 Ack=562 Win=42496 Len=0 TSval=4217060749 TSecr=763884938
39	11.023219	10.0.1.5	10.0.1.2	TCP	97	52884 → 9999 [PSH, ACK] Seq=332 Ack=562 Win=42496 Len=31 TSval=4217061750 TSecr=763884938 [TCP segment of a reassembled PDU]
40	11.023772	10.0.1.2	10.0.1.5	TCP	117	9999 → 52884 [PSH, ACK] Seq=562 Ack=363 Win=43520 Len=51 TSval=763885940 TSecr=4217061750 [TCP segment of a reassembled PDU]
41	11.023780	10.0.1.5	10.0.1.2	TCP	66	52884 → 9999 [ACK] Seq=363 Ack=613 Win=42496 Len=0 TSval=4217061751 TSecr=763885940
42	12.025422	10.0.1.5	10.0.1.2	TCP	97	52884 → 9999 [PSH, ACK] Seq=363 Ack=613 Win=42496 Len=31 TSval=4217062752 TSecr=763885940 [TCP segment of a reassembled PDU]
43	12.025603	10.0.1.2	10.0.1.5	TCP	117	9999 → 52884 [PSH, ACK] Seq=613 Ack=394 Win=43520 Len=51 TSval=763886942 TSecr=4217062752 [TCP segment of a reassembled PDU]
44	12.025611	10.0.1.5	10.0.1.2	TCP	66	52884 → 9999 [ACK] Seq=394 Ack=664 Win=42496 Len=0 TSval=4217062753 TSecr=763886942
45	13.026774	10.0.1.5	10.0.1.2	TCP	97	52884 → 9999 [PSH, ACK] Seq=394 Ack=664 Win=42496 Len=31 TSval=4217063754 TSecr=763886942 [TCP segment of a reassembled PDU]
46	13.026932	10.0.1.2	10.0.1.5	TCP	117	9999 → 52884 [PSH, ACK] Seq=664 Ack=425 Win=43520 Len=51 TSval=763887943 TSecr=4217063754 [TCP segment of a reassembled PDU]
47	13.026938	10.0.1.5	10.0.1.2	TCP	66	52884 → 9999 [ACK] Seq=425 Ack=715 Win=42496 Len=0 TSval=4217063754 TSecr=763887943
48	14.028067	10.0.1.5	10.0.1.2	TCP	97	52884 → 9999 [PSH, ACK] Seq=425 Ack=715 Win=42496 Len=31 TSval=4217064755 TSecr=763887943 [TCP segment of a reassembled PDU]
49	14.028288	10.0.1.2	10.0.1.5	TCP	117	9999 → 52884 [PSH, ACK] Seq=715 Ack=456 Win=43520 Len=51 TSval=763888944 TSecr=4217064755 [TCP segment of a reassembled PDU]
50	14.028294	10.0.1.5	10.0.1.2	TCP	66	52884 → 9999 [ACK] Seq=456 Ack=766 Win=42496 Len=0 TSval=4217064755 TSecr=763888944
51	15.029483	10.0.1.5	10.0.1.2	TCP	97	52884 → 9999 [PSH, ACK] Seq=456 Ack=766 Win=42496 Len=31 TSval=4217065756 TSecr=763888944 [TCP segment of a reassembled PDU]
52	15.029935	10.0.1.2	10.0.1.5	TCP	117	9999 → 52884 [PSH, ACK] Seq=766 Ack=487 Win=43520 Len=51 TSval=763889946 TSecr=4217065756 [TCP segment of a reassembled PDU]
53	15.029947	10.0.1.5	10.0.1.2	TCP	66	52884 → 9999 [ACK] Seq=487 Ack=817 Win=42496 Len=0 TSval=4217065757 TSecr=763889946
54	16.031424	10.0.1.5	10.0.1.2	TCP	97	52884 → 9999 [PSH, ACK] Seq=487 Ack=817 Win=42496 Len=31 TSval=4217066758 TSecr=763889946 [TCP segment of a reassembled PDU]
55	16.031597	10.0.1.2	10.0.1.5	TCP	117	9999 → 52884 [PSH, ACK] Seq=817 Ack=518 Win=43520 Len=51 TSval=763890948 TSecr=4217066758 [TCP segment of a reassembled PDU]
56	16.031607	10.0.1.5	10.0.1.2	TCP	66	52884 → 9999 [ACK] Seq=518 Ack=868 Win=42496 Len=0 TSval=4217066759 TSecr=763890948