1	0.000000	10.0.1.5	10.0.1.2	TCP	74	45158 → 9999 [SYN] Seq=0 Win=42340 Len=0 MSS=1460 SACK_PERM=1 TSval=4222638047 TSecr=0 WS=512
2	0.002663	10.0.1.2	10.0.1.5	TCP	74	9999 → 45158 [SYN, ACK] Seq=0 Ack=1 Win=43440 Len=0 MSS=1460 SACK_PERM=1 TSval=769462237 TSecr=4222638047 WS=512
3	0.002689	10.0.1.5	10.0.1.2	TCP	66	45158 → 9999 [ACK] Seq=1 Ack=1 Win=42496 Len=0 TSval=4222638049 TSecr=769462237
4	0.002773	10.0.1.5	10.0.1.2	TCP	96	45158 → 9999 [PSH, ACK] Seq=1 Ack=1 Win=42496 Len=30 TSval=4222638050 TSecr=769462237 [TCP segment of a reassembled PDU]
5	0.003938	10.0.1.2	10.0.1.5	TCP	66	9999 → 45158 [ACK] Seq=1 Ack=31 Win=43520 Len=0 TSval=769462239 TSecr=4222638050
6	0.003976	10.0.1.2	10.0.1.5	TCP	66	[TCP Dup ACK 5#1] 9999 → 45158 [ACK] Seq=1 Ack=31 Win=43520 Len=0 TSval=769462239 TSecr=4222638050
7	0.004463	10.0.1.2	10.0.1.5	TCP	117	9999 → 45158 [PSH, ACK] Seq=1 Ack=31 Win=43520 Len=51 TSval=769462239 TSecr=4222638050 [TCP segment of a reassembled PDU]
8	0.004486	10.0.1.5	10.0.1.2	TCP	66	45158 → 9999 [ACK] Seq=31 Ack=52 Win=42496 Len=0 TSval=4222638051 TSecr=769462239
9	1.006220	10.0.1.5	10.0.1.2	TCP	96	45158 → 9999 [PSH, ACK] Seq=31 Ack=52 Win=42496 Len=30 TSval=4222639053 TSecr=769462239 [TCP segment of a reassembled PDU]
10	1.007194	10.0.1.2	10.0.1.5	TCP	117	9999 → 45158 [PSH, ACK] Seq=52 Ack=61 Win=43520 Len=51 TSval=769463242 TSecr=4222639053 [TCP segment of a reassembled PDU]
11	1.007216	10.0.1.5	10.0.1.2	TCP	66	45158 → 9999 [ACK] Seq=61 Ack=103 Win=42496 Len=0 TSval=4222639054 TSecr=769463242
12	2.009321	10.0.1.5	10.0.1.2	TCP	96	45158 → 9999 [PSH, ACK] Seq=61 Ack=103 Win=42496 Len=30 TSval=4222640056 TSecr=769463242 [TCP segment of a reassembled PDU]
13	2.010833	10.0.1.2	10.0.1.5	TCP	117	9999 → 45158 [PSH, ACK] Seq=103 Ack=91 Win=43520 Len=51 TSval=769464247 TSecr=4222640056 [TCP segment of a reassembled PDU]
14	2.010846	10.0.1.5	10.0.1.2	TCP	66	45158 → 9999 [ACK] Seq=91 Ack=154 Win=42496 Len=0 TSval=4222640058 TSecr=769464247
15	3.012663	10.0.1.5	10.0.1.2	TCP	96	45158 → 9999 [PSH, ACK] Seq=91 Ack=154 Win=42496 Len=30 TSval=4222641059 TSecr=769464247 [TCP segment of a reassembled PDU]
16	3.012850	10.0.1.2	10.0.1.5	TCP	117	9999 → 45158 [PSH, ACK] Seq=154 Ack=121 Win=43520 Len=51 TSval=769465249 TSecr=4222641059 [TCP segment of a reassembled PDU]
17	3.012857	10.0.1.5	10.0.1.2	TCP	66	45158 → 9999 [ACK] Seq=121 Ack=205 Win=42496 Len=0 TSval=4222641060 TSecr=769465249
18	4.014471	10.0.1.5	10.0.1.2	TCP	96	45158 → 9999 [PSH, ACK] Seq=121 Ack=205 Win=42496 Len=30 TSval=4222642061 TSecr=769465249 [TCP segment of a reassembled PDU]
19	4.014699	10.0.1.2	10.0.1.5	TCP	117	9999 → 45158 [PSH, ACK] Seq=205 Ack=151 Win=43520 Len=51 TSval=769466250 TSecr=4222642061 [TCP segment of a reassembled PDU]
20	4.014707	10.0.1.5	10.0.1.2	TCP	66	45158 → 9999 [ACK] Seq=151 Ack=256 Win=42496 Len=0 TSval=4222642062 TSecr=769466250
21	5.016532	10.0.1.5	10.0.1.2	TCP	96	45158 → 9999 [PSH, ACK] Seq=151 Ack=256 Win=42496 Len=30 TSval=4222643063 TSecr=769466250 [TCP segment of a reassembled PDU]
22	5.016871	10.0.1.2	10.0.1.5	TCP	117	9999 → 45158 [PSH, ACK] Seq=256 Ack=181 Win=43520 Len=51 TSval=769467253 TSecr=4222643063 [TCP segment of a reassembled PDU]
23	5.016883	10.0.1.5	10.0.1.2	TCP	66	45158 → 9999 [ACK] Seq=181 Ack=307 Win=42496 Len=0 TSval=4222643064 TSecr=769467253
24	6.018505	10.0.1.5	10.0.1.2	TCP	96	45158 → 9999 [PSH, ACK] Seq=181 Ack=307 Win=42496 Len=30 TSval=4222644065 TSecr=769467253 [TCP segment of a reassembled PDU]
25	6.018917	10.0.1.2	10.0.1.5	TCP	117	9999 → 45158 [PSH, ACK] Seq=307 Ack=211 Win=43520 Len=51 TSval=769468255 TSecr=4222644065 [TCP segment of a reassembled PDU]
26	6.018928	10.0.1.5	10.0.1.2	TCP	66	45158 → 9999 [ACK] Seq=211 Ack=358 Win=42496 Len=0 TSval=4222644066 TSecr=769468255
27	7.020319	10.0.1.5	10.0.1.2	TCP	96	45158 → 9999 [PSH, ACK] Seq=211 Ack=358 Win=42496 Len=30 TSval=4222645067 TSecr=769468255 [TCP segment of a reassembled PDU]
28	7.021154	10.0.1.2	10.0.1.5	TCP	117	9999 → 45158 [PSH, ACK] Seq=358 Ack=241 Win=43520 Len=51 TSval=769469257 TSecr=4222645067 [TCP segment of a reassembled PDU]
29	7.021165	10.0.1.5	10.0.1.2	TCP	66	45158 → 9999 [ACK] Seq=241 Ack=409 Win=42496 Len=0 TSval=4222645068 TSecr=769469257
30	8.022538	10.0.1.5	10.0.1.2	TCP	96	45158 → 9999 [PSH, ACK] Seq=241 Ack=409 Win=42496 Len=30 TSval=4222646069 TSecr=769469257 [TCP segment of a reassembled PDU]
31	8.022822	10.0.1.2	10.0.1.5	TCP	117	9999 → 45158 [PSH, ACK] Seq=409 Ack=271 Win=43520 Len=51 TSval=769470259 TSecr=4222646069 [TCP segment of a reassembled PDU]
32	8.022827	10.0.1.5	10.0.1.2	TCP	66	45158 → 9999 [ACK] Seq=271 Ack=460 Win=42496 Len=0 TSval=4222646070 TSecr=769470259
33	9.024483	10.0.1.5	10.0.1.2	TCP	96	45158 → 9999 [PSH, ACK] Seq=271 Ack=460 Win=42496 Len=30 TSval=4222647071 TSecr=769470259 [TCP segment of a reassembled PDU]
34	9.024713	10.0.1.2	10.0.1.5	TCP	117	9999 → 45158 [PSH, ACK] Seq=460 Ack=301 Win=43520 Len=51 TSval=769471261 TSecr=4222647071 [TCP segment of a reassembled PDU]
35	9.024717	10.0.1.5	10.0.1.2	TCP	66	45158 → 9999 [ACK] Seq=301 Ack=511 Win=42496 Len=0 TSval=4222647072 TSecr=769471261
36	10.025956	10.0.1.5	10.0.1.2	TCP	97	45158 → 9999 [PSH, ACK] Seq=301 Ack=511 Win=42496 Len=31 TSval=4222648073 TSecr=769471261 [TCP segment of a reassembled PDU]
37	10.026114	10.0.1.2	10.0.1.5	TCP	117	9999 → 45158 [PSH, ACK] Seq=511 Ack=332 Win=43520 Len=51 TSval=769472262 TSecr=4222648073 [TCP segment of a reassembled PDU]
38	10.026119	10.0.1.5	10.0.1.2	TCP	66	45158 → 9999 [ACK] Seq=332 Ack=562 Win=42496 Len=0 TSval=4222648073 TSecr=769472262
39	11.027623	10.0.1.5	10.0.1.2	TCP	97	45158 → 9999 [PSH, ACK] Seq=332 Ack=562 Win=42496 Len=31 TSval=4222649074 TSecr=769472262 [TCP segment of a reassembled PDU]
40	11.027858	10.0.1.2	10.0.1.5	TCP	117	9999 → 45158 [PSH, ACK] Seq=562 Ack=363 Win=43520 Len=51 TSval=769473264 TSecr=4222649074 [TCP segment of a reassembled PDU]
41	11.027865	10.0.1.5	10.0.1.2	TCP	66	45158 → 9999 [ACK] Seq=363 Ack=613 Win=42496 Len=0 TSval=4222649075 TSecr=769473264
42	12.029209	10.0.1.5	10.0.1.2	TCP	97	45158 → 9999 [PSH, ACK] Seq=363 Ack=613 Win=42496 Len=31 TSval=4222650076 TSecr=769473264 [TCP segment of a reassembled PDU]
43	12.029462	10.0.1.2	10.0.1.5	TCP	117	9999 → 45158 [PSH, ACK] Seq=613 Ack=394 Win=43520 Len=51 TSval=769474265 TSecr=4222650076 [TCP segment of a reassembled PDU]
44	12.029469	10.0.1.5	10.0.1.2	TCP	66	45158 → 9999 [ACK] Seq=394 Ack=664 Win=42496 Len=0 TSval=4222650076 TSecr=769474265
45	13.030730	10.0.1.5	10.0.1.2	TCP	97	45158 → 9999 [PSH, ACK] Seq=394 Ack=664 Win=42496 Len=31 TSval=4222651078 TSecr=769474265 [TCP segment of a reassembled PDU]
46	13.030899	10.0.1.2	10.0.1.5	TCP	117	9999 → 45158 [PSH, ACK] Seq=664 Ack=425 Win=43520 Len=51 TSval=769475267 TSecr=4222651078 [TCP segment of a reassembled PDU]
47	13.030904	10.0.1.5	10.0.1.2	TCP	66	45158 → 9999 [ACK] Seq=425 Ack=715 Win=42496 Len=0 TSval=4222651078 TSecr=769475267
48	14.034139	10.0.1.5	10.0.1.2	TCP	97	45158 → 9999 [PSH, ACK] Seq=425 Ack=715 Win=42496 Len=31 TSval=4222652081 TSecr=769475267 [TCP segment of a reassembled PDU]
49	14.034804	10.0.1.2	10.0.1.5	TCP	117	9999 → 45158 [PSH, ACK] Seq=715 Ack=456 Win=43520 Len=51 TSval=769476271 TSecr=4222652081 [TCP segment of a reassembled PDU]
50	14.034811	10.0.1.5	10.0.1.2	TCP	66	45158 → 9999 [ACK] Seq=456 Ack=766 Win=42496 Len=0 TSval=4222652082 TSecr=769476271
51	15.035619	10.0.1.5	10.0.1.2	TCP	97	45158 → 9999 [PSH, ACK] Seq=456 Ack=766 Win=42496 Len=31 TSval=4222653082 TSecr=769476271 [TCP segment of a reassembled PDU]
52	15.035832	10.0.1.2	10.0.1.5	TCP	117	9999 → 45158 [PSH, ACK] Seq=766 Ack=487 Win=43520 Len=51 TSval=769477272 TSecr=4222653082 [TCP segment of a reassembled PDU]
53	15.035839	10.0.1.5	10.0.1.2	TCP	66	45158 → 9999 [ACK] Seq=487 Ack=817 Win=42496 Len=0 TSval=4222653083 TSecr=769477272
54	16.038296	10.0.1.5	10.0.1.2	TCP	97	45158 → 9999 [PSH, ACK] Seq=487 Ack=817 Win=42496 Len=31 TSval=4222654085 TSecr=769477272 [TCP segment of a reassembled PDU]
55	16.038575	10.0.1.2	10.0.1.5	TCP	117	9999 → 45158 [PSH, ACK] Seq=817 Ack=518 Win=43520 Len=51 TSval=769478274 TSecr=4222654085 [TCP segment of a reassembled PDU]
56	16.038584	10.0.1.5	10.0.1.2	TCP	66	45158 → 9999 [ACK] Seq=518 Ack=868 Win=42496 Len=0 TSval=4222654085 TSecr=769478274
57	17.040054	10.0.1.5	10.0.1.2	TCP	97	45158 → 9999 [PSH, ACK] Seq=518 Ack=868 Win=42496 Len=31 TSval=4222655087 TSecr=769478274 [TCP segment of a reassembled PDU]
58	17.040285	10.0.1.2	10.0.1.5	TCP	117	9999 → 45158 [PSH, ACK] Seq=868 Ack=549 Win=43520 Len=51 TSval=769479276 TSecr=4222655087 [TCP segment of a reassembled PDU]
59	17.040291	10.0.1.5	10.0.1.2	TCP	66	45158 → 9999 [ACK] Seq=549 Ack=919 Win=42496 Len=0 TSval=4222655087 TSecr=769479276
60	18.041636	10.0.1.5	10.0.1.2	TCP	97	45158 → 9999 [PSH, ACK] Seq=549 Ack=919 Win=42496 Len=31 TSval=4222656088 TSecr=769479276 [TCP segment of a reassembled PDU]
61	18.041869	10.0.1.2	10.0.1.5	TCP	117	9999 → 45158 [PSH, ACK] Seq=919 Ack=580 Win=43520 Len=51 TSval=769480278 TSecr=4222656088 [TCP segment of a reassembled PDU]
62	18.041877	10.0.1.5	10.0.1.2	TCP	66	45158 → 9999 [ACK] Seq=580 Ack=970 Win=42496 Len=0 TSval=4222656089 TSecr=769480278
63	19.042884	10.0.1.5	10.0.1.2	TCP	97	45158 → 9999 [PSH, ACK] Seq=580 Ack=970 Win=42496 Len=31 TSval=4222657090 TSecr=769480278 [TCP segment of a reassembled PDU]
64	19.043150	10.0.1.2	10.0.1.5	TCP	117	9999 → 45158 [PSH, ACK] Seq=970 Ack=611 Win=43520 Len=51 TSval=769481279 TSecr=4222657090 [TCP segment of a reassembled PDU]
65	19.043157	10.0.1.5	10.0.1.2	TCP	66	45158 → 9999 [ACK] Seq=611 Ack=1021 Win=42496 Len=0 TSval=4222657090 TSecr=769481279
66	20.044461	10.0.1.5	10.0.1.2	TCP	97	45158 → 9999 [PSH, ACK] Seq=611 Ack=1021 Win=42496 Len=31 TSval=4222658091 TSecr=769481279 [TCP segment of a reassembled PDU]
67	20.044702	10.0.1.2	10.0.1.5	TCP	117	9999 → 45158 [PSH, ACK] Seq=1021 Ack=642 Win=43520 Len=51 TSval=769482280 TSecr=4222658091 [TCP segment of a reassembled PDU]
68	20.044707	10.0.1.5	10.0.1.2	TCP	66	45158 → 9999 [ACK] Seq=642 Ack=1072 Win=42496 Len=0 TSval=4222658092 TSecr=769482280
69	21.046074	10.0.1.5	10.0.1.2	TCP	97	45158 → 9999 [PSH, ACK] Seq=642 Ack=1072 Win=42496 Len=31 TSval=4222659093 TSecr=769482280 [TCP segment of a reassembled PDU]
70	21.046933	10.0.1.2	10.0.1.5	TCP	117	9999 → 45158 [PSH, ACK] Seq=1072 Ack=673 Win=43520 Len=51 TSval=769483283 TSecr=4222659093 [TCP segment of a reassembled PDU]
71	21.046939	10.0.1.5	10.0.1.2	TCP	66	45158 → 9999 [ACK] Seq=673 Ack=1123 Win=42496 Len=0 TSval=4222659094 TSecr=769483283
72	22.048393	10.0.1.5	10.0.1.2	TCP	97	45158 → 9999 [PSH, ACK] Seq=673 Ack=1123 Win=42496 Len=31 TSval=4222660095 TSecr=769483283 [TCP segment of a reassembled PDU]
73	22.048845	10.0.1.2	10.0.1.5	TCP	117	9999 → 45158 [PSH, ACK] Seq=1123 Ack=704 Win=43520 Len=51 TSval=769484285 TSecr=4222660095 [TCP segment of a reassembled PDU]
74	22.048854	10.0.1.5	10.0.1.2	TCP	66	45158 → 9999 [ACK] Seq=704 Ack=1174 Win=42496 Len=0 TSval=4222660096 TSecr=769484285
75	23.050253	10.0.1.5	10.0.1.2	TCP	97	45158 → 9999 [PSH, ACK] Seq=704 Ack=1174 Win=42496 Len=31 TSval=4222661097 TSecr=769484285 [TCP segment of a reassembled PDU]
76	23.050335	10.0.1.2	10.0.1.5	TCP	117	9999 → 45158 [PSH, ACK] Seq=1174 Ack=735 Win=43520 Len=51 TSval=769485286 TSecr=4222661097 [TCP segment of a reassembled PDU]
77	23.050339	10.0.1.5	10.0.1.2	TCP	66	45158 → 9999 [ACK] Seq=735 Ack=1225 Win=42496 Len=0 TSval=4222661097 TSecr=769485286
78	24.051756	10.0.1.5	10.0.1.2	TCP	97	45158 → 9999 [PSH, ACK] Seq=735 Ack=1225 Win=42496 Len=31 TSval=4222662099 TSecr=769485286 [TCP segment of a reassembled PDU]
79	24.051926	10.0.1.2	10.0.1.5	TCP	117	9999 → 45158 [PSH, ACK] Seq=1225 Ack=766 Win=43520 Len=51 TSval=769486288 TSecr=4222662099 [TCP segment of a reassembled PDU]
80	24.051933	10.0.1.5	10.0.1.2	TCP	66	45158 → 9999 [ACK] Seq=766 Ack=1276 Win=42496 Len=0 TSval=4222662099 TSecr=769486288
81	25.053027	10.0.1.5	10.0.1.2	TCP	97	45158 → 9999 [PSH, ACK] Seq=766 Ack=1276 Win=42496 Len=31 TSval=4222663100 TSecr=769486288 [TCP segment of a reassembled PDU]
82	25.053136	10.0.1.2	10.0.1.5	TCP	117	9999 → 45158 [PSH, ACK] Seq=1276 Ack=797 Win=43520 Len=51 TSval=769487289 TSecr=4222663100 [TCP segment of a reassembled PDU]
83	25.053140	10.0.1.5	10.0.1.2	TCP	66	45158 → 9999 [ACK] Seq=797 Ack=1327 Win=42496 Len=0 TSval=4222663100 TSecr=769487289
84	26.054360	10.0.1.5	10.0.1.2	TCP	97	45158 → 9999 [PSH, ACK] Seq=797 Ack=1327 Win=42496 Len=31 TSval=4222664101 TSecr=769487289 [TCP segment of a reassembled PDU]
85	26.054441	10.0.1.2	10.0.1.5	TCP	117	9999 → 45158 [PSH, ACK] Seq=1327 Ack=828 Win=43520 Len=51 TSval=769488290 TSecr=4222664101 [TCP segment of a reassembled PDU]
86	26.054444	10.0.1.5	10.0.1.2	TCP	66	45158 → 9999 [ACK] Seq=828 Ack=1378 Win=42496 Len=0 TSval=4222664101 TSecr=769488290
87	27.055674	10.0.1.5	10.0.1.2	TCP	97	45158 → 9999 [PSH, ACK] Seq=828 Ack=1378 Win=42496 Len=31 TSval=4222665102 TSecr=769488290 [TCP segment of a reassembled PDU]
88	27.055869	10.0.1.2	10.0.1.5	TCP	117	9999 → 45158 [PSH, ACK] Seq=1378 Ack=859 Win=43520 Len=51 TSval=769489292 TSecr=4222665102 [TCP segment of a reassembled PDU]
89	27.055875	10.0.1.5	10.0.1.2	TCP	66	45158 → 9999 [ACK] Seq=859 Ack=1429 Win=42496 Len=0 TSval=4222665103 TSecr=769489292
90	28.057227	10.0.1.5	10.0.1.2	TCP	97	45158 → 9999 [PSH, ACK] Seq=859 Ack=1429 Win=42496 Len=31 TSval=4222666104 TSecr=769489292 [TCP segment of a reassembled PDU]
91	28.057368	10.0.1.2	10.0.1.5	TCP	117	9999 → 45158 [PSH, ACK] Seq=1429 Ack=890 Win=43520 Len=51 TSval=769490293 TSecr=4222666104 [TCP segment of a reassembled PDU]
92	28.057375	10.0.1.5	10.0.1.2	TCP	66	45158 → 9999 [ACK] Seq=890 Ack=1480 Win=42496 Len=0 TSval=4222666104 TSecr=769490293
93	29.058941	10.0.1.5	10.0.1.2	TCP	97	45158 → 9999 [PSH, ACK] Seq=890 Ack=1480 Win=42496 Len=31 TSval=4222667106 TSecr=769490293 [TCP segment of a reassembled PDU]
94	29.059148	10.0.1.2	10.0.1.5	TCP	117	9999 → 45158 [PSH, ACK] Seq=1480 Ack=921 Win=43520 Len=51 TSval=769491295 TSecr=4222667106 [TCP segment of a reassembled PDU]
95	29.059159	10.0.1.5	10.0.1.2	TCP	66	45158 → 9999 [ACK] Seq=921 Ack=1531 Win=42496 Len=0 TSval=4222667106 TSecr=769491295
96	30.060548	10.0.1.5	10.0.1.2	TCP	97	45158 → 9999 [PSH, ACK] Seq=921 Ack=1531 Win=42496 Len=31 TSval=4222668107 TSecr=769491295 [TCP segment of a reassembled PDU]
97	30.060856	10.0.1.2	10.0.1.5	TCP	117	9999 → 45158 [PSH, ACK] Seq=1531 Ack=952 Win=43520 Len=51 TSval=769492297 TSecr=4222668107 [TCP segment of a reassembled PDU]
98	30.060869	10.0.1.5	10.0.1.2	TCP	66	45158 → 9999 [ACK] Seq=952 Ack=1582 Win=42496 Len=0 TSval=4222668108 TSecr=769492297
99	31.062212	10.0.1.5	10.0.1.2	TCP	97	45158 → 9999 [PSH, ACK] Seq=952 Ack=1582 Win=42496 Len=31 TSval=4222669109 TSecr=769492297 [TCP segment of a reassembled PDU]
100	31.062355	10.0.1.2	10.0.1.5	TCP	117	9999 → 45158 [PSH, ACK] Seq=1582 Ack=983 Win=43520 Len=51 TSval=769493298 TSecr=4222669109 [TCP segment of a reassembled PDU]
101	31.062363	10.0.1.5	10.0.1.2	TCP	66	45158 → 9999 [ACK] Seq=983 Ack=1633 Win=42496 Len=0 TSval=4222669109 TSecr=769493298
102	32.063973	10.0.1.5	10.0.1.2	TCP	97	45158 → 9999 [PSH, ACK] Seq=983 Ack=1633 Win=42496 Len=31 TSval=4222670111 TSecr=769493298 [TCP segment of a reassembled PDU]
103	32.064299	10.0.1.2	10.0.1.5	TCP	117	9999 → 45158 [PSH, ACK] Seq=1633 Ack=1014 Win=43520 Len=51 TSval=769494300 TSecr=4222670111 [TCP segment of a reassembled PDU]
104	32.064315	10.0.1.5	10.0.1.2	TCP	66	45158 → 9999 [ACK] Seq=1014 Ack=1684 Win=42496 Len=0 TSval=4222670111 TSecr=769494300
105	33.066269	10.0.1.5	10.0.1.2	TCP	97	45158 → 9999 [PSH, ACK] Seq=1014 Ack=1684 Win=42496 Len=31 TSval=4222671113 TSecr=769494300 [TCP segment of a reassembled PDU]
106	33.066505	10.0.1.2	10.0.1.5	TCP	117	9999 → 45158 [PSH, ACK] Seq=1684 Ack=1045 Win=43520 Len=51 TSval=769495302 TSecr=4222671113 [TCP segment of a reassembled PDU]
107	33.066518	10.0.1.5	10.0.1.2	TCP	66	45158 → 9999 [ACK] Seq=1045 Ack=1735 Win=42496 Len=0 TSval=4222671113 TSecr=769495302
108	34.068159	10.0.1.5	10.0.1.2	TCP	97	45158 → 9999 [PSH, ACK] Seq=1045 Ack=1735 Win=42496 Len=31 TSval=4222672115 TSecr=769495302 [TCP segment of a reassembled PDU]
109	34.068390	10.0.1.2	10.0.1.5	TCP	117	9999 → 45158 [PSH, ACK] Seq=1735 Ack=1076 Win=43520 Len=51 TSval=769496304 TSecr=4222672115 [TCP segment of a reassembled PDU]
110	34.068402	10.0.1.5	10.0.1.2	TCP	66	45158 → 9999 [ACK] Seq=1076 Ack=1786 Win=42496 Len=0 TSval=4222672115 TSecr=769496304
111	35.069910	10.0.1.5	10.0.1.2	TCP	97	45158 → 9999 [PSH, ACK] Seq=1076 Ack=1786 Win=42496 Len=31 TSval=4222673117 TSecr=769496304 [TCP segment of a reassembled PDU]
112	35.070143	10.0.1.2	10.0.1.5	TCP	117	9999 → 45158 [PSH, ACK] Seq=1786 Ack=1107 Win=43520 Len=51 TSval=769497306 TSecr=4222673117 [TCP segment of a reassembled PDU]
113	35.070156	10.0.1.5	10.0.1.2	TCP	66	45158 → 9999 [ACK] Seq=1107 Ack=1837 Win=42496 Len=0 TSval=4222673117 TSecr=769497306
114	36.071861	10.0.1.5	10.0.1.2	TCP	97	45158 → 9999 [PSH, ACK] Seq=1107 Ack=1837 Win=42496 Len=31 TSval=4222674119 TSecr=769497306 [TCP segment of a reassembled PDU]
115	36.072080	10.0.1.2	10.0.1.5	TCP	117	9999 → 45158 [PSH, ACK] Seq=1837 Ack=1138 Win=43520 Len=51 TSval=769498308 TSecr=4222674119 [TCP segment of a reassembled PDU]
116	36.072092	10.0.1.5	10.0.1.2	TCP	66	45158 → 9999 [ACK] Seq=1138 Ack=1888 Win=42496 Len=0 TSval=4222674119 TSecr=769498308
117	37.075131	10.0.1.5	10.0.1.2	TCP	97	45158 → 9999 [PSH, ACK] Seq=1138 Ack=1888 Win=42496 Len=31 TSval=4222675122 TSecr=769498308 [TCP segment of a reassembled PDU]
118	37.075526	10.0.1.2	10.0.1.5	TCP	117	9999 → 45158 [PSH, ACK] Seq=1888 Ack=1169 Win=43520 Len=51 TSval=769499311 TSecr=4222675122 [TCP segment of a reassembled PDU]
119	37.075541	10.0.1.5	10.0.1.2	TCP	66	45158 → 9999 [ACK] Seq=1169 Ack=1939 Win=42496 Len=0 TSval=4222675122 TSecr=769499311
120	38.077174	10.0.1.5	10.0.1.2	TCP	97	45158 → 9999 [PSH, ACK] Seq=1169 Ack=1939 Win=42496 Len=31 TSval=4222676124 TSecr=769499311 [TCP segment of a reassembled PDU]
121	38.077612	10.0.1.2	10.0.1.5	TCP	117	9999 → 45158 [PSH, ACK] Seq=1939 Ack=1200 Win=43520 Len=51 TSval=769500313 TSecr=4222676124 [TCP segment of a reassembled PDU]
122	38.077634	10.0.1.5	10.0.1.2	TCP	66	45158 → 9999 [ACK] Seq=1200 Ack=1990 Win=42496 Len=0 TSval=4222676124 TSecr=769500313
123	39.079427	10.0.1.5	10.0.1.2	TCP	97	45158 → 9999 [PSH, ACK] Seq=1200 Ack=1990 Win=42496 Len=31 TSval=4222677126 TSecr=769500313 [TCP segment of a reassembled PDU]
124	39.079631	10.0.1.2	10.0.1.5	TCP	117	9999 → 45158 [PSH, ACK] Seq=1990 Ack=1231 Win=43520 Len=51 TSval=769501315 TSecr=4222677126 [TCP segment of a reassembled PDU]
125	39.079640	10.0.1.5	10.0.1.2	TCP	66	45158 → 9999 [ACK] Seq=1231 Ack=2041 Win=42496 Len=0 TSval=4222677126 TSecr=769501315
126	40.081274	10.0.1.5	10.0.1.2	TCP	97	45158 → 9999 [PSH, ACK] Seq=1231 Ack=2041 Win=42496 Len=31 TSval=4222678128 TSecr=769501315 [TCP segment of a reassembled PDU]
127	40.081911	10.0.1.2	10.0.1.5	TCP	117	9999 → 45158 [PSH, ACK] Seq=2041 Ack=1262 Win=43520 Len=51 TSval=769502318 TSecr=4222678128 [TCP segment of a reassembled PDU]
128	40.081929	10.0.1.5	10.0.1.2	TCP	66	45158 → 9999 [ACK] Seq=1262 Ack=2092 Win=42496 Len=0 TSval=4222678129 TSecr=769502318
129	41.083954	10.0.1.5	10.0.1.2	TCP	97	45158 → 9999 [PSH, ACK] Seq=1262 Ack=2092 Win=42496 Len=31 TSval=4222679131 TSecr=769502318 [TCP segment of a reassembled PDU]
130	41.084410	10.0.1.2	10.0.1.5	TCP	117	9999 → 45158 [PSH, ACK] Seq=2092 Ack=1293 Win=43520 Len=51 TSval=769503320 TSecr=4222679131 [TCP segment of a reassembled PDU]
131	41.084429	10.0.1.5	10.0.1.2	TCP	66	45158 → 9999 [ACK] Seq=1293 Ack=2143 Win=42496 Len=0 TSval=4222679131 TSecr=769503320
132	42.086420	10.0.1.5	10.0.1.2	TCP	97	45158 → 9999 [PSH, ACK] Seq=1293 Ack=2143 Win=42496 Len=31 TSval=4222680133 TSecr=769503320 [TCP segment of a reassembled PDU]
133	42.087031	10.0.1.2	10.0.1.5	TCP	117	9999 → 45158 [PSH, ACK] Seq=2143 Ack=1324 Win=43520 Len=51 TSval=769504323 TSecr=4222680133 [TCP segment of a reassembled PDU]
134	42.087053	10.0.1.5	10.0.1.2	TCP	66	45158 → 9999 [ACK] Seq=1324 Ack=2194 Win=42496 Len=0 TSval=4222680134 TSecr=769504323
135	43.088914	10.0.1.5	10.0.1.2	TCP	97	45158 → 9999 [PSH, ACK] Seq=1324 Ack=2194 Win=42496 Len=31 TSval=4222681136 TSecr=769504323 [TCP segment of a reassembled PDU]
136	43.089371	10.0.1.2	10.0.1.5	TCP	117	9999 → 45158 [PSH, ACK] Seq=2194 Ack=1355 Win=43520 Len=51 TSval=769505325 TSecr=4222681136 [TCP segment of a reassembled PDU]
137	43.089389	10.0.1.5	10.0.1.2	TCP	66	45158 → 9999 [ACK] Seq=1355 Ack=2245 Win=42496 Len=0 TSval=4222681136 TSecr=769505325
138	44.091501	10.0.1.5	10.0.1.2	TCP	97	45158 → 9999 [PSH, ACK] Seq=1355 Ack=2245 Win=42496 Len=31 TSval=4222682138 TSecr=769505325 [TCP segment of a reassembled PDU]
139	44.092119	10.0.1.2	10.0.1.5	TCP	117	9999 → 45158 [PSH, ACK] Seq=2245 Ack=1386 Win=43520 Len=51 TSval=769506328 TSecr=4222682138 [TCP segment of a reassembled PDU]
140	44.092151	10.0.1.5	10.0.1.2	TCP	66	45158 → 9999 [ACK] Seq=1386 Ack=2296 Win=42496 Len=0 TSval=4222682139 TSecr=769506328
141	45.093864	10.0.1.5	10.0.1.2	TCP	97	45158 → 9999 [PSH, ACK] Seq=1386 Ack=2296 Win=42496 Len=31 TSval=4222683141 TSecr=769506328 [TCP segment of a reassembled PDU]
142	45.094205	10.0.1.2	10.0.1.5	TCP	117	9999 → 45158 [PSH, ACK] Seq=2296 Ack=1417 Win=43520 Len=51 TSval=769507330 TSecr=4222683141 [TCP segment of a reassembled PDU]
143	45.094218	10.0.1.5	10.0.1.2	TCP	66	45158 → 9999 [ACK] Seq=1417 Ack=2347 Win=42496 Len=0 TSval=4222683141 TSecr=769507330
144	46.095611	10.0.1.5	10.0.1.2	TCP	97	45158 → 9999 [PSH, ACK] Seq=1417 Ack=2347 Win=42496 Len=31 TSval=4222684142 TSecr=769507330 [TCP segment of a reassembled PDU]
145	46.095920	10.0.1.2	10.0.1.5	TCP	117	9999 → 45158 [PSH, ACK] Seq=2347 Ack=1448 Win=43520 Len=51 TSval=769508332 TSecr=4222684142 [TCP segment of a reassembled PDU]
146	46.095928	10.0.1.5	10.0.1.2	TCP	66	45158 → 9999 [ACK] Seq=1448 Ack=2398 Win=42496 Len=0 TSval=4222684143 TSecr=769508332
147	47.097860	10.0.1.5	10.0.1.2	TCP	97	45158 → 9999 [PSH, ACK] Seq=1448 Ack=2398 Win=42496 Len=31 TSval=4222685145 TSecr=769508332 [TCP segment of a reassembled PDU]
148	47.098915	10.0.1.2	10.0.1.5	TCP	117	9999 → 45158 [PSH, ACK] Seq=2398 Ack=1479 Win=43520 Len=51 TSval=769509335 TSecr=4222685145 [TCP segment of a reassembled PDU]
149	47.098928	10.0.1.5	10.0.1.2	TCP	66	45158 → 9999 [ACK] Seq=1479 Ack=2449 Win=42496 Len=0 TSval=4222685146 TSecr=769509335
150	48.100586	10.0.1.5	10.0.1.2	TCP	97	45158 → 9999 [PSH, ACK] Seq=1479 Ack=2449 Win=42496 Len=31 TSval=4222686147 TSecr=769509335 [TCP segment of a reassembled PDU]
151	48.101034	10.0.1.2	10.0.1.5	TCP	117	9999 → 45158 [PSH, ACK] Seq=2449 Ack=1510 Win=43520 Len=51 TSval=769510337 TSecr=4222686147 [TCP segment of a reassembled PDU]
152	48.101049	10.0.1.5	10.0.1.2	TCP	66	45158 → 9999 [ACK] Seq=1510 Ack=2500 Win=42496 Len=0 TSval=4222686148 TSecr=769510337
153	49.102406	10.0.1.5	10.0.1.2	TCP	97	45158 → 9999 [PSH, ACK] Seq=1510 Ack=2500 Win=42496 Len=31 TSval=4222687149 TSecr=769510337 [TCP segment of a reassembled PDU]
154	49.102492	10.0.1.2	10.0.1.5	TCP	117	9999 → 45158 [PSH, ACK] Seq=2500 Ack=1541 Win=43520 Len=51 TSval=769511338 TSecr=4222687149 [TCP segment of a reassembled PDU]
155	49.102497	10.0.1.5	10.0.1.2	TCP	66	45158 → 9999 [ACK] Seq=1541 Ack=2551 Win=42496 Len=0 TSval=4222687149 TSecr=769511338
156	50.103857	10.0.1.5	10.0.1.2	TCP	97	45158 → 9999 [PSH, ACK] Seq=1541 Ack=2551 Win=42496 Len=31 TSval=4222688151 TSecr=769511338 [TCP segment of a reassembled PDU]
157	50.103962	10.0.1.2	10.0.1.5	TCP	117	9999 → 45158 [PSH, ACK] Seq=2551 Ack=1572 Win=43520 Len=51 TSval=769512340 TSecr=4222688151 [TCP segment of a reassembled PDU]
158	50.103967	10.0.1.5	10.0.1.2	TCP	66	45158 → 9999 [ACK] Seq=1572 Ack=2602 Win=42496 Len=0 TSval=4222688151 TSecr=769512340
159	51.104750	10.0.1.5	10.0.1.2	TCP	97	45158 → 9999 [PSH, ACK] Seq=1572 Ack=2602 Win=42496 Len=31 TSval=4222689152 TSecr=769512340 [TCP segment of a reassembled PDU]
160	51.105020	10.0.1.2	10.0.1.5	TCP	117	9999 → 45158 [PSH, ACK] Seq=2602 Ack=1603 Win=43520 Len=51 TSval=769513341 TSecr=4222689152 [TCP segment of a reassembled PDU]
161	51.105026	10.0.1.5	10.0.1.2	TCP	66	45158 → 9999 [ACK] Seq=1603 Ack=2653 Win=42496 Len=0 TSval=4222689152 TSecr=769513341
162	52.106462	10.0.1.5	10.0.1.2	TCP	97	45158 → 9999 [PSH, ACK] Seq=1603 Ack=2653 Win=42496 Len=31 TSval=4222690153 TSecr=769513341 [TCP segment of a reassembled PDU]
163	52.106644	10.0.1.2	10.0.1.5	TCP	117	9999 → 45158 [PSH, ACK] Seq=2653 Ack=1634 Win=43520 Len=51 TSval=769514342 TSecr=4222690153 [TCP segment of a reassembled PDU]
164	52.106655	10.0.1.5	10.0.1.2	TCP	66	45158 → 9999 [ACK] Seq=1634 Ack=2704 Win=42496 Len=0 TSval=4222690153 TSecr=769514342
165	53.108225	10.0.1.5	10.0.1.2	TCP	97	45158 → 9999 [PSH, ACK] Seq=1634 Ack=2704 Win=42496 Len=31 TSval=4222691155 TSecr=769514342 [TCP segment of a reassembled PDU]
166	53.108366	10.0.1.2	10.0.1.5	TCP	117	9999 → 45158 [PSH, ACK] Seq=2704 Ack=1665 Win=43520 Len=51 TSval=769515344 TSecr=4222691155 [TCP segment of a reassembled PDU]
167	53.108372	10.0.1.5	10.0.1.2	TCP	66	45158 → 9999 [ACK] Seq=1665 Ack=2755 Win=42496 Len=0 TSval=4222691155 TSecr=769515344
168	54.109672	10.0.1.5	10.0.1.2	TCP	97	45158 → 9999 [PSH, ACK] Seq=1665 Ack=2755 Win=42496 Len=31 TSval=4222692156 TSecr=769515344 [TCP segment of a reassembled PDU]
169	54.109841	10.0.1.2	10.0.1.5	TCP	117	9999 → 45158 [PSH, ACK] Seq=2755 Ack=1696 Win=43520 Len=51 TSval=769516346 TSecr=4222692156 [TCP segment of a reassembled PDU]
170	54.109848	10.0.1.5	10.0.1.2	TCP	66	45158 → 9999 [ACK] Seq=1696 Ack=2806 Win=42496 Len=0 TSval=4222692157 TSecr=769516346
171	54.893698	10.0.1.5	10.0.1.2	TCP	66	45158 → 9999 [FIN, ACK] Seq=1696 Ack=2806 Win=42496 Len=0 TSval=4222692940 TSecr=769516346
172	54.894383	10.0.1.2	10.0.1.5	TCP	66	9999 → 45158 [FIN, ACK] Seq=2806 Ack=1697 Win=43520 Len=0 TSval=769517130 TSecr=4222692940
173	54.894403	10.0.1.5	10.0.1.2	TCP	66	45158 → 9999 [ACK] Seq=1697 Ack=2807 Win=42496 Len=0 TSval=4222692941 TSecr=769517130
174	105.275774	fe80::200:ff:fe00:1	ff02::2	ICMPv6	70	Router Solicitation from 00:00:00:00:00:01