1	0.000000	10.0.1.5	10.0.1.2	TCP	74	56170 → 9999 [SYN] Seq=0 Win=42340 Len=0 MSS=1460 SACK_PERM=1 TSval=4217132433 TSecr=0 WS=512
2	0.002351	10.0.1.2	10.0.1.5	TCP	74	9999 → 56170 [SYN, ACK] Seq=0 Ack=1 Win=43440 Len=0 MSS=1460 SACK_PERM=1 TSval=763956623 TSecr=4217132433 WS=512
3	0.002370	10.0.1.5	10.0.1.2	TCP	66	56170 → 9999 [ACK] Seq=1 Ack=1 Win=42496 Len=0 TSval=4217132435 TSecr=763956623
4	0.002405	10.0.1.5	10.0.1.2	TCP	96	56170 → 9999 [PSH, ACK] Seq=1 Ack=1 Win=42496 Len=30 TSval=4217132435 TSecr=763956623 [TCP segment of a reassembled PDU]
5	0.003784	10.0.1.2	10.0.1.5	TCP	66	9999 → 56170 [ACK] Seq=1 Ack=31 Win=43520 Len=0 TSval=763956624 TSecr=4217132435
6	0.003797	10.0.1.2	10.0.1.5	TCP	66	[TCP Dup ACK 5#1] 9999 → 56170 [ACK] Seq=1 Ack=31 Win=43520 Len=0 TSval=763956624 TSecr=4217132435
7	0.003806	10.0.1.2	10.0.1.5	TCP	117	9999 → 56170 [PSH, ACK] Seq=1 Ack=31 Win=43520 Len=51 TSval=763956624 TSecr=4217132435 [TCP segment of a reassembled PDU]
8	0.003822	10.0.1.5	10.0.1.2	TCP	66	56170 → 9999 [ACK] Seq=31 Ack=52 Win=42496 Len=0 TSval=4217132437 TSecr=763956624
9	1.005014	10.0.1.5	10.0.1.2	TCP	96	56170 → 9999 [PSH, ACK] Seq=31 Ack=52 Win=42496 Len=30 TSval=4217133438 TSecr=763956624 [TCP segment of a reassembled PDU]
10	1.005500	10.0.1.2	10.0.1.5	TCP	117	9999 → 56170 [PSH, ACK] Seq=52 Ack=61 Win=43520 Len=51 TSval=763957627 TSecr=4217133438 [TCP segment of a reassembled PDU]
11	1.005509	10.0.1.5	10.0.1.2	TCP	66	56170 → 9999 [ACK] Seq=61 Ack=103 Win=42496 Len=0 TSval=4217133438 TSecr=763957627
12	2.006646	10.0.1.5	10.0.1.2	TCP	96	56170 → 9999 [PSH, ACK] Seq=61 Ack=103 Win=42496 Len=30 TSval=4217134439 TSecr=763957627 [TCP segment of a reassembled PDU]
13	2.006865	10.0.1.2	10.0.1.5	TCP	117	9999 → 56170 [PSH, ACK] Seq=103 Ack=91 Win=43520 Len=51 TSval=763958629 TSecr=4217134439 [TCP segment of a reassembled PDU]
14	2.006871	10.0.1.5	10.0.1.2	TCP	66	56170 → 9999 [ACK] Seq=91 Ack=154 Win=42496 Len=0 TSval=4217134440 TSecr=763958629
15	3.008384	10.0.1.5	10.0.1.2	TCP	96	56170 → 9999 [PSH, ACK] Seq=91 Ack=154 Win=42496 Len=30 TSval=4217135441 TSecr=763958629 [TCP segment of a reassembled PDU]
16	3.008555	10.0.1.2	10.0.1.5	TCP	117	9999 → 56170 [PSH, ACK] Seq=154 Ack=121 Win=43520 Len=51 TSval=763959630 TSecr=4217135441 [TCP segment of a reassembled PDU]
17	3.008559	10.0.1.5	10.0.1.2	TCP	66	56170 → 9999 [ACK] Seq=121 Ack=205 Win=42496 Len=0 TSval=4217135441 TSecr=763959630
18	4.009992	10.0.1.5	10.0.1.2	TCP	96	56170 → 9999 [PSH, ACK] Seq=121 Ack=205 Win=42496 Len=30 TSval=4217136443 TSecr=763959630 [TCP segment of a reassembled PDU]
19	4.010149	10.0.1.2	10.0.1.5	TCP	117	9999 → 56170 [PSH, ACK] Seq=205 Ack=151 Win=43520 Len=51 TSval=763960632 TSecr=4217136443 [TCP segment of a reassembled PDU]
20	4.010158	10.0.1.5	10.0.1.2	TCP	66	56170 → 9999 [ACK] Seq=151 Ack=256 Win=42496 Len=0 TSval=4217136443 TSecr=763960632
21	5.011008	10.0.1.5	10.0.1.2	TCP	96	56170 → 9999 [PSH, ACK] Seq=151 Ack=256 Win=42496 Len=30 TSval=4217137444 TSecr=763960632 [TCP segment of a reassembled PDU]
22	5.011215	10.0.1.2	10.0.1.5	TCP	117	9999 → 56170 [PSH, ACK] Seq=256 Ack=181 Win=43520 Len=51 TSval=763961633 TSecr=4217137444 [TCP segment of a reassembled PDU]
23	5.011224	10.0.1.5	10.0.1.2	TCP	66	56170 → 9999 [ACK] Seq=181 Ack=307 Win=42496 Len=0 TSval=4217137444 TSecr=763961633
24	6.012562	10.0.1.5	10.0.1.2	TCP	96	56170 → 9999 [PSH, ACK] Seq=181 Ack=307 Win=42496 Len=30 TSval=4217138445 TSecr=763961633 [TCP segment of a reassembled PDU]
25	6.012788	10.0.1.2	10.0.1.5	TCP	117	9999 → 56170 [PSH, ACK] Seq=307 Ack=211 Win=43520 Len=51 TSval=763962635 TSecr=4217138445 [TCP segment of a reassembled PDU]
26	6.012797	10.0.1.5	10.0.1.2	TCP	66	56170 → 9999 [ACK] Seq=211 Ack=358 Win=42496 Len=0 TSval=4217138446 TSecr=763962635
27	7.014207	10.0.1.5	10.0.1.2	TCP	96	56170 → 9999 [PSH, ACK] Seq=211 Ack=358 Win=42496 Len=30 TSval=4217139447 TSecr=763962635 [TCP segment of a reassembled PDU]
28	7.014363	10.0.1.2	10.0.1.5	TCP	117	9999 → 56170 [PSH, ACK] Seq=358 Ack=241 Win=43520 Len=51 TSval=763963636 TSecr=4217139447 [TCP segment of a reassembled PDU]
29	7.014373	10.0.1.5	10.0.1.2	TCP	66	56170 → 9999 [ACK] Seq=241 Ack=409 Win=42496 Len=0 TSval=4217139447 TSecr=763963636
30	8.015658	10.0.1.5	10.0.1.2	TCP	96	56170 → 9999 [PSH, ACK] Seq=241 Ack=409 Win=42496 Len=30 TSval=4217140448 TSecr=763963636 [TCP segment of a reassembled PDU]
31	8.015801	10.0.1.2	10.0.1.5	TCP	117	9999 → 56170 [PSH, ACK] Seq=409 Ack=271 Win=43520 Len=51 TSval=763964638 TSecr=4217140448 [TCP segment of a reassembled PDU]
32	8.015808	10.0.1.5	10.0.1.2	TCP	66	56170 → 9999 [ACK] Seq=271 Ack=460 Win=42496 Len=0 TSval=4217140449 TSecr=763964638
33	9.017028	10.0.1.5	10.0.1.2	TCP	96	56170 → 9999 [PSH, ACK] Seq=271 Ack=460 Win=42496 Len=30 TSval=4217141450 TSecr=763964638 [TCP segment of a reassembled PDU]
34	9.017191	10.0.1.2	10.0.1.5	TCP	117	9999 → 56170 [PSH, ACK] Seq=460 Ack=301 Win=43520 Len=51 TSval=763965639 TSecr=4217141450 [TCP segment of a reassembled PDU]
35	9.017200	10.0.1.5	10.0.1.2	TCP	66	56170 → 9999 [ACK] Seq=301 Ack=511 Win=42496 Len=0 TSval=4217141450 TSecr=763965639
36	10.017834	10.0.1.5	10.0.1.2	TCP	97	56170 → 9999 [PSH, ACK] Seq=301 Ack=511 Win=42496 Len=31 TSval=4217142451 TSecr=763965639 [TCP segment of a reassembled PDU]
37	10.018035	10.0.1.2	10.0.1.5	TCP	117	9999 → 56170 [PSH, ACK] Seq=511 Ack=332 Win=43520 Len=51 TSval=763966640 TSecr=4217142451 [TCP segment of a reassembled PDU]
38	10.018040	10.0.1.5	10.0.1.2	TCP	66	56170 → 9999 [ACK] Seq=332 Ack=562 Win=42496 Len=0 TSval=4217142451 TSecr=763966640
39	11.019352	10.0.1.5	10.0.1.2	TCP	97	56170 → 9999 [PSH, ACK] Seq=332 Ack=562 Win=42496 Len=31 TSval=4217143452 TSecr=763966640 [TCP segment of a reassembled PDU]
40	11.019490	10.0.1.2	10.0.1.5	TCP	117	9999 → 56170 [PSH, ACK] Seq=562 Ack=363 Win=43520 Len=51 TSval=763967641 TSecr=4217143452 [TCP segment of a reassembled PDU]
41	11.019498	10.0.1.5	10.0.1.2	TCP	66	56170 → 9999 [ACK] Seq=363 Ack=613 Win=42496 Len=0 TSval=4217143452 TSecr=763967641
42	12.020846	10.0.1.5	10.0.1.2	TCP	97	56170 → 9999 [PSH, ACK] Seq=363 Ack=613 Win=42496 Len=31 TSval=4217144454 TSecr=763967641 [TCP segment of a reassembled PDU]
43	12.021015	10.0.1.2	10.0.1.5	TCP	117	9999 → 56170 [PSH, ACK] Seq=613 Ack=394 Win=43520 Len=51 TSval=763968643 TSecr=4217144454 [TCP segment of a reassembled PDU]
44	12.021024	10.0.1.5	10.0.1.2	TCP	66	56170 → 9999 [ACK] Seq=394 Ack=664 Win=42496 Len=0 TSval=4217144454 TSecr=763968643
45	12.198684	10.0.1.5	10.0.1.2	TCP	66	56170 → 9999 [FIN, ACK] Seq=394 Ack=664 Win=42496 Len=0 TSval=4217144631 TSecr=763968643
46	12.198981	10.0.1.2	10.0.1.5	TCP	66	9999 → 56170 [FIN, ACK] Seq=664 Ack=395 Win=43520 Len=0 TSval=763968821 TSecr=4217144631
47	12.198993	10.0.1.5	10.0.1.2	TCP	66	56170 → 9999 [ACK] Seq=395 Ack=665 Win=42496 Len=0 TSval=4217144632 TSecr=763968821