1	0.000000	10.0.1.5	10.0.1.2	TCP	74	46642 → 9999 [SYN] Seq=0 Win=42340 Len=0 MSS=1460 SACK_PERM=1 TSval=4031382539 TSecr=0 WS=512
2	0.004789	10.0.1.2	10.0.1.5	TCP	74	9999 → 46642 [SYN, ACK] Seq=0 Ack=1 Win=43440 Len=0 MSS=1460 SACK_PERM=1 TSval=4177314028 TSecr=4031382539 WS=512
3	0.004814	10.0.1.5	10.0.1.2	TCP	66	46642 → 9999 [ACK] Seq=1 Ack=1 Win=42496 Len=0 TSval=4031382544 TSecr=4177314028
4	0.005260	10.0.1.5	10.0.1.2	TCP	96	46642 → 9999 [PSH, ACK] Seq=1 Ack=1 Win=42496 Len=30 TSval=4031382544 TSecr=4177314028 [TCP segment of a reassembled PDU]
5	0.007978	10.0.1.2	10.0.1.5	TCP	66	9999 → 46642 [ACK] Seq=1 Ack=31 Win=43520 Len=0 TSval=4177314030 TSecr=4031382544
6	0.008117	10.0.1.2	10.0.1.5	TCP	117	9999 → 46642 [PSH, ACK] Seq=1 Ack=31 Win=43520 Len=51 TSval=4177314031 TSecr=4031382544 [TCP segment of a reassembled PDU]
7	0.008133	10.0.1.5	10.0.1.2	TCP	66	46642 → 9999 [ACK] Seq=31 Ack=52 Win=42496 Len=0 TSval=4031382547 TSecr=4177314031
8	1.010062	10.0.1.5	10.0.1.2	TCP	96	46642 → 9999 [PSH, ACK] Seq=31 Ack=52 Win=42496 Len=30 TSval=4031383549 TSecr=4177314031 [TCP segment of a reassembled PDU]
9	1.011846	10.0.1.2	10.0.1.5	TCP	117	9999 → 46642 [PSH, ACK] Seq=52 Ack=61 Win=43520 Len=51 TSval=4177315036 TSecr=4031383549 [TCP segment of a reassembled PDU]
10	1.011880	10.0.1.5	10.0.1.2	TCP	66	46642 → 9999 [ACK] Seq=61 Ack=103 Win=42496 Len=0 TSval=4031383551 TSecr=4177315036
11	2.013621	10.0.1.5	10.0.1.2	TCP	96	46642 → 9999 [PSH, ACK] Seq=61 Ack=103 Win=42496 Len=30 TSval=4031384553 TSecr=4177315036 [TCP segment of a reassembled PDU]
12	2.014049	10.0.1.2	10.0.1.5	TCP	117	9999 → 46642 [PSH, ACK] Seq=103 Ack=91 Win=43520 Len=51 TSval=4177316039 TSecr=4031384553 [TCP segment of a reassembled PDU]
13	2.014074	10.0.1.5	10.0.1.2	TCP	66	46642 → 9999 [ACK] Seq=91 Ack=154 Win=42496 Len=0 TSval=4031384553 TSecr=4177316039
14	3.016616	10.0.1.5	10.0.1.2	TCP	96	46642 → 9999 [PSH, ACK] Seq=91 Ack=154 Win=42496 Len=30 TSval=4031385556 TSecr=4177316039 [TCP segment of a reassembled PDU]
15	3.017212	10.0.1.2	10.0.1.5	TCP	117	9999 → 46642 [PSH, ACK] Seq=154 Ack=121 Win=43520 Len=51 TSval=4177317042 TSecr=4031385556 [TCP segment of a reassembled PDU]
16	3.017244	10.0.1.5	10.0.1.2	TCP	66	46642 → 9999 [ACK] Seq=121 Ack=205 Win=42496 Len=0 TSval=4031385556 TSecr=4177317042
17	4.018941	10.0.1.5	10.0.1.2	TCP	96	46642 → 9999 [PSH, ACK] Seq=121 Ack=205 Win=42496 Len=30 TSval=4031386558 TSecr=4177317042 [TCP segment of a reassembled PDU]
18	4.019494	10.0.1.2	10.0.1.5	TCP	117	9999 → 46642 [PSH, ACK] Seq=205 Ack=151 Win=43520 Len=51 TSval=4177318045 TSecr=4031386558 [TCP segment of a reassembled PDU]
19	4.019523	10.0.1.5	10.0.1.2	TCP	66	46642 → 9999 [ACK] Seq=151 Ack=256 Win=42496 Len=0 TSval=4031386559 TSecr=4177318045
20	5.021754	10.0.1.5	10.0.1.2	TCP	96	46642 → 9999 [PSH, ACK] Seq=151 Ack=256 Win=42496 Len=30 TSval=4031387561 TSecr=4177318045 [TCP segment of a reassembled PDU]
21	5.021959	10.0.1.2	10.0.1.5	TCP	117	9999 → 46642 [PSH, ACK] Seq=256 Ack=181 Win=43520 Len=51 TSval=4177319047 TSecr=4031387561 [TCP segment of a reassembled PDU]
22	5.021973	10.0.1.5	10.0.1.2	TCP	66	46642 → 9999 [ACK] Seq=181 Ack=307 Win=42496 Len=0 TSval=4031387561 TSecr=4177319047
23	6.023226	10.0.1.5	10.0.1.2	TCP	96	46642 → 9999 [PSH, ACK] Seq=181 Ack=307 Win=42496 Len=30 TSval=4031388562 TSecr=4177319047 [TCP segment of a reassembled PDU]
24	6.023998	10.0.1.2	10.0.1.5	TCP	117	9999 → 46642 [PSH, ACK] Seq=307 Ack=211 Win=43520 Len=51 TSval=4177320049 TSecr=4031388562 [TCP segment of a reassembled PDU]
25	6.024026	10.0.1.5	10.0.1.2	TCP	66	46642 → 9999 [ACK] Seq=211 Ack=358 Win=42496 Len=0 TSval=4031388563 TSecr=4177320049
26	7.026421	10.0.1.5	10.0.1.2	TCP	96	46642 → 9999 [PSH, ACK] Seq=211 Ack=358 Win=42496 Len=30 TSval=4031389566 TSecr=4177320049 [TCP segment of a reassembled PDU]
27	7.026735	10.0.1.2	10.0.1.5	TCP	117	9999 → 46642 [PSH, ACK] Seq=358 Ack=241 Win=43520 Len=51 TSval=4177321052 TSecr=4031389566 [TCP segment of a reassembled PDU]
28	7.026752	10.0.1.5	10.0.1.2	TCP	66	46642 → 9999 [ACK] Seq=241 Ack=409 Win=42496 Len=0 TSval=4031389566 TSecr=4177321052
29	8.028772	10.0.1.5	10.0.1.2	TCP	96	46642 → 9999 [PSH, ACK] Seq=241 Ack=409 Win=42496 Len=30 TSval=4031390568 TSecr=4177321052 [TCP segment of a reassembled PDU]
30	8.029616	10.0.1.2	10.0.1.5	TCP	117	9999 → 46642 [PSH, ACK] Seq=409 Ack=271 Win=43520 Len=51 TSval=4177322055 TSecr=4031390568 [TCP segment of a reassembled PDU]
31	8.029648	10.0.1.5	10.0.1.2	TCP	66	46642 → 9999 [ACK] Seq=271 Ack=460 Win=42496 Len=0 TSval=4031390569 TSecr=4177322055
32	9.031610	10.0.1.5	10.0.1.2	TCP	96	46642 → 9999 [PSH, ACK] Seq=271 Ack=460 Win=42496 Len=30 TSval=4031391571 TSecr=4177322055 [TCP segment of a reassembled PDU]
33	9.032215	10.0.1.2	10.0.1.5	TCP	117	9999 → 46642 [PSH, ACK] Seq=460 Ack=301 Win=43520 Len=51 TSval=4177323057 TSecr=4031391571 [TCP segment of a reassembled PDU]
34	9.032251	10.0.1.5	10.0.1.2	TCP	66	46642 → 9999 [ACK] Seq=301 Ack=511 Win=42496 Len=0 TSval=4031391571 TSecr=4177323057
35	10.034233	10.0.1.5	10.0.1.2	TCP	97	46642 → 9999 [PSH, ACK] Seq=301 Ack=511 Win=42496 Len=31 TSval=4031392573 TSecr=4177323057 [TCP segment of a reassembled PDU]
36	10.034730	10.0.1.2	10.0.1.5	TCP	117	9999 → 46642 [PSH, ACK] Seq=511 Ack=332 Win=43520 Len=51 TSval=4177324060 TSecr=4031392573 [TCP segment of a reassembled PDU]
37	10.034759	10.0.1.5	10.0.1.2	TCP	66	46642 → 9999 [ACK] Seq=332 Ack=562 Win=42496 Len=0 TSval=4031392574 TSecr=4177324060
38	11.036806	10.0.1.5	10.0.1.2	TCP	97	46642 → 9999 [PSH, ACK] Seq=332 Ack=562 Win=42496 Len=31 TSval=4031393576 TSecr=4177324060 [TCP segment of a reassembled PDU]
39	11.037265	10.0.1.2	10.0.1.5	TCP	117	9999 → 46642 [PSH, ACK] Seq=562 Ack=363 Win=43520 Len=51 TSval=4177325062 TSecr=4031393576 [TCP segment of a reassembled PDU]
40	11.037293	10.0.1.5	10.0.1.2	TCP	66	46642 → 9999 [ACK] Seq=363 Ack=613 Win=42496 Len=0 TSval=4031393576 TSecr=4177325062
41	12.040062	10.0.1.5	10.0.1.2	TCP	97	46642 → 9999 [PSH, ACK] Seq=363 Ack=613 Win=42496 Len=31 TSval=4031394579 TSecr=4177325062 [TCP segment of a reassembled PDU]
42	12.040714	10.0.1.2	10.0.1.5	TCP	117	9999 → 46642 [PSH, ACK] Seq=613 Ack=394 Win=43520 Len=51 TSval=4177326066 TSecr=4031394579 [TCP segment of a reassembled PDU]
43	12.040744	10.0.1.5	10.0.1.2	TCP	66	46642 → 9999 [ACK] Seq=394 Ack=664 Win=42496 Len=0 TSval=4031394580 TSecr=4177326066
44	13.042948	10.0.1.5	10.0.1.2	TCP	97	46642 → 9999 [PSH, ACK] Seq=394 Ack=664 Win=42496 Len=31 TSval=4031395582 TSecr=4177326066 [TCP segment of a reassembled PDU]
45	13.043351	10.0.1.2	10.0.1.5	TCP	117	9999 → 46642 [PSH, ACK] Seq=664 Ack=425 Win=43520 Len=51 TSval=4177327068 TSecr=4031395582 [TCP segment of a reassembled PDU]
46	13.043440	10.0.1.5	10.0.1.2	TCP	66	46642 → 9999 [ACK] Seq=425 Ack=715 Win=42496 Len=0 TSval=4031395582 TSecr=4177327068
47	14.045647	10.0.1.5	10.0.1.2	TCP	97	46642 → 9999 [PSH, ACK] Seq=425 Ack=715 Win=42496 Len=31 TSval=4031396585 TSecr=4177327068 [TCP segment of a reassembled PDU]
48	14.046170	10.0.1.2	10.0.1.5	TCP	117	9999 → 46642 [PSH, ACK] Seq=715 Ack=456 Win=43520 Len=51 TSval=4177328071 TSecr=4031396585 [TCP segment of a reassembled PDU]
49	14.046197	10.0.1.5	10.0.1.2	TCP	66	46642 → 9999 [ACK] Seq=456 Ack=766 Win=42496 Len=0 TSval=4031396585 TSecr=4177328071
50	15.048141	10.0.1.5	10.0.1.2	TCP	97	46642 → 9999 [PSH, ACK] Seq=456 Ack=766 Win=42496 Len=31 TSval=4031397587 TSecr=4177328071 [TCP segment of a reassembled PDU]
51	15.049834	10.0.1.2	10.0.1.5	TCP	117	9999 → 46642 [PSH, ACK] Seq=766 Ack=487 Win=43520 Len=51 TSval=4177329075 TSecr=4031397587 [TCP segment of a reassembled PDU]
52	15.049863	10.0.1.5	10.0.1.2	TCP	66	46642 → 9999 [ACK] Seq=487 Ack=817 Win=42496 Len=0 TSval=4031397589 TSecr=4177329075
53	16.052127	10.0.1.5	10.0.1.2	TCP	97	46642 → 9999 [PSH, ACK] Seq=487 Ack=817 Win=42496 Len=31 TSval=4031398591 TSecr=4177329075 [TCP segment of a reassembled PDU]
54	16.052736	10.0.1.2	10.0.1.5	TCP	117	9999 → 46642 [PSH, ACK] Seq=817 Ack=518 Win=43520 Len=51 TSval=4177330078 TSecr=4031398591 [TCP segment of a reassembled PDU]
55	16.052769	10.0.1.5	10.0.1.2	TCP	66	46642 → 9999 [ACK] Seq=518 Ack=868 Win=42496 Len=0 TSval=4031398592 TSecr=4177330078
56	17.054704	10.0.1.5	10.0.1.2	TCP	97	46642 → 9999 [PSH, ACK] Seq=518 Ack=868 Win=42496 Len=31 TSval=4031399594 TSecr=4177330078 [TCP segment of a reassembled PDU]
57	17.055540	10.0.1.2	10.0.1.5	TCP	117	9999 → 46642 [PSH, ACK] Seq=868 Ack=549 Win=43520 Len=51 TSval=4177331081 TSecr=4031399594 [TCP segment of a reassembled PDU]
58	17.055575	10.0.1.5	10.0.1.2	TCP	66	46642 → 9999 [ACK] Seq=549 Ack=919 Win=42496 Len=0 TSval=4031399595 TSecr=4177331081
59	18.057605	10.0.1.5	10.0.1.2	TCP	97	46642 → 9999 [PSH, ACK] Seq=549 Ack=919 Win=42496 Len=31 TSval=4031400597 TSecr=4177331081 [TCP segment of a reassembled PDU]
60	18.057900	10.0.1.2	10.0.1.5	TCP	117	9999 → 46642 [PSH, ACK] Seq=919 Ack=580 Win=43520 Len=51 TSval=4177332083 TSecr=4031400597 [TCP segment of a reassembled PDU]
61	18.057921	10.0.1.5	10.0.1.2	TCP	66	46642 → 9999 [ACK] Seq=580 Ack=970 Win=42496 Len=0 TSval=4031400597 TSecr=4177332083
62	19.059647	10.0.1.5	10.0.1.2	TCP	97	46642 → 9999 [PSH, ACK] Seq=580 Ack=970 Win=42496 Len=31 TSval=4031401599 TSecr=4177332083 [TCP segment of a reassembled PDU]
63	19.060086	10.0.1.2	10.0.1.5	TCP	117	9999 → 46642 [PSH, ACK] Seq=970 Ack=611 Win=43520 Len=51 TSval=4177333085 TSecr=4031401599 [TCP segment of a reassembled PDU]
64	19.060116	10.0.1.5	10.0.1.2	TCP	66	46642 → 9999 [ACK] Seq=611 Ack=1021 Win=42496 Len=0 TSval=4031401599 TSecr=4177333085
65	19.798589	10.0.1.5	10.0.1.2	TCP	66	46642 → 9999 [FIN, ACK] Seq=611 Ack=1021 Win=42496 Len=0 TSval=4031402338 TSecr=4177333085
66	19.799910	10.0.1.2	10.0.1.5	TCP	66	9999 → 46642 [FIN, ACK] Seq=1021 Ack=612 Win=43520 Len=0 TSval=4177333825 TSecr=4031402338
67	19.799932	10.0.1.5	10.0.1.2	TCP	66	46642 → 9999 [ACK] Seq=612 Ack=1022 Win=42496 Len=0 TSval=4031402339 TSecr=4177333825