1	0.000000	10.0.1.5	10.0.1.2	TCP	74	46330 → 9999 [SYN] Seq=0 Win=42340 Len=0 MSS=1460 SACK_PERM=1 TSval=4216281538 TSecr=0 WS=512
2	0.001790	10.0.1.2	10.0.1.5	TCP	74	9999 → 46330 [SYN, ACK] Seq=0 Ack=1 Win=43440 Len=0 MSS=1460 SACK_PERM=1 TSval=2637137455 TSecr=4216281538 WS=512
3	0.001813	10.0.1.5	10.0.1.2	TCP	66	46330 → 9999 [ACK] Seq=1 Ack=1 Win=42496 Len=0 TSval=4216281539 TSecr=2637137455
4	0.001836	10.0.1.5	10.0.1.2	TCP	96	46330 → 9999 [PSH, ACK] Seq=1 Ack=1 Win=42496 Len=30 TSval=4216281539 TSecr=2637137455 [TCP segment of a reassembled PDU]
5	0.003523	10.0.1.2	10.0.1.5	TCP	54	9999 → 46330 [RST] Seq=1 Win=0 Len=0
6	0.003546	10.0.1.2	10.0.1.5	TCP	54	9999 → 46330 [RST] Seq=1 Win=0 Len=0
7	1.045031	10.0.1.2	10.0.1.5	TCP	74	[TCP Retransmission] 9999 → 46330 [SYN, ACK] Seq=0 Ack=1 Win=43440 Len=0 MSS=1460 SACK_PERM=1 TSval=2637138499 TSecr=4216281538 WS=512
8	1.045068	10.0.1.5	10.0.1.2	TCP	54	46330 → 9999 [RST] Seq=1 Win=0 Len=0
9	2.681689	10.0.1.5	10.0.1.2	TCP	74	46344 → 9999 [SYN] Seq=0 Win=42340 Len=0 MSS=1460 SACK_PERM=1 TSval=4216284219 TSecr=0 WS=512
10	2.681885	10.0.1.2	10.0.1.5	TCP	74	9999 → 46344 [SYN, ACK] Seq=0 Ack=1 Win=43440 Len=0 MSS=1460 SACK_PERM=1 TSval=763108409 TSecr=4216284219 WS=512
11	2.681895	10.0.1.5	10.0.1.2	TCP	66	46344 → 9999 [ACK] Seq=1 Ack=1 Win=42496 Len=0 TSval=4216284220 TSecr=763108409
12	2.682011	10.0.1.5	10.0.1.2	TCP	96	46344 → 9999 [PSH, ACK] Seq=1 Ack=1 Win=42496 Len=30 TSval=4216284220 TSecr=763108409 [TCP segment of a reassembled PDU]
13	2.682016	10.0.1.2	10.0.1.5	TCP	66	9999 → 46344 [ACK] Seq=1 Ack=31 Win=43520 Len=0 TSval=763108409 TSecr=4216284220
14	2.682305	10.0.1.2	10.0.1.5	TCP	117	9999 → 46344 [PSH, ACK] Seq=1 Ack=31 Win=43520 Len=51 TSval=763108409 TSecr=4216284220 [TCP segment of a reassembled PDU]
15	2.682368	10.0.1.5	10.0.1.2	TCP	66	46344 → 9999 [ACK] Seq=31 Ack=52 Win=42496 Len=0 TSval=4216284220 TSecr=763108409
16	3.683600	10.0.1.5	10.0.1.2	TCP	96	46344 → 9999 [PSH, ACK] Seq=31 Ack=52 Win=42496 Len=30 TSval=4216285221 TSecr=763108409 [TCP segment of a reassembled PDU]
17	3.683996	10.0.1.2	10.0.1.5	TCP	117	9999 → 46344 [PSH, ACK] Seq=52 Ack=61 Win=43520 Len=51 TSval=763109411 TSecr=4216285221 [TCP segment of a reassembled PDU]
18	3.684009	10.0.1.5	10.0.1.2	TCP	66	46344 → 9999 [ACK] Seq=61 Ack=103 Win=42496 Len=0 TSval=4216285222 TSecr=763109411
19	4.685419	10.0.1.5	10.0.1.2	TCP	96	46344 → 9999 [PSH, ACK] Seq=61 Ack=103 Win=42496 Len=30 TSval=4216286223 TSecr=763109411 [TCP segment of a reassembled PDU]
20	4.685649	10.0.1.2	10.0.1.5	TCP	117	9999 → 46344 [PSH, ACK] Seq=103 Ack=91 Win=43520 Len=51 TSval=763110412 TSecr=4216286223 [TCP segment of a reassembled PDU]
21	4.685663	10.0.1.5	10.0.1.2	TCP	66	46344 → 9999 [ACK] Seq=91 Ack=154 Win=42496 Len=0 TSval=4216286223 TSecr=763110412
22	5.461159	00:00:00_00:00:02	00:00:00_00:00:03	ARP	42	Who has 10.0.1.5? Tell 10.0.1.3
23	5.461167	00:00:00_00:00:03	00:00:00_00:00:02	ARP	42	10.0.1.5 is at 00:00:00:00:00:03
24	5.687081	10.0.1.5	10.0.1.2	TCP	96	46344 → 9999 [PSH, ACK] Seq=91 Ack=154 Win=42496 Len=30 TSval=4216287225 TSecr=763110412 [TCP segment of a reassembled PDU]
25	5.687365	10.0.1.2	10.0.1.5	TCP	117	9999 → 46344 [PSH, ACK] Seq=154 Ack=121 Win=43520 Len=51 TSval=763111414 TSecr=4216287225 [TCP segment of a reassembled PDU]
26	5.687380	10.0.1.5	10.0.1.2	TCP	66	46344 → 9999 [ACK] Seq=121 Ack=205 Win=42496 Len=0 TSval=4216287225 TSecr=763111414
27	6.688786	10.0.1.5	10.0.1.2	TCP	96	46344 → 9999 [PSH, ACK] Seq=121 Ack=205 Win=42496 Len=30 TSval=4216288226 TSecr=763111414 [TCP segment of a reassembled PDU]
28	6.689043	10.0.1.2	10.0.1.5	TCP	117	9999 → 46344 [PSH, ACK] Seq=205 Ack=151 Win=43520 Len=51 TSval=763112416 TSecr=4216288226 [TCP segment of a reassembled PDU]
29	6.689052	10.0.1.5	10.0.1.2	TCP	66	46344 → 9999 [ACK] Seq=151 Ack=256 Win=42496 Len=0 TSval=4216288227 TSecr=763112416
30	7.690475	10.0.1.5	10.0.1.2	TCP	96	46344 → 9999 [PSH, ACK] Seq=151 Ack=256 Win=42496 Len=30 TSval=4216289228 TSecr=763112416 [TCP segment of a reassembled PDU]
31	7.690770	10.0.1.2	10.0.1.5	TCP	117	9999 → 46344 [PSH, ACK] Seq=256 Ack=181 Win=43520 Len=51 TSval=763113417 TSecr=4216289228 [TCP segment of a reassembled PDU]
32	7.690782	10.0.1.5	10.0.1.2	TCP	66	46344 → 9999 [ACK] Seq=181 Ack=307 Win=42496 Len=0 TSval=4216289228 TSecr=763113417
33	8.692097	10.0.1.5	10.0.1.2	TCP	96	46344 → 9999 [PSH, ACK] Seq=181 Ack=307 Win=42496 Len=30 TSval=4216290230 TSecr=763113417 [TCP segment of a reassembled PDU]
34	8.692342	10.0.1.2	10.0.1.5	TCP	117	9999 → 46344 [PSH, ACK] Seq=307 Ack=211 Win=43520 Len=51 TSval=763114419 TSecr=4216290230 [TCP segment of a reassembled PDU]
35	8.692350	10.0.1.5	10.0.1.2	TCP	66	46344 → 9999 [ACK] Seq=211 Ack=358 Win=42496 Len=0 TSval=4216290230 TSecr=763114419
36	9.693758	10.0.1.5	10.0.1.2	TCP	96	46344 → 9999 [PSH, ACK] Seq=211 Ack=358 Win=42496 Len=30 TSval=4216291231 TSecr=763114419 [TCP segment of a reassembled PDU]
37	9.693996	10.0.1.2	10.0.1.5	TCP	117	9999 → 46344 [PSH, ACK] Seq=358 Ack=241 Win=43520 Len=51 TSval=763115421 TSecr=4216291231 [TCP segment of a reassembled PDU]
38	9.694009	10.0.1.5	10.0.1.2	TCP	66	46344 → 9999 [ACK] Seq=241 Ack=409 Win=42496 Len=0 TSval=4216291232 TSecr=763115421
39	10.340168	fe80::4cb8:5fff:feea:9ee6	ff02::fb	MDNS	107	Standard query 0x0000 PTR _ipps._tcp.local, "QM" question PTR _ipp._tcp.local, "QM" question
40	10.695331	10.0.1.5	10.0.1.2	TCP	96	46344 → 9999 [PSH, ACK] Seq=241 Ack=409 Win=42496 Len=30 TSval=4216292233 TSecr=763115421 [TCP segment of a reassembled PDU]
41	10.695584	10.0.1.2	10.0.1.5	TCP	117	9999 → 46344 [PSH, ACK] Seq=409 Ack=271 Win=43520 Len=51 TSval=763116422 TSecr=4216292233 [TCP segment of a reassembled PDU]
42	10.695594	10.0.1.5	10.0.1.2	TCP	66	46344 → 9999 [ACK] Seq=271 Ack=460 Win=42496 Len=0 TSval=4216292233 TSecr=763116422
43	11.696978	10.0.1.5	10.0.1.2	TCP	96	46344 → 9999 [PSH, ACK] Seq=271 Ack=460 Win=42496 Len=30 TSval=4216293235 TSecr=763116422 [TCP segment of a reassembled PDU]
44	11.697260	10.0.1.2	10.0.1.5	TCP	117	9999 → 46344 [PSH, ACK] Seq=460 Ack=301 Win=43520 Len=51 TSval=763117424 TSecr=4216293235 [TCP segment of a reassembled PDU]
45	11.697270	10.0.1.5	10.0.1.2	TCP	66	46344 → 9999 [ACK] Seq=301 Ack=511 Win=42496 Len=0 TSval=4216293235 TSecr=763117424
46	12.698898	10.0.1.5	10.0.1.2	TCP	97	46344 → 9999 [PSH, ACK] Seq=301 Ack=511 Win=42496 Len=31 TSval=4216294237 TSecr=763117424 [TCP segment of a reassembled PDU]
47	12.699134	10.0.1.2	10.0.1.5	TCP	117	9999 → 46344 [PSH, ACK] Seq=511 Ack=332 Win=43520 Len=51 TSval=763118426 TSecr=4216294237 [TCP segment of a reassembled PDU]
48	12.699153	10.0.1.5	10.0.1.2	TCP	66	46344 → 9999 [ACK] Seq=332 Ack=562 Win=42496 Len=0 TSval=4216294237 TSecr=763118426
49	13.700909	10.0.1.5	10.0.1.2	TCP	97	46344 → 9999 [PSH, ACK] Seq=332 Ack=562 Win=42496 Len=31 TSval=4216295239 TSecr=763118426 [TCP segment of a reassembled PDU]
50	13.701020	10.0.1.2	10.0.1.5	TCP	117	9999 → 46344 [PSH, ACK] Seq=562 Ack=363 Win=43520 Len=51 TSval=763119428 TSecr=4216295239 [TCP segment of a reassembled PDU]
51	13.701028	10.0.1.5	10.0.1.2	TCP	66	46344 → 9999 [ACK] Seq=363 Ack=613 Win=42496 Len=0 TSval=4216295239 TSecr=763119428
52	14.702278	10.0.1.5	10.0.1.2	TCP	97	46344 → 9999 [PSH, ACK] Seq=363 Ack=613 Win=42496 Len=31 TSval=4216296240 TSecr=763119428 [TCP segment of a reassembled PDU]
53	14.703484	10.0.1.2	10.0.1.5	TCP	117	9999 → 46344 [PSH, ACK] Seq=613 Ack=394 Win=43520 Len=51 TSval=763120430 TSecr=4216296240 [TCP segment of a reassembled PDU]
54	14.703492	10.0.1.5	10.0.1.2	TCP	66	46344 → 9999 [ACK] Seq=394 Ack=664 Win=42496 Len=0 TSval=4216296241 TSecr=763120430
55	15.704673	10.0.1.5	10.0.1.2	TCP	97	46344 → 9999 [PSH, ACK] Seq=394 Ack=664 Win=42496 Len=31 TSval=4216297242 TSecr=763120430 [TCP segment of a reassembled PDU]
56	15.704777	10.0.1.2	10.0.1.5	TCP	117	9999 → 46344 [PSH, ACK] Seq=664 Ack=425 Win=43520 Len=51 TSval=763121431 TSecr=4216297242 [TCP segment of a reassembled PDU]
57	15.704783	10.0.1.5	10.0.1.2	TCP	66	46344 → 9999 [ACK] Seq=425 Ack=715 Win=42496 Len=0 TSval=4216297242 TSecr=763121431
58	16.705944	10.0.1.5	10.0.1.2	TCP	97	46344 → 9999 [PSH, ACK] Seq=425 Ack=715 Win=42496 Len=31 TSval=4216298244 TSecr=763121431 [TCP segment of a reassembled PDU]
59	16.706037	10.0.1.2	10.0.1.5	TCP	117	9999 → 46344 [PSH, ACK] Seq=715 Ack=456 Win=43520 Len=51 TSval=763122433 TSecr=4216298244 [TCP segment of a reassembled PDU]
60	16.706043	10.0.1.5	10.0.1.2	TCP	66	46344 → 9999 [ACK] Seq=456 Ack=766 Win=42496 Len=0 TSval=4216298244 TSecr=763122433
61	17.707277	10.0.1.5	10.0.1.2	TCP	97	46344 → 9999 [PSH, ACK] Seq=456 Ack=766 Win=42496 Len=31 TSval=4216299245 TSecr=763122433 [TCP segment of a reassembled PDU]
62	17.707454	10.0.1.2	10.0.1.5	TCP	117	9999 → 46344 [PSH, ACK] Seq=766 Ack=487 Win=43520 Len=51 TSval=763123434 TSecr=4216299245 [TCP segment of a reassembled PDU]
63	17.707459	10.0.1.5	10.0.1.2	TCP	66	46344 → 9999 [ACK] Seq=487 Ack=817 Win=42496 Len=0 TSval=4216299245 TSecr=763123434
64	18.708669	10.0.1.5	10.0.1.2	TCP	97	46344 → 9999 [PSH, ACK] Seq=487 Ack=817 Win=42496 Len=31 TSval=4216300246 TSecr=763123434 [TCP segment of a reassembled PDU]
65	18.708758	10.0.1.2	10.0.1.5	TCP	117	9999 → 46344 [PSH, ACK] Seq=817 Ack=518 Win=43520 Len=51 TSval=763124435 TSecr=4216300246 [TCP segment of a reassembled PDU]
66	18.708764	10.0.1.5	10.0.1.2	TCP	66	46344 → 9999 [ACK] Seq=518 Ack=868 Win=42496 Len=0 TSval=4216300246 TSecr=763124435
67	19.709918	10.0.1.5	10.0.1.2	TCP	97	46344 → 9999 [PSH, ACK] Seq=518 Ack=868 Win=42496 Len=31 TSval=4216301248 TSecr=763124435 [TCP segment of a reassembled PDU]
68	19.710080	10.0.1.2	10.0.1.5	TCP	117	9999 → 46344 [PSH, ACK] Seq=868 Ack=549 Win=43520 Len=51 TSval=763125437 TSecr=4216301248 [TCP segment of a reassembled PDU]
69	19.710087	10.0.1.5	10.0.1.2	TCP	66	46344 → 9999 [ACK] Seq=549 Ack=919 Win=42496 Len=0 TSval=4216301248 TSecr=763125437
70	20.711345	10.0.1.5	10.0.1.2	TCP	97	46344 → 9999 [PSH, ACK] Seq=549 Ack=919 Win=42496 Len=31 TSval=4216302249 TSecr=763125437 [TCP segment of a reassembled PDU]
71	20.711482	10.0.1.2	10.0.1.5	TCP	117	9999 → 46344 [PSH, ACK] Seq=919 Ack=580 Win=43520 Len=51 TSval=763126438 TSecr=4216302249 [TCP segment of a reassembled PDU]
72	20.711490	10.0.1.5	10.0.1.2	TCP	66	46344 → 9999 [ACK] Seq=580 Ack=970 Win=42496 Len=0 TSval=4216302249 TSecr=763126438
73	21.712861	10.0.1.5	10.0.1.2	TCP	97	46344 → 9999 [PSH, ACK] Seq=580 Ack=970 Win=42496 Len=31 TSval=4216303251 TSecr=763126438 [TCP segment of a reassembled PDU]
74	21.713138	10.0.1.2	10.0.1.5	TCP	117	9999 → 46344 [PSH, ACK] Seq=970 Ack=611 Win=43520 Len=51 TSval=763127440 TSecr=4216303251 [TCP segment of a reassembled PDU]
75	21.713147	10.0.1.5	10.0.1.2	TCP	66	46344 → 9999 [ACK] Seq=611 Ack=1021 Win=42496 Len=0 TSval=4216303251 TSecr=763127440
76	22.714423	10.0.1.5	10.0.1.2	TCP	97	46344 → 9999 [PSH, ACK] Seq=611 Ack=1021 Win=42496 Len=31 TSval=4216304252 TSecr=763127440 [TCP segment of a reassembled PDU]
77	22.714644	10.0.1.2	10.0.1.5	TCP	117	9999 → 46344 [PSH, ACK] Seq=1021 Ack=642 Win=43520 Len=51 TSval=763128441 TSecr=4216304252 [TCP segment of a reassembled PDU]
78	22.714653	10.0.1.5	10.0.1.2	TCP	66	46344 → 9999 [ACK] Seq=642 Ack=1072 Win=42496 Len=0 TSval=4216304252 TSecr=763128441
79	23.546123	10.0.1.5	10.0.1.2	TCP	66	46344 → 9999 [FIN, ACK] Seq=642 Ack=1072 Win=42496 Len=0 TSval=4216305084 TSecr=763128441
80	23.546334	10.0.1.2	10.0.1.5	TCP	66	9999 → 46344 [FIN, ACK] Seq=1072 Ack=643 Win=43520 Len=0 TSval=763129273 TSecr=4216305084
81	23.546342	10.0.1.5	10.0.1.2	TCP	66	46344 → 9999 [ACK] Seq=643 Ack=1073 Win=42496 Len=0 TSval=4216305084 TSecr=763129273