1	0.000000	00:00:00_00:00:03	Broadcast	ARP	42	Who has 10.0.1.2? Tell 10.0.1.5
2	0.001757	00:00:00_00:00:01	00:00:00_00:00:03	ARP	42	10.0.1.2 is at 00:00:00:00:00:01
3	0.001760	10.0.1.5	10.0.1.2	TCP	74	37828 → 9999 [SYN] Seq=0 Win=42340 Len=0 MSS=1460 SACK_PERM=1 TSval=4215887576 TSecr=0 WS=512
4	0.004154	00:00:00_00:00:02	Broadcast	ARP	42	Who has 10.0.1.5? Tell 10.0.1.3
5	0.004158	00:00:00_00:00:03	00:00:00_00:00:02	ARP	42	10.0.1.5 is at 00:00:00:00:00:03
6	0.004608	10.0.1.2	10.0.1.5	TCP	74	9999 → 37828 [SYN, ACK] Seq=0 Ack=1 Win=43440 Len=0 MSS=1460 SACK_PERM=1 TSval=2636743495 TSecr=4215887576 WS=512
7	0.004628	10.0.1.5	10.0.1.2	TCP	66	37828 → 9999 [ACK] Seq=1 Ack=1 Win=42496 Len=0 TSval=4215887580 TSecr=2636743495
8	0.004675	10.0.1.5	10.0.1.2	TCP	96	37828 → 9999 [PSH, ACK] Seq=1 Ack=1 Win=42496 Len=30 TSval=4215887580 TSecr=2636743495 [TCP segment of a reassembled PDU]
9	0.004688	10.0.1.2	10.0.1.5	TCP	66	9999 → 37828 [ACK] Seq=1 Ack=31 Win=43520 Len=0 TSval=2636743496 TSecr=4215887580
10	0.004895	10.0.1.2	10.0.1.5	TCP	117	9999 → 37828 [PSH, ACK] Seq=1 Ack=31 Win=43520 Len=51 TSval=2636743497 TSecr=4215887580 [TCP segment of a reassembled PDU]
11	0.004908	10.0.1.5	10.0.1.2	TCP	66	37828 → 9999 [ACK] Seq=31 Ack=52 Win=42496 Len=0 TSval=4215887581 TSecr=2636743497
12	1.006084	10.0.1.5	10.0.1.2	TCP	96	37828 → 9999 [PSH, ACK] Seq=31 Ack=52 Win=42496 Len=30 TSval=4215888582 TSecr=2636743497 [TCP segment of a reassembled PDU]
13	1.006357	10.0.1.2	10.0.1.5	TCP	117	9999 → 37828 [PSH, ACK] Seq=52 Ack=61 Win=43520 Len=51 TSval=2636744498 TSecr=4215888582 [TCP segment of a reassembled PDU]
14	1.006374	10.0.1.5	10.0.1.2	TCP	66	37828 → 9999 [ACK] Seq=61 Ack=103 Win=42496 Len=0 TSval=4215888582 TSecr=2636744498
15	2.007794	10.0.1.5	10.0.1.2	TCP	96	37828 → 9999 [PSH, ACK] Seq=61 Ack=103 Win=42496 Len=30 TSval=4215889583 TSecr=2636744498 [TCP segment of a reassembled PDU]
16	2.008106	10.0.1.2	10.0.1.5	TCP	117	9999 → 37828 [PSH, ACK] Seq=103 Ack=91 Win=43520 Len=51 TSval=2636745500 TSecr=4215889583 [TCP segment of a reassembled PDU]
17	2.008117	10.0.1.5	10.0.1.2	TCP	66	37828 → 9999 [ACK] Seq=91 Ack=154 Win=42496 Len=0 TSval=4215889584 TSecr=2636745500
18	3.008933	10.0.1.5	10.0.1.2	TCP	96	37828 → 9999 [PSH, ACK] Seq=91 Ack=154 Win=42496 Len=30 TSval=4215890585 TSecr=2636745500 [TCP segment of a reassembled PDU]
19	3.009094	10.0.1.2	10.0.1.5	TCP	117	9999 → 37828 [PSH, ACK] Seq=154 Ack=121 Win=43520 Len=51 TSval=2636746501 TSecr=4215890585 [TCP segment of a reassembled PDU]
20	3.009104	10.0.1.5	10.0.1.2	TCP	66	37828 → 9999 [ACK] Seq=121 Ack=205 Win=42496 Len=0 TSval=4215890585 TSecr=2636746501
21	4.009969	10.0.1.5	10.0.1.2	TCP	96	37828 → 9999 [PSH, ACK] Seq=121 Ack=205 Win=42496 Len=30 TSval=4215891586 TSecr=2636746501 [TCP segment of a reassembled PDU]
22	4.010211	10.0.1.2	10.0.1.5	TCP	117	9999 → 37828 [PSH, ACK] Seq=205 Ack=151 Win=43520 Len=51 TSval=2636747502 TSecr=4215891586 [TCP segment of a reassembled PDU]
23	4.010218	10.0.1.5	10.0.1.2	TCP	66	37828 → 9999 [ACK] Seq=151 Ack=256 Win=42496 Len=0 TSval=4215891586 TSecr=2636747502
24	5.011056	10.0.1.5	10.0.1.2	TCP	96	37828 → 9999 [PSH, ACK] Seq=151 Ack=256 Win=42496 Len=30 TSval=4215892587 TSecr=2636747502 [TCP segment of a reassembled PDU]
25	5.011386	10.0.1.2	10.0.1.5	TCP	117	9999 → 37828 [PSH, ACK] Seq=256 Ack=181 Win=43520 Len=51 TSval=2636748503 TSecr=4215892587 [TCP segment of a reassembled PDU]
26	5.011396	10.0.1.5	10.0.1.2	TCP	66	37828 → 9999 [ACK] Seq=181 Ack=307 Win=42496 Len=0 TSval=4215892587 TSecr=2636748503
27	6.012656	10.0.1.5	10.0.1.2	TCP	96	37828 → 9999 [PSH, ACK] Seq=181 Ack=307 Win=42496 Len=30 TSval=4215893588 TSecr=2636748503 [TCP segment of a reassembled PDU]
28	6.012775	10.0.1.2	10.0.1.5	TCP	117	9999 → 37828 [PSH, ACK] Seq=307 Ack=211 Win=43520 Len=51 TSval=2636749504 TSecr=4215893588 [TCP segment of a reassembled PDU]
29	6.012782	10.0.1.5	10.0.1.2	TCP	66	37828 → 9999 [ACK] Seq=211 Ack=358 Win=42496 Len=0 TSval=4215893588 TSecr=2636749504
30	7.014151	10.0.1.5	10.0.1.2	TCP	96	37828 → 9999 [PSH, ACK] Seq=211 Ack=358 Win=42496 Len=30 TSval=4215894590 TSecr=2636749504 [TCP segment of a reassembled PDU]
31	7.014285	10.0.1.2	10.0.1.5	TCP	117	9999 → 37828 [PSH, ACK] Seq=358 Ack=241 Win=43520 Len=51 TSval=2636750506 TSecr=4215894590 [TCP segment of a reassembled PDU]
32	7.014292	10.0.1.5	10.0.1.2	TCP	66	37828 → 9999 [ACK] Seq=241 Ack=409 Win=42496 Len=0 TSval=4215894590 TSecr=2636750506
33	7.230948	fe80::200:ff:fe00:3	ff02::2	ICMPv6	70	Router Solicitation from 00:00:00:00:00:03
34	8.015721	10.0.1.5	10.0.1.2	TCP	96	37828 → 9999 [PSH, ACK] Seq=241 Ack=409 Win=42496 Len=30 TSval=4215895591 TSecr=2636750506 [TCP segment of a reassembled PDU]
35	8.015966	10.0.1.2	10.0.1.5	TCP	117	9999 → 37828 [PSH, ACK] Seq=409 Ack=271 Win=43520 Len=51 TSval=2636751508 TSecr=4215895591 [TCP segment of a reassembled PDU]
36	8.015976	10.0.1.5	10.0.1.2	TCP	66	37828 → 9999 [ACK] Seq=271 Ack=460 Win=42496 Len=0 TSval=4215895592 TSecr=2636751508
37	9.017399	10.0.1.5	10.0.1.2	TCP	96	37828 → 9999 [PSH, ACK] Seq=271 Ack=460 Win=42496 Len=30 TSval=4215896593 TSecr=2636751508 [TCP segment of a reassembled PDU]
38	9.017488	10.0.1.2	10.0.1.5	TCP	117	9999 → 37828 [PSH, ACK] Seq=460 Ack=301 Win=43520 Len=51 TSval=2636752509 TSecr=4215896593 [TCP segment of a reassembled PDU]
39	9.017493	10.0.1.5	10.0.1.2	TCP	66	37828 → 9999 [ACK] Seq=301 Ack=511 Win=42496 Len=0 TSval=4215896593 TSecr=2636752509
40	10.018850	10.0.1.5	10.0.1.2	TCP	97	37828 → 9999 [PSH, ACK] Seq=301 Ack=511 Win=42496 Len=31 TSval=4215897594 TSecr=2636752509 [TCP segment of a reassembled PDU]
41	10.019176	10.0.1.2	10.0.1.5	TCP	117	9999 → 37828 [PSH, ACK] Seq=511 Ack=332 Win=43520 Len=51 TSval=2636753511 TSecr=4215897594 [TCP segment of a reassembled PDU]
42	10.019185	10.0.1.5	10.0.1.2	TCP	66	37828 → 9999 [ACK] Seq=332 Ack=562 Win=42496 Len=0 TSval=4215897595 TSecr=2636753511
43	11.021317	10.0.1.5	10.0.1.2	TCP	97	37828 → 9999 [PSH, ACK] Seq=332 Ack=562 Win=42496 Len=31 TSval=4215898597 TSecr=2636753511 [TCP segment of a reassembled PDU]
44	11.021398	10.0.1.2	10.0.1.5	TCP	117	9999 → 37828 [PSH, ACK] Seq=562 Ack=363 Win=43520 Len=51 TSval=2636754513 TSecr=4215898597 [TCP segment of a reassembled PDU]
45	11.021402	10.0.1.5	10.0.1.2	TCP	66	37828 → 9999 [ACK] Seq=363 Ack=613 Win=42496 Len=0 TSval=4215898597 TSecr=2636754513
46	12.022535	10.0.1.5	10.0.1.2	TCP	97	37828 → 9999 [PSH, ACK] Seq=363 Ack=613 Win=42496 Len=31 TSval=4215899598 TSecr=2636754513 [TCP segment of a reassembled PDU]
47	12.022644	10.0.1.2	10.0.1.5	TCP	117	9999 → 37828 [PSH, ACK] Seq=613 Ack=394 Win=43520 Len=51 TSval=2636755514 TSecr=4215899598 [TCP segment of a reassembled PDU]
48	12.022649	10.0.1.5	10.0.1.2	TCP	66	37828 → 9999 [ACK] Seq=394 Ack=664 Win=42496 Len=0 TSval=4215899598 TSecr=2636755514
49	13.024066	10.0.1.5	10.0.1.2	TCP	97	37828 → 9999 [PSH, ACK] Seq=394 Ack=664 Win=42496 Len=31 TSval=4215900600 TSecr=2636755514 [TCP segment of a reassembled PDU]
50	13.024223	10.0.1.2	10.0.1.5	TCP	117	9999 → 37828 [PSH, ACK] Seq=664 Ack=425 Win=43520 Len=51 TSval=2636756516 TSecr=4215900600 [TCP segment of a reassembled PDU]
51	13.024230	10.0.1.5	10.0.1.2	TCP	66	37828 → 9999 [ACK] Seq=425 Ack=715 Win=42496 Len=0 TSval=4215900600 TSecr=2636756516
52	14.025764	10.0.1.5	10.0.1.2	TCP	97	37828 → 9999 [PSH, ACK] Seq=425 Ack=715 Win=42496 Len=31 TSval=4215901601 TSecr=2636756516 [TCP segment of a reassembled PDU]
53	14.026103	10.0.1.2	10.0.1.5	TCP	117	9999 → 37828 [PSH, ACK] Seq=715 Ack=456 Win=43520 Len=51 TSval=2636757518 TSecr=4215901601 [TCP segment of a reassembled PDU]
54	14.026112	10.0.1.5	10.0.1.2	TCP	66	37828 → 9999 [ACK] Seq=456 Ack=766 Win=42496 Len=0 TSval=4215901602 TSecr=2636757518
55	14.443748	10.0.1.5	10.0.1.2	TCP	66	37828 → 9999 [FIN, ACK] Seq=456 Ack=766 Win=42496 Len=0 TSval=4215902019 TSecr=2636757518
56	14.444201	10.0.1.2	10.0.1.5	TCP	66	9999 → 37828 [FIN, ACK] Seq=766 Ack=457 Win=43520 Len=0 TSval=2636757936 TSecr=4215902019
57	14.444208	10.0.1.5	10.0.1.2	TCP	66	37828 → 9999 [ACK] Seq=457 Ack=767 Win=42496 Len=0 TSval=4215902020 TSecr=2636757936