1	0.000000	10.0.1.5	10.0.1.2	TCP	74	40302 → 9999 [SYN] Seq=0 Win=42340 Len=0 MSS=1460 SACK_PERM=1 TSval=4223552926 TSecr=0 WS=512
2	0.002219	10.0.1.2	10.0.1.5	TCP	74	9999 → 40302 [SYN, ACK] Seq=0 Ack=1 Win=43440 Len=0 MSS=1460 SACK_PERM=1 TSval=2644408844 TSecr=4223552926 WS=512
3	0.002238	10.0.1.5	10.0.1.2	TCP	66	40302 → 9999 [ACK] Seq=1 Ack=1 Win=42496 Len=0 TSval=4223552928 TSecr=2644408844
4	0.002361	10.0.1.5	10.0.1.2	TCP	96	40302 → 9999 [PSH, ACK] Seq=1 Ack=1 Win=42496 Len=30 TSval=4223552928 TSecr=2644408844 [TCP segment of a reassembled PDU]
5	0.002371	10.0.1.2	10.0.1.5	TCP	66	9999 → 40302 [ACK] Seq=1 Ack=31 Win=43520 Len=0 TSval=2644408844 TSecr=4223552928
6	0.002459	10.0.1.2	10.0.1.5	TCP	117	9999 → 40302 [PSH, ACK] Seq=1 Ack=31 Win=43520 Len=51 TSval=2644408844 TSecr=4223552928 [TCP segment of a reassembled PDU]
7	0.002471	10.0.1.5	10.0.1.2	TCP	66	40302 → 9999 [ACK] Seq=31 Ack=52 Win=42496 Len=0 TSval=4223552928 TSecr=2644408844
8	1.003892	10.0.1.5	10.0.1.2	TCP	96	40302 → 9999 [PSH, ACK] Seq=31 Ack=52 Win=42496 Len=30 TSval=4223553930 TSecr=2644408844 [TCP segment of a reassembled PDU]
9	1.004327	10.0.1.2	10.0.1.5	TCP	117	9999 → 40302 [PSH, ACK] Seq=52 Ack=61 Win=43520 Len=51 TSval=2644409846 TSecr=4223553930 [TCP segment of a reassembled PDU]
10	1.004344	10.0.1.5	10.0.1.2	TCP	66	40302 → 9999 [ACK] Seq=61 Ack=103 Win=42496 Len=0 TSval=4223553930 TSecr=2644409846
11	2.005808	10.0.1.5	10.0.1.2	TCP	96	40302 → 9999 [PSH, ACK] Seq=61 Ack=103 Win=42496 Len=30 TSval=4223554932 TSecr=2644409846 [TCP segment of a reassembled PDU]
12	2.006256	10.0.1.2	10.0.1.5	TCP	117	9999 → 40302 [PSH, ACK] Seq=103 Ack=91 Win=43520 Len=51 TSval=2644410848 TSecr=4223554932 [TCP segment of a reassembled PDU]
13	2.006277	10.0.1.5	10.0.1.2	TCP	66	40302 → 9999 [ACK] Seq=91 Ack=154 Win=42496 Len=0 TSval=4223554932 TSecr=2644410848
14	3.008039	10.0.1.5	10.0.1.2	TCP	96	40302 → 9999 [PSH, ACK] Seq=91 Ack=154 Win=42496 Len=30 TSval=4223555934 TSecr=2644410848 [TCP segment of a reassembled PDU]
15	3.008779	10.0.1.2	10.0.1.5	TCP	117	9999 → 40302 [PSH, ACK] Seq=154 Ack=121 Win=43520 Len=51 TSval=2644411851 TSecr=4223555934 [TCP segment of a reassembled PDU]
16	3.008798	10.0.1.5	10.0.1.2	TCP	66	40302 → 9999 [ACK] Seq=121 Ack=205 Win=42496 Len=0 TSval=4223555935 TSecr=2644411851
17	4.010381	10.0.1.5	10.0.1.2	TCP	96	40302 → 9999 [PSH, ACK] Seq=121 Ack=205 Win=42496 Len=30 TSval=4223556936 TSecr=2644411851 [TCP segment of a reassembled PDU]
18	4.010761	10.0.1.2	10.0.1.5	TCP	117	9999 → 40302 [PSH, ACK] Seq=205 Ack=151 Win=43520 Len=51 TSval=2644412853 TSecr=4223556936 [TCP segment of a reassembled PDU]
19	4.010774	10.0.1.5	10.0.1.2	TCP	66	40302 → 9999 [ACK] Seq=151 Ack=256 Win=42496 Len=0 TSval=4223556937 TSecr=2644412853
20	5.011747	10.0.1.5	10.0.1.2	TCP	96	40302 → 9999 [PSH, ACK] Seq=151 Ack=256 Win=42496 Len=30 TSval=4223557938 TSecr=2644412853 [TCP segment of a reassembled PDU]
21	5.011984	10.0.1.2	10.0.1.5	TCP	117	9999 → 40302 [PSH, ACK] Seq=256 Ack=181 Win=43520 Len=51 TSval=2644413854 TSecr=4223557938 [TCP segment of a reassembled PDU]
22	5.011990	10.0.1.5	10.0.1.2	TCP	66	40302 → 9999 [ACK] Seq=181 Ack=307 Win=42496 Len=0 TSval=4223557938 TSecr=2644413854
23	6.013750	10.0.1.5	10.0.1.2	TCP	96	40302 → 9999 [PSH, ACK] Seq=181 Ack=307 Win=42496 Len=30 TSval=4223558940 TSecr=2644413854 [TCP segment of a reassembled PDU]
24	6.014164	10.0.1.2	10.0.1.5	TCP	117	9999 → 40302 [PSH, ACK] Seq=307 Ack=211 Win=43520 Len=51 TSval=2644414856 TSecr=4223558940 [TCP segment of a reassembled PDU]
25	6.014185	10.0.1.5	10.0.1.2	TCP	66	40302 → 9999 [ACK] Seq=211 Ack=358 Win=42496 Len=0 TSval=4223558940 TSecr=2644414856
26	7.016072	10.0.1.5	10.0.1.2	TCP	96	40302 → 9999 [PSH, ACK] Seq=211 Ack=358 Win=42496 Len=30 TSval=4223559942 TSecr=2644414856 [TCP segment of a reassembled PDU]
27	7.016733	10.0.1.2	10.0.1.5	TCP	117	9999 → 40302 [PSH, ACK] Seq=358 Ack=241 Win=43520 Len=51 TSval=2644415859 TSecr=4223559942 [TCP segment of a reassembled PDU]
28	7.016752	10.0.1.5	10.0.1.2	TCP	66	40302 → 9999 [ACK] Seq=241 Ack=409 Win=42496 Len=0 TSval=4223559943 TSecr=2644415859
29	8.018392	10.0.1.5	10.0.1.2	TCP	96	40302 → 9999 [PSH, ACK] Seq=241 Ack=409 Win=42496 Len=30 TSval=4223560944 TSecr=2644415859 [TCP segment of a reassembled PDU]
30	8.018845	10.0.1.2	10.0.1.5	TCP	117	9999 → 40302 [PSH, ACK] Seq=409 Ack=271 Win=43520 Len=51 TSval=2644416861 TSecr=4223560944 [TCP segment of a reassembled PDU]
31	8.018869	10.0.1.5	10.0.1.2	TCP	66	40302 → 9999 [ACK] Seq=271 Ack=460 Win=42496 Len=0 TSval=4223560945 TSecr=2644416861
32	9.020702	10.0.1.5	10.0.1.2	TCP	96	40302 → 9999 [PSH, ACK] Seq=271 Ack=460 Win=42496 Len=30 TSval=4223561947 TSecr=2644416861 [TCP segment of a reassembled PDU]
33	9.021811	10.0.1.2	10.0.1.5	TCP	117	9999 → 40302 [PSH, ACK] Seq=460 Ack=301 Win=43520 Len=51 TSval=2644417864 TSecr=4223561947 [TCP segment of a reassembled PDU]
34	9.021828	10.0.1.5	10.0.1.2	TCP	66	40302 → 9999 [ACK] Seq=301 Ack=511 Win=42496 Len=0 TSval=4223561948 TSecr=2644417864
35	10.023681	10.0.1.5	10.0.1.2	TCP	97	40302 → 9999 [PSH, ACK] Seq=301 Ack=511 Win=42496 Len=31 TSval=4223562950 TSecr=2644417864 [TCP segment of a reassembled PDU]
36	10.024006	10.0.1.2	10.0.1.5	TCP	117	9999 → 40302 [PSH, ACK] Seq=511 Ack=332 Win=43520 Len=51 TSval=2644418866 TSecr=4223562950 [TCP segment of a reassembled PDU]
37	10.024016	10.0.1.5	10.0.1.2	TCP	66	40302 → 9999 [ACK] Seq=332 Ack=562 Win=42496 Len=0 TSval=4223562950 TSecr=2644418866
38	11.026294	10.0.1.5	10.0.1.2	TCP	97	40302 → 9999 [PSH, ACK] Seq=332 Ack=562 Win=42496 Len=31 TSval=4223563952 TSecr=2644418866 [TCP segment of a reassembled PDU]
39	11.026773	10.0.1.2	10.0.1.5	TCP	117	9999 → 40302 [PSH, ACK] Seq=562 Ack=363 Win=43520 Len=51 TSval=2644419869 TSecr=4223563952 [TCP segment of a reassembled PDU]
40	11.026786	10.0.1.5	10.0.1.2	TCP	66	40302 → 9999 [ACK] Seq=363 Ack=613 Win=42496 Len=0 TSval=4223563953 TSecr=2644419869
41	12.028360	10.0.1.5	10.0.1.2	TCP	97	40302 → 9999 [PSH, ACK] Seq=363 Ack=613 Win=42496 Len=31 TSval=4223564954 TSecr=2644419869 [TCP segment of a reassembled PDU]
42	12.028801	10.0.1.2	10.0.1.5	TCP	117	9999 → 40302 [PSH, ACK] Seq=613 Ack=394 Win=43520 Len=51 TSval=2644420871 TSecr=4223564954 [TCP segment of a reassembled PDU]
43	12.028818	10.0.1.5	10.0.1.2	TCP	66	40302 → 9999 [ACK] Seq=394 Ack=664 Win=42496 Len=0 TSval=4223564955 TSecr=2644420871
44	13.031204	10.0.1.5	10.0.1.2	TCP	97	40302 → 9999 [PSH, ACK] Seq=394 Ack=664 Win=42496 Len=31 TSval=4223565957 TSecr=2644420871 [TCP segment of a reassembled PDU]
45	13.031647	10.0.1.2	10.0.1.5	TCP	117	9999 → 40302 [PSH, ACK] Seq=664 Ack=425 Win=43520 Len=51 TSval=2644421873 TSecr=4223565957 [TCP segment of a reassembled PDU]
46	13.031665	10.0.1.5	10.0.1.2	TCP	66	40302 → 9999 [ACK] Seq=425 Ack=715 Win=42496 Len=0 TSval=4223565958 TSecr=2644421873
47	14.033226	10.0.1.5	10.0.1.2	TCP	97	40302 → 9999 [PSH, ACK] Seq=425 Ack=715 Win=42496 Len=31 TSval=4223566959 TSecr=2644421873 [TCP segment of a reassembled PDU]
48	14.033451	10.0.1.2	10.0.1.5	TCP	117	9999 → 40302 [PSH, ACK] Seq=715 Ack=456 Win=43520 Len=51 TSval=2644422875 TSecr=4223566959 [TCP segment of a reassembled PDU]
49	14.033457	10.0.1.5	10.0.1.2	TCP	66	40302 → 9999 [ACK] Seq=456 Ack=766 Win=42496 Len=0 TSval=4223566959 TSecr=2644422875
50	15.035037	10.0.1.5	10.0.1.2	TCP	97	40302 → 9999 [PSH, ACK] Seq=456 Ack=766 Win=42496 Len=31 TSval=4223567961 TSecr=2644422875 [TCP segment of a reassembled PDU]
51	15.036028	10.0.1.2	10.0.1.5	TCP	117	9999 → 40302 [PSH, ACK] Seq=766 Ack=487 Win=43520 Len=51 TSval=2644423878 TSecr=4223567961 [TCP segment of a reassembled PDU]
52	15.036037	10.0.1.5	10.0.1.2	TCP	66	40302 → 9999 [ACK] Seq=487 Ack=817 Win=42496 Len=0 TSval=4223567962 TSecr=2644423878
53	16.037696	10.0.1.5	10.0.1.2	TCP	97	40302 → 9999 [PSH, ACK] Seq=487 Ack=817 Win=42496 Len=31 TSval=4223568964 TSecr=2644423878 [TCP segment of a reassembled PDU]
54	16.038223	10.0.1.2	10.0.1.5	TCP	117	9999 → 40302 [PSH, ACK] Seq=817 Ack=518 Win=43520 Len=51 TSval=2644424880 TSecr=4223568964 [TCP segment of a reassembled PDU]
55	16.038243	10.0.1.5	10.0.1.2	TCP	66	40302 → 9999 [ACK] Seq=518 Ack=868 Win=42496 Len=0 TSval=4223568964 TSecr=2644424880
56	17.039989	10.0.1.5	10.0.1.2	TCP	97	40302 → 9999 [PSH, ACK] Seq=518 Ack=868 Win=42496 Len=31 TSval=4223569966 TSecr=2644424880 [TCP segment of a reassembled PDU]
57	17.040346	10.0.1.2	10.0.1.5	TCP	117	9999 → 40302 [PSH, ACK] Seq=868 Ack=549 Win=43520 Len=51 TSval=2644425882 TSecr=4223569966 [TCP segment of a reassembled PDU]
58	17.040359	10.0.1.5	10.0.1.2	TCP	66	40302 → 9999 [ACK] Seq=549 Ack=919 Win=42496 Len=0 TSval=4223569966 TSecr=2644425882
59	18.040961	10.0.1.5	10.0.1.2	TCP	97	40302 → 9999 [PSH, ACK] Seq=549 Ack=919 Win=42496 Len=31 TSval=4223570967 TSecr=2644425882 [TCP segment of a reassembled PDU]
60	18.041376	10.0.1.2	10.0.1.5	TCP	117	9999 → 40302 [PSH, ACK] Seq=919 Ack=580 Win=43520 Len=51 TSval=2644426883 TSecr=4223570967 [TCP segment of a reassembled PDU]
61	18.041391	10.0.1.5	10.0.1.2	TCP	66	40302 → 9999 [ACK] Seq=580 Ack=970 Win=42496 Len=0 TSval=4223570967 TSecr=2644426883
62	19.043294	10.0.1.5	10.0.1.2	TCP	97	40302 → 9999 [PSH, ACK] Seq=580 Ack=970 Win=42496 Len=31 TSval=4223571969 TSecr=2644426883 [TCP segment of a reassembled PDU]
63	19.043886	10.0.1.2	10.0.1.5	TCP	117	9999 → 40302 [PSH, ACK] Seq=970 Ack=611 Win=43520 Len=51 TSval=2644427886 TSecr=4223571969 [TCP segment of a reassembled PDU]
64	19.043907	10.0.1.5	10.0.1.2	TCP	66	40302 → 9999 [ACK] Seq=611 Ack=1021 Win=42496 Len=0 TSval=4223571970 TSecr=2644427886
65	19.912365	10.0.1.5	10.0.1.2	TCP	66	40302 → 9999 [FIN, ACK] Seq=611 Ack=1021 Win=42496 Len=0 TSval=4223572838 TSecr=2644427886
66	19.912963	10.0.1.2	10.0.1.5	TCP	66	9999 → 40302 [FIN, ACK] Seq=1021 Ack=612 Win=43520 Len=0 TSval=2644428755 TSecr=4223572838
67	19.912984	10.0.1.5	10.0.1.2	TCP	66	40302 → 9999 [ACK] Seq=612 Ack=1022 Win=42496 Len=0 TSval=4223572839 TSecr=2644428755