1	0.000000	00:00:00_00:00:03	Broadcast	ARP	42	Who has 10.0.1.2? Tell 10.0.1.5
2	0.002651	00:00:00_00:00:01	00:00:00_00:00:03	ARP	42	10.0.1.2 is at 00:00:00:00:00:01
3	0.002654	10.0.1.5	10.0.1.2	TCP	74	38300 → 9999 [SYN] Seq=0 Win=42340 Len=0 MSS=1460 SACK_PERM=1 TSval=4223331408 TSecr=0 WS=512
4	0.004964	00:00:00_00:00:02	Broadcast	ARP	42	Who has 10.0.1.5? Tell 10.0.1.3
5	0.004968	00:00:00_00:00:03	00:00:00_00:00:02	ARP	42	10.0.1.5 is at 00:00:00:00:00:03
6	0.006088	10.0.1.2	10.0.1.5	TCP	74	9999 → 38300 [SYN, ACK] Seq=0 Ack=1 Win=43440 Len=0 MSS=1460 SACK_PERM=1 TSval=2644187328 TSecr=4223331408 WS=512
7	0.006100	10.0.1.5	10.0.1.2	TCP	66	38300 → 9999 [ACK] Seq=1 Ack=1 Win=42496 Len=0 TSval=4223331414 TSecr=2644187328
8	0.006155	10.0.1.5	10.0.1.2	TCP	96	38300 → 9999 [PSH, ACK] Seq=1 Ack=1 Win=42496 Len=30 TSval=4223331414 TSecr=2644187328 [TCP segment of a reassembled PDU]
9	0.006231	10.0.1.2	10.0.1.5	TCP	66	9999 → 38300 [ACK] Seq=1 Ack=31 Win=43520 Len=0 TSval=2644187330 TSecr=4223331414
10	0.006451	10.0.1.2	10.0.1.5	TCP	117	9999 → 38300 [PSH, ACK] Seq=1 Ack=31 Win=43520 Len=51 TSval=2644187330 TSecr=4223331414 [TCP segment of a reassembled PDU]
11	0.006456	10.0.1.5	10.0.1.2	TCP	66	38300 → 9999 [ACK] Seq=31 Ack=52 Win=42496 Len=0 TSval=4223331414 TSecr=2644187330
12	1.007899	10.0.1.5	10.0.1.2	TCP	96	38300 → 9999 [PSH, ACK] Seq=31 Ack=52 Win=42496 Len=30 TSval=4223332416 TSecr=2644187330 [TCP segment of a reassembled PDU]
13	1.008199	10.0.1.2	10.0.1.5	TCP	117	9999 → 38300 [PSH, ACK] Seq=52 Ack=61 Win=43520 Len=51 TSval=2644188332 TSecr=4223332416 [TCP segment of a reassembled PDU]
14	1.008214	10.0.1.5	10.0.1.2	TCP	66	38300 → 9999 [ACK] Seq=61 Ack=103 Win=42496 Len=0 TSval=4223332416 TSecr=2644188332
15	2.009151	10.0.1.5	10.0.1.2	TCP	96	38300 → 9999 [PSH, ACK] Seq=61 Ack=103 Win=42496 Len=30 TSval=4223333417 TSecr=2644188332 [TCP segment of a reassembled PDU]
16	2.009545	10.0.1.2	10.0.1.5	TCP	117	9999 → 38300 [PSH, ACK] Seq=103 Ack=91 Win=43520 Len=51 TSval=2644189333 TSecr=4223333417 [TCP segment of a reassembled PDU]
17	2.009550	10.0.1.5	10.0.1.2	TCP	66	38300 → 9999 [ACK] Seq=91 Ack=154 Win=42496 Len=0 TSval=4223333417 TSecr=2644189333
18	3.011127	10.0.1.5	10.0.1.2	TCP	96	38300 → 9999 [PSH, ACK] Seq=91 Ack=154 Win=42496 Len=30 TSval=4223334419 TSecr=2644189333 [TCP segment of a reassembled PDU]
19	3.011607	10.0.1.2	10.0.1.5	TCP	117	9999 → 38300 [PSH, ACK] Seq=154 Ack=121 Win=43520 Len=51 TSval=2644190335 TSecr=4223334419 [TCP segment of a reassembled PDU]
20	3.011621	10.0.1.5	10.0.1.2	TCP	66	38300 → 9999 [ACK] Seq=121 Ack=205 Win=42496 Len=0 TSval=4223334419 TSecr=2644190335
21	4.013237	10.0.1.5	10.0.1.2	TCP	96	38300 → 9999 [PSH, ACK] Seq=121 Ack=205 Win=42496 Len=30 TSval=4223335421 TSecr=2644190335 [TCP segment of a reassembled PDU]
22	4.013451	10.0.1.2	10.0.1.5	TCP	117	9999 → 38300 [PSH, ACK] Seq=205 Ack=151 Win=43520 Len=51 TSval=2644191337 TSecr=4223335421 [TCP segment of a reassembled PDU]
23	4.013461	10.0.1.5	10.0.1.2	TCP	66	38300 → 9999 [ACK] Seq=151 Ack=256 Win=42496 Len=0 TSval=4223335421 TSecr=2644191337
24	5.014955	10.0.1.5	10.0.1.2	TCP	96	38300 → 9999 [PSH, ACK] Seq=151 Ack=256 Win=42496 Len=30 TSval=4223336423 TSecr=2644191337 [TCP segment of a reassembled PDU]
25	5.015097	10.0.1.2	10.0.1.5	TCP	117	9999 → 38300 [PSH, ACK] Seq=256 Ack=181 Win=43520 Len=51 TSval=2644192339 TSecr=4223336423 [TCP segment of a reassembled PDU]
26	5.015103	10.0.1.5	10.0.1.2	TCP	66	38300 → 9999 [ACK] Seq=181 Ack=307 Win=42496 Len=0 TSval=4223336423 TSecr=2644192339
27	6.017618	10.0.1.5	10.0.1.2	TCP	96	38300 → 9999 [PSH, ACK] Seq=181 Ack=307 Win=42496 Len=30 TSval=4223337425 TSecr=2644192339 [TCP segment of a reassembled PDU]
28	6.018152	10.0.1.2	10.0.1.5	TCP	117	9999 → 38300 [PSH, ACK] Seq=307 Ack=211 Win=43520 Len=51 TSval=2644193342 TSecr=4223337425 [TCP segment of a reassembled PDU]
29	6.018168	10.0.1.5	10.0.1.2	TCP	66	38300 → 9999 [ACK] Seq=211 Ack=358 Win=42496 Len=0 TSval=4223337426 TSecr=2644193342
30	7.020279	10.0.1.5	10.0.1.2	TCP	96	38300 → 9999 [PSH, ACK] Seq=211 Ack=358 Win=42496 Len=30 TSval=4223338428 TSecr=2644193342 [TCP segment of a reassembled PDU]
31	7.021057	10.0.1.2	10.0.1.5	TCP	117	9999 → 38300 [PSH, ACK] Seq=358 Ack=241 Win=43520 Len=51 TSval=2644194345 TSecr=4223338428 [TCP segment of a reassembled PDU]
32	7.021080	10.0.1.5	10.0.1.2	TCP	66	38300 → 9999 [ACK] Seq=241 Ack=409 Win=42496 Len=0 TSval=4223338429 TSecr=2644194345
33	8.022165	10.0.1.5	10.0.1.2	TCP	96	38300 → 9999 [PSH, ACK] Seq=241 Ack=409 Win=42496 Len=30 TSval=4223339430 TSecr=2644194345 [TCP segment of a reassembled PDU]
34	8.023136	10.0.1.2	10.0.1.5	TCP	117	9999 → 38300 [PSH, ACK] Seq=409 Ack=271 Win=43520 Len=51 TSval=2644195347 TSecr=4223339430 [TCP segment of a reassembled PDU]
35	8.023158	10.0.1.5	10.0.1.2	TCP	66	38300 → 9999 [ACK] Seq=271 Ack=460 Win=42496 Len=0 TSval=4223339431 TSecr=2644195347
36	9.023952	10.0.1.5	10.0.1.2	TCP	96	38300 → 9999 [PSH, ACK] Seq=271 Ack=460 Win=42496 Len=30 TSval=4223340432 TSecr=2644195347 [TCP segment of a reassembled PDU]
37	9.024234	10.0.1.2	10.0.1.5	TCP	117	9999 → 38300 [PSH, ACK] Seq=460 Ack=301 Win=43520 Len=51 TSval=2644196348 TSecr=4223340432 [TCP segment of a reassembled PDU]
38	9.024244	10.0.1.5	10.0.1.2	TCP	66	38300 → 9999 [ACK] Seq=301 Ack=511 Win=42496 Len=0 TSval=4223340432 TSecr=2644196348
39	10.024942	10.0.1.5	10.0.1.2	TCP	97	38300 → 9999 [PSH, ACK] Seq=301 Ack=511 Win=42496 Len=31 TSval=4223341433 TSecr=2644196348 [TCP segment of a reassembled PDU]
40	10.025522	10.0.1.2	10.0.1.5	TCP	117	9999 → 38300 [PSH, ACK] Seq=511 Ack=332 Win=43520 Len=51 TSval=2644197349 TSecr=4223341433 [TCP segment of a reassembled PDU]
41	10.025536	10.0.1.5	10.0.1.2	TCP	66	38300 → 9999 [ACK] Seq=332 Ack=562 Win=42496 Len=0 TSval=4223341433 TSecr=2644197349
42	11.027213	10.0.1.5	10.0.1.2	TCP	97	38300 → 9999 [PSH, ACK] Seq=332 Ack=562 Win=42496 Len=31 TSval=4223342435 TSecr=2644197349 [TCP segment of a reassembled PDU]
43	11.027643	10.0.1.2	10.0.1.5	TCP	117	9999 → 38300 [PSH, ACK] Seq=562 Ack=363 Win=43520 Len=51 TSval=2644198351 TSecr=4223342435 [TCP segment of a reassembled PDU]
44	11.027662	10.0.1.5	10.0.1.2	TCP	66	38300 → 9999 [ACK] Seq=363 Ack=613 Win=42496 Len=0 TSval=4223342435 TSecr=2644198351
45	12.028966	10.0.1.5	10.0.1.2	TCP	97	38300 → 9999 [PSH, ACK] Seq=363 Ack=613 Win=42496 Len=31 TSval=4223343437 TSecr=2644198351 [TCP segment of a reassembled PDU]
46	12.029180	10.0.1.2	10.0.1.5	TCP	117	9999 → 38300 [PSH, ACK] Seq=613 Ack=394 Win=43520 Len=51 TSval=2644199353 TSecr=4223343437 [TCP segment of a reassembled PDU]
47	12.029186	10.0.1.5	10.0.1.2	TCP	66	38300 → 9999 [ACK] Seq=394 Ack=664 Win=42496 Len=0 TSval=4223343437 TSecr=2644199353
48	13.030500	10.0.1.5	10.0.1.2	TCP	97	38300 → 9999 [PSH, ACK] Seq=394 Ack=664 Win=42496 Len=31 TSval=4223344438 TSecr=2644199353 [TCP segment of a reassembled PDU]
49	13.031349	10.0.1.2	10.0.1.5	TCP	117	9999 → 38300 [PSH, ACK] Seq=664 Ack=425 Win=43520 Len=51 TSval=2644200355 TSecr=4223344438 [TCP segment of a reassembled PDU]
50	13.031357	10.0.1.5	10.0.1.2	TCP	66	38300 → 9999 [ACK] Seq=425 Ack=715 Win=42496 Len=0 TSval=4223344439 TSecr=2644200355
51	14.033866	10.0.1.5	10.0.1.2	TCP	97	38300 → 9999 [PSH, ACK] Seq=425 Ack=715 Win=42496 Len=31 TSval=4223345442 TSecr=2644200355 [TCP segment of a reassembled PDU]
52	14.034061	10.0.1.2	10.0.1.5	TCP	117	9999 → 38300 [PSH, ACK] Seq=715 Ack=456 Win=43520 Len=51 TSval=2644201358 TSecr=4223345442 [TCP segment of a reassembled PDU]
53	14.034067	10.0.1.5	10.0.1.2	TCP	66	38300 → 9999 [ACK] Seq=456 Ack=766 Win=42496 Len=0 TSval=4223345442 TSecr=2644201358
54	15.035248	10.0.1.5	10.0.1.2	TCP	97	38300 → 9999 [PSH, ACK] Seq=456 Ack=766 Win=42496 Len=31 TSval=4223346443 TSecr=2644201358 [TCP segment of a reassembled PDU]
55	15.035440	10.0.1.2	10.0.1.5	TCP	117	9999 → 38300 [PSH, ACK] Seq=766 Ack=487 Win=43520 Len=51 TSval=2644202359 TSecr=4223346443 [TCP segment of a reassembled PDU]
56	15.035447	10.0.1.5	10.0.1.2	TCP	66	38300 → 9999 [ACK] Seq=487 Ack=817 Win=42496 Len=0 TSval=4223346443 TSecr=2644202359
57	16.035974	10.0.1.5	10.0.1.2	TCP	97	38300 → 9999 [PSH, ACK] Seq=487 Ack=817 Win=42496 Len=31 TSval=4223347444 TSecr=2644202359 [TCP segment of a reassembled PDU]
58	16.036304	10.0.1.2	10.0.1.5	TCP	117	9999 → 38300 [PSH, ACK] Seq=817 Ack=518 Win=43520 Len=51 TSval=2644203360 TSecr=4223347444 [TCP segment of a reassembled PDU]
59	16.036317	10.0.1.5	10.0.1.2	TCP	66	38300 → 9999 [ACK] Seq=518 Ack=868 Win=42496 Len=0 TSval=4223347444 TSecr=2644203360
60	17.037340	10.0.1.5	10.0.1.2	TCP	97	38300 → 9999 [PSH, ACK] Seq=518 Ack=868 Win=42496 Len=31 TSval=4223348445 TSecr=2644203360 [TCP segment of a reassembled PDU]
61	17.037834	10.0.1.2	10.0.1.5	TCP	117	9999 → 38300 [PSH, ACK] Seq=868 Ack=549 Win=43520 Len=51 TSval=2644204362 TSecr=4223348445 [TCP segment of a reassembled PDU]
62	17.037839	10.0.1.5	10.0.1.2	TCP	66	38300 → 9999 [ACK] Seq=549 Ack=919 Win=42496 Len=0 TSval=4223348446 TSecr=2644204362
63	18.038987	10.0.1.5	10.0.1.2	TCP	97	38300 → 9999 [PSH, ACK] Seq=549 Ack=919 Win=42496 Len=31 TSval=4223349447 TSecr=2644204362 [TCP segment of a reassembled PDU]
64	18.039236	10.0.1.2	10.0.1.5	TCP	117	9999 → 38300 [PSH, ACK] Seq=919 Ack=580 Win=43520 Len=51 TSval=2644205363 TSecr=4223349447 [TCP segment of a reassembled PDU]
65	18.039245	10.0.1.5	10.0.1.2	TCP	66	38300 → 9999 [ACK] Seq=580 Ack=970 Win=42496 Len=0 TSval=4223349447 TSecr=2644205363
66	19.039721	10.0.1.5	10.0.1.2	TCP	97	38300 → 9999 [PSH, ACK] Seq=580 Ack=970 Win=42496 Len=31 TSval=4223350447 TSecr=2644205363 [TCP segment of a reassembled PDU]
67	19.040073	10.0.1.2	10.0.1.5	TCP	117	9999 → 38300 [PSH, ACK] Seq=970 Ack=611 Win=43520 Len=51 TSval=2644206364 TSecr=4223350447 [TCP segment of a reassembled PDU]
68	19.040085	10.0.1.5	10.0.1.2	TCP	66	38300 → 9999 [ACK] Seq=611 Ack=1021 Win=42496 Len=0 TSval=4223350448 TSecr=2644206364
69	19.588963	10.0.1.5	10.0.1.2	TCP	66	38300 → 9999 [FIN, ACK] Seq=611 Ack=1021 Win=42496 Len=0 TSval=4223350997 TSecr=2644206364
70	19.589410	10.0.1.2	10.0.1.5	TCP	66	9999 → 38300 [FIN, ACK] Seq=1021 Ack=612 Win=43520 Len=0 TSval=2644206913 TSecr=4223350997
71	19.589430	10.0.1.5	10.0.1.2	TCP	66	38300 → 9999 [ACK] Seq=612 Ack=1022 Win=42496 Len=0 TSval=4223350997 TSecr=2644206913
72	22.218474	fe80::200:ff:fe00:2	ff02::2	ICMPv6	70	Router Solicitation from 00:00:00:00:00:02