1	0.000000	10.0.1.5	10.0.1.2	TCP	74	33016 → 9999 [SYN] Seq=0 Win=42340 Len=0 MSS=1460 SACK_PERM=1 TSval=4035403483 TSecr=0 WS=512
2	0.003711	10.0.1.2	10.0.1.5	TCP	74	9999 → 33016 [SYN, ACK] Seq=0 Ack=1 Win=43440 Len=0 MSS=1460 SACK_PERM=1 TSval=3913398310 TSecr=4035403483 WS=512
3	0.003736	10.0.1.5	10.0.1.2	TCP	66	33016 → 9999 [ACK] Seq=1 Ack=1 Win=42496 Len=0 TSval=4035403487 TSecr=3913398310
4	0.003865	10.0.1.5	10.0.1.2	TCP	96	33016 → 9999 [PSH, ACK] Seq=1 Ack=1 Win=42496 Len=30 TSval=4035403487 TSecr=3913398310 [TCP segment of a reassembled PDU]
5	0.003884	10.0.1.2	10.0.1.5	TCP	66	9999 → 33016 [ACK] Seq=1 Ack=31 Win=43520 Len=0 TSval=3913398311 TSecr=4035403487
6	0.004192	10.0.1.2	10.0.1.5	TCP	117	9999 → 33016 [PSH, ACK] Seq=1 Ack=31 Win=43520 Len=51 TSval=3913398311 TSecr=4035403487 [TCP segment of a reassembled PDU]
7	0.004221	10.0.1.5	10.0.1.2	TCP	66	33016 → 9999 [ACK] Seq=31 Ack=52 Win=42496 Len=0 TSval=4035403487 TSecr=3913398311
8	1.007153	10.0.1.5	10.0.1.2	TCP	96	33016 → 9999 [PSH, ACK] Seq=31 Ack=52 Win=42496 Len=30 TSval=4035404490 TSecr=3913398311 [TCP segment of a reassembled PDU]
9	1.007634	10.0.1.2	10.0.1.5	TCP	117	9999 → 33016 [PSH, ACK] Seq=52 Ack=61 Win=43520 Len=51 TSval=3913399315 TSecr=4035404490 [TCP segment of a reassembled PDU]
10	1.007662	10.0.1.5	10.0.1.2	TCP	66	33016 → 9999 [ACK] Seq=61 Ack=103 Win=42496 Len=0 TSval=4035404491 TSecr=3913399315
11	2.009633	10.0.1.5	10.0.1.2	TCP	96	33016 → 9999 [PSH, ACK] Seq=61 Ack=103 Win=42496 Len=30 TSval=4035405493 TSecr=3913399315 [TCP segment of a reassembled PDU]
12	2.010710	10.0.1.2	10.0.1.5	TCP	117	9999 → 33016 [PSH, ACK] Seq=103 Ack=91 Win=43520 Len=51 TSval=3913400318 TSecr=4035405493 [TCP segment of a reassembled PDU]
13	2.010741	10.0.1.5	10.0.1.2	TCP	66	33016 → 9999 [ACK] Seq=91 Ack=154 Win=42496 Len=0 TSval=4035405494 TSecr=3913400318
14	3.012706	10.0.1.5	10.0.1.2	TCP	96	33016 → 9999 [PSH, ACK] Seq=91 Ack=154 Win=42496 Len=30 TSval=4035406496 TSecr=3913400318 [TCP segment of a reassembled PDU]
15	3.012883	10.0.1.2	10.0.1.5	TCP	117	9999 → 33016 [PSH, ACK] Seq=154 Ack=121 Win=43520 Len=51 TSval=3913401320 TSecr=4035406496 [TCP segment of a reassembled PDU]
16	3.012894	10.0.1.5	10.0.1.2	TCP	66	33016 → 9999 [ACK] Seq=121 Ack=205 Win=42496 Len=0 TSval=4035406496 TSecr=3913401320
17	4.014553	10.0.1.5	10.0.1.2	TCP	96	33016 → 9999 [PSH, ACK] Seq=121 Ack=205 Win=42496 Len=30 TSval=4035407498 TSecr=3913401320 [TCP segment of a reassembled PDU]
18	4.015162	10.0.1.2	10.0.1.5	TCP	117	9999 → 33016 [PSH, ACK] Seq=205 Ack=151 Win=43520 Len=51 TSval=3913402322 TSecr=4035407498 [TCP segment of a reassembled PDU]
19	4.015190	10.0.1.5	10.0.1.2	TCP	66	33016 → 9999 [ACK] Seq=151 Ack=256 Win=42496 Len=0 TSval=4035407498 TSecr=3913402322
20	5.017084	10.0.1.5	10.0.1.2	TCP	96	33016 → 9999 [PSH, ACK] Seq=151 Ack=256 Win=42496 Len=30 TSval=4035408500 TSecr=3913402322 [TCP segment of a reassembled PDU]
21	5.017464	10.0.1.2	10.0.1.5	TCP	117	9999 → 33016 [PSH, ACK] Seq=256 Ack=181 Win=43520 Len=51 TSval=3913403325 TSecr=4035408500 [TCP segment of a reassembled PDU]
22	5.017482	10.0.1.5	10.0.1.2	TCP	66	33016 → 9999 [ACK] Seq=181 Ack=307 Win=42496 Len=0 TSval=4035408501 TSecr=3913403325
23	6.019053	10.0.1.5	10.0.1.2	TCP	96	33016 → 9999 [PSH, ACK] Seq=181 Ack=307 Win=42496 Len=30 TSval=4035409502 TSecr=3913403325 [TCP segment of a reassembled PDU]
24	6.019608	10.0.1.2	10.0.1.5	TCP	117	9999 → 33016 [PSH, ACK] Seq=307 Ack=211 Win=43520 Len=51 TSval=3913404327 TSecr=4035409502 [TCP segment of a reassembled PDU]
25	6.019641	10.0.1.5	10.0.1.2	TCP	66	33016 → 9999 [ACK] Seq=211 Ack=358 Win=42496 Len=0 TSval=4035409503 TSecr=3913404327
26	7.021657	10.0.1.5	10.0.1.2	TCP	96	33016 → 9999 [PSH, ACK] Seq=211 Ack=358 Win=42496 Len=30 TSval=4035410505 TSecr=3913404327 [TCP segment of a reassembled PDU]
27	7.022243	10.0.1.2	10.0.1.5	TCP	117	9999 → 33016 [PSH, ACK] Seq=358 Ack=241 Win=43520 Len=51 TSval=3913405329 TSecr=4035410505 [TCP segment of a reassembled PDU]
28	7.022271	10.0.1.5	10.0.1.2	TCP	66	33016 → 9999 [ACK] Seq=241 Ack=409 Win=42496 Len=0 TSval=4035410505 TSecr=3913405329
29	8.024316	10.0.1.5	10.0.1.2	TCP	96	33016 → 9999 [PSH, ACK] Seq=241 Ack=409 Win=42496 Len=30 TSval=4035411507 TSecr=3913405329 [TCP segment of a reassembled PDU]
30	8.025034	10.0.1.2	10.0.1.5	TCP	117	9999 → 33016 [PSH, ACK] Seq=409 Ack=271 Win=43520 Len=51 TSval=3913406332 TSecr=4035411507 [TCP segment of a reassembled PDU]
31	8.025055	10.0.1.5	10.0.1.2	TCP	66	33016 → 9999 [ACK] Seq=271 Ack=460 Win=42496 Len=0 TSval=4035411508 TSecr=3913406332
32	9.027034	10.0.1.5	10.0.1.2	TCP	96	33016 → 9999 [PSH, ACK] Seq=271 Ack=460 Win=42496 Len=30 TSval=4035412510 TSecr=3913406332 [TCP segment of a reassembled PDU]
33	9.027693	10.0.1.2	10.0.1.5	TCP	117	9999 → 33016 [PSH, ACK] Seq=460 Ack=301 Win=43520 Len=51 TSval=3913407335 TSecr=4035412510 [TCP segment of a reassembled PDU]
34	9.027722	10.0.1.5	10.0.1.2	TCP	66	33016 → 9999 [ACK] Seq=301 Ack=511 Win=42496 Len=0 TSval=4035412511 TSecr=3913407335
35	10.030218	10.0.1.5	10.0.1.2	TCP	97	33016 → 9999 [PSH, ACK] Seq=301 Ack=511 Win=42496 Len=31 TSval=4035413513 TSecr=3913407335 [TCP segment of a reassembled PDU]
36	10.030897	10.0.1.2	10.0.1.5	TCP	117	9999 → 33016 [PSH, ACK] Seq=511 Ack=332 Win=43520 Len=51 TSval=3913408338 TSecr=4035413513 [TCP segment of a reassembled PDU]
37	10.030926	10.0.1.5	10.0.1.2	TCP	66	33016 → 9999 [ACK] Seq=332 Ack=562 Win=42496 Len=0 TSval=4035413514 TSecr=3913408338
38	11.031936	10.0.1.5	10.0.1.2	TCP	97	33016 → 9999 [PSH, ACK] Seq=332 Ack=562 Win=42496 Len=31 TSval=4035414515 TSecr=3913408338 [TCP segment of a reassembled PDU]
39	11.032543	10.0.1.2	10.0.1.5	TCP	117	9999 → 33016 [PSH, ACK] Seq=562 Ack=363 Win=43520 Len=51 TSval=3913409340 TSecr=4035414515 [TCP segment of a reassembled PDU]
40	11.032571	10.0.1.5	10.0.1.2	TCP	66	33016 → 9999 [ACK] Seq=363 Ack=613 Win=42496 Len=0 TSval=4035414516 TSecr=3913409340
41	12.034808	10.0.1.5	10.0.1.2	TCP	97	33016 → 9999 [PSH, ACK] Seq=363 Ack=613 Win=42496 Len=31 TSval=4035415518 TSecr=3913409340 [TCP segment of a reassembled PDU]
42	12.035550	10.0.1.2	10.0.1.5	TCP	117	9999 → 33016 [PSH, ACK] Seq=613 Ack=394 Win=43520 Len=51 TSval=3913410343 TSecr=4035415518 [TCP segment of a reassembled PDU]
43	12.035576	10.0.1.5	10.0.1.2	TCP	66	33016 → 9999 [ACK] Seq=394 Ack=664 Win=42496 Len=0 TSval=4035415519 TSecr=3913410343
44	13.037590	10.0.1.5	10.0.1.2	TCP	97	33016 → 9999 [PSH, ACK] Seq=394 Ack=664 Win=42496 Len=31 TSval=4035416521 TSecr=3913410343 [TCP segment of a reassembled PDU]
45	13.039142	10.0.1.2	10.0.1.5	TCP	117	9999 → 33016 [PSH, ACK] Seq=664 Ack=425 Win=43520 Len=51 TSval=3913411346 TSecr=4035416521 [TCP segment of a reassembled PDU]
46	13.039172	10.0.1.5	10.0.1.2	TCP	66	33016 → 9999 [ACK] Seq=425 Ack=715 Win=42496 Len=0 TSval=4035416522 TSecr=3913411346
47	14.041403	10.0.1.5	10.0.1.2	TCP	97	33016 → 9999 [PSH, ACK] Seq=425 Ack=715 Win=42496 Len=31 TSval=4035417525 TSecr=3913411346 [TCP segment of a reassembled PDU]
48	14.041716	10.0.1.2	10.0.1.5	TCP	117	9999 → 33016 [PSH, ACK] Seq=715 Ack=456 Win=43520 Len=51 TSval=3913412349 TSecr=4035417525 [TCP segment of a reassembled PDU]
49	14.041730	10.0.1.5	10.0.1.2	TCP	66	33016 → 9999 [ACK] Seq=456 Ack=766 Win=42496 Len=0 TSval=4035417525 TSecr=3913412349
50	15.043307	10.0.1.5	10.0.1.2	TCP	97	33016 → 9999 [PSH, ACK] Seq=456 Ack=766 Win=42496 Len=31 TSval=4035418526 TSecr=3913412349 [TCP segment of a reassembled PDU]
51	15.045684	10.0.1.2	10.0.1.5	TCP	117	9999 → 33016 [PSH, ACK] Seq=766 Ack=487 Win=43520 Len=51 TSval=3913413353 TSecr=4035418526 [TCP segment of a reassembled PDU]
52	15.045697	10.0.1.5	10.0.1.2	TCP	66	33016 → 9999 [ACK] Seq=487 Ack=817 Win=42496 Len=0 TSval=4035418529 TSecr=3913413353
53	16.047582	10.0.1.5	10.0.1.2	TCP	97	33016 → 9999 [PSH, ACK] Seq=487 Ack=817 Win=42496 Len=31 TSval=4035419531 TSecr=3913413353 [TCP segment of a reassembled PDU]
54	16.048060	10.0.1.2	10.0.1.5	TCP	117	9999 → 33016 [PSH, ACK] Seq=817 Ack=518 Win=43520 Len=51 TSval=3913414355 TSecr=4035419531 [TCP segment of a reassembled PDU]
55	16.048076	10.0.1.5	10.0.1.2	TCP	66	33016 → 9999 [ACK] Seq=518 Ack=868 Win=42496 Len=0 TSval=4035419531 TSecr=3913414355
56	17.049760	10.0.1.5	10.0.1.2	TCP	97	33016 → 9999 [PSH, ACK] Seq=518 Ack=868 Win=42496 Len=31 TSval=4035420533 TSecr=3913414355 [TCP segment of a reassembled PDU]
57	17.050099	10.0.1.2	10.0.1.5	TCP	117	9999 → 33016 [PSH, ACK] Seq=868 Ack=549 Win=43520 Len=51 TSval=3913415357 TSecr=4035420533 [TCP segment of a reassembled PDU]
58	17.050112	10.0.1.5	10.0.1.2	TCP	66	33016 → 9999 [ACK] Seq=549 Ack=919 Win=42496 Len=0 TSval=4035420533 TSecr=3913415357
59	18.051656	10.0.1.5	10.0.1.2	TCP	97	33016 → 9999 [PSH, ACK] Seq=549 Ack=919 Win=42496 Len=31 TSval=4035421535 TSecr=3913415357 [TCP segment of a reassembled PDU]
60	18.051905	10.0.1.2	10.0.1.5	TCP	117	9999 → 33016 [PSH, ACK] Seq=919 Ack=580 Win=43520 Len=51 TSval=3913416359 TSecr=4035421535 [TCP segment of a reassembled PDU]
61	18.051919	10.0.1.5	10.0.1.2	TCP	66	33016 → 9999 [ACK] Seq=580 Ack=970 Win=42496 Len=0 TSval=4035421535 TSecr=3913416359
62	19.053728	10.0.1.5	10.0.1.2	TCP	97	33016 → 9999 [PSH, ACK] Seq=580 Ack=970 Win=42496 Len=31 TSval=4035422537 TSecr=3913416359 [TCP segment of a reassembled PDU]
63	19.053994	10.0.1.2	10.0.1.5	TCP	117	9999 → 33016 [PSH, ACK] Seq=970 Ack=611 Win=43520 Len=51 TSval=3913417361 TSecr=4035422537 [TCP segment of a reassembled PDU]
64	19.054006	10.0.1.5	10.0.1.2	TCP	66	33016 → 9999 [ACK] Seq=611 Ack=1021 Win=42496 Len=0 TSval=4035422537 TSecr=3913417361
65	20.055344	10.0.1.5	10.0.1.2	TCP	97	33016 → 9999 [PSH, ACK] Seq=611 Ack=1021 Win=42496 Len=31 TSval=4035423538 TSecr=3913417361 [TCP segment of a reassembled PDU]
66	20.055595	10.0.1.2	10.0.1.5	TCP	117	9999 → 33016 [PSH, ACK] Seq=1021 Ack=642 Win=43520 Len=51 TSval=3913418363 TSecr=4035423538 [TCP segment of a reassembled PDU]
67	20.055608	10.0.1.5	10.0.1.2	TCP	66	33016 → 9999 [ACK] Seq=642 Ack=1072 Win=42496 Len=0 TSval=4035423539 TSecr=3913418363
68	20.343273	10.0.1.5	10.0.1.2	TCP	66	33016 → 9999 [FIN, ACK] Seq=642 Ack=1072 Win=42496 Len=0 TSval=4035423826 TSecr=3913418363
69	20.343642	10.0.1.2	10.0.1.5	TCP	66	9999 → 33016 [FIN, ACK] Seq=1072 Ack=643 Win=43520 Len=0 TSval=3913418651 TSecr=4035423826
70	20.343662	10.0.1.5	10.0.1.2	TCP	66	33016 → 9999 [ACK] Seq=643 Ack=1073 Win=42496 Len=0 TSval=4035423827 TSecr=3913418651