1	0.000000	10.0.1.5	10.0.1.2	TCP	74	54336 → 9999 [SYN] Seq=0 Win=42340 Len=0 MSS=1460 SACK_PERM=1 TSval=4216113653 TSecr=0 WS=512
2	0.001576	10.0.1.2	10.0.1.5	TCP	74	9999 → 54336 [SYN, ACK] Seq=0 Ack=1 Win=43440 Len=0 MSS=1460 SACK_PERM=1 TSval=2636969570 TSecr=4216113653 WS=512
3	0.001596	10.0.1.5	10.0.1.2	TCP	66	54336 → 9999 [ACK] Seq=1 Ack=1 Win=42496 Len=0 TSval=4216113655 TSecr=2636969570
4	0.001644	10.0.1.5	10.0.1.2	TCP	96	54336 → 9999 [PSH, ACK] Seq=1 Ack=1 Win=42496 Len=30 TSval=4216113655 TSecr=2636969570 [TCP segment of a reassembled PDU]
5	0.003723	10.0.1.2	10.0.1.5	TCP	54	9999 → 54336 [RST] Seq=1 Win=0 Len=0
6	0.003753	10.0.1.2	10.0.1.5	TCP	54	9999 → 54336 [RST] Seq=1 Win=0 Len=0
7	1.057619	10.0.1.2	10.0.1.5	TCP	74	[TCP Retransmission] 9999 → 54336 [SYN, ACK] Seq=0 Ack=1 Win=43440 Len=0 MSS=1460 SACK_PERM=1 TSval=2636970627 TSecr=4216113653 WS=512
8	1.057630	10.0.1.5	10.0.1.2	TCP	54	54336 → 9999 [RST] Seq=1 Win=0 Len=0
9	5.409591	00:00:00_00:00:03	00:00:00_00:00:01	ARP	42	Who has 10.0.1.2? Tell 10.0.1.5
10	5.411623	00:00:00_00:00:01	00:00:00_00:00:03	ARP	42	Who has 10.0.1.5? Tell 10.0.1.2
11	5.411630	00:00:00_00:00:03	00:00:00_00:00:01	ARP	42	10.0.1.5 is at 00:00:00:00:00:03
12	5.411681	00:00:00_00:00:02	00:00:00_00:00:03	ARP	42	Who has 10.0.1.5? Tell 10.0.1.3
13	5.411683	00:00:00_00:00:03	00:00:00_00:00:02	ARP	42	10.0.1.5 is at 00:00:00:00:00:03
14	5.413137	00:00:00_00:00:01	00:00:00_00:00:03	ARP	42	10.0.1.2 is at 00:00:00:00:00:01
15	6.521123	10.0.1.5	10.0.1.2	TCP	74	50686 → 9999 [SYN] Seq=0 Win=42340 Len=0 MSS=1460 SACK_PERM=1 TSval=4216120174 TSecr=0 WS=512
16	6.522819	10.0.1.2	10.0.1.5	TCP	74	9999 → 50686 [SYN, ACK] Seq=0 Ack=1 Win=43440 Len=0 MSS=1460 SACK_PERM=1 TSval=2636976092 TSecr=4216120174 WS=512
17	6.522826	10.0.1.5	10.0.1.2	TCP	66	50686 → 9999 [ACK] Seq=1 Ack=1 Win=42496 Len=0 TSval=4216120176 TSecr=2636976092
18	6.522924	10.0.1.5	10.0.1.2	TCP	96	50686 → 9999 [PSH, ACK] Seq=1 Ack=1 Win=42496 Len=30 TSval=4216120176 TSecr=2636976092 [TCP segment of a reassembled PDU]
19	6.522934	10.0.1.2	10.0.1.5	TCP	66	9999 → 50686 [ACK] Seq=1 Ack=31 Win=43520 Len=0 TSval=2636976092 TSecr=4216120176
20	6.523202	10.0.1.2	10.0.1.5	TCP	117	9999 → 50686 [PSH, ACK] Seq=1 Ack=31 Win=43520 Len=51 TSval=2636976092 TSecr=4216120176 [TCP segment of a reassembled PDU]
21	6.523215	10.0.1.5	10.0.1.2	TCP	66	50686 → 9999 [ACK] Seq=31 Ack=52 Win=42496 Len=0 TSval=4216120176 TSecr=2636976092
22	7.524467	10.0.1.5	10.0.1.2	TCP	96	50686 → 9999 [PSH, ACK] Seq=31 Ack=52 Win=42496 Len=30 TSval=4216121177 TSecr=2636976092 [TCP segment of a reassembled PDU]
23	7.524771	10.0.1.2	10.0.1.5	TCP	117	9999 → 50686 [PSH, ACK] Seq=52 Ack=61 Win=43520 Len=51 TSval=2636977094 TSecr=4216121177 [TCP segment of a reassembled PDU]
24	7.524781	10.0.1.5	10.0.1.2	TCP	66	50686 → 9999 [ACK] Seq=61 Ack=103 Win=42496 Len=0 TSval=4216121178 TSecr=2636977094
25	8.526660	10.0.1.5	10.0.1.2	TCP	96	50686 → 9999 [PSH, ACK] Seq=61 Ack=103 Win=42496 Len=30 TSval=4216122180 TSecr=2636977094 [TCP segment of a reassembled PDU]
26	8.527022	10.0.1.2	10.0.1.5	TCP	117	9999 → 50686 [PSH, ACK] Seq=103 Ack=91 Win=43520 Len=51 TSval=2636978096 TSecr=4216122180 [TCP segment of a reassembled PDU]
27	8.527034	10.0.1.5	10.0.1.2	TCP	66	50686 → 9999 [ACK] Seq=91 Ack=154 Win=42496 Len=0 TSval=4216122180 TSecr=2636978096
28	9.528281	10.0.1.5	10.0.1.2	TCP	96	50686 → 9999 [PSH, ACK] Seq=91 Ack=154 Win=42496 Len=30 TSval=4216123181 TSecr=2636978096 [TCP segment of a reassembled PDU]
29	9.528395	10.0.1.2	10.0.1.5	TCP	117	9999 → 50686 [PSH, ACK] Seq=154 Ack=121 Win=43520 Len=51 TSval=2636979097 TSecr=4216123181 [TCP segment of a reassembled PDU]
30	9.528401	10.0.1.5	10.0.1.2	TCP	66	50686 → 9999 [ACK] Seq=121 Ack=205 Win=42496 Len=0 TSval=4216123181 TSecr=2636979097
31	10.530111	10.0.1.5	10.0.1.2	TCP	96	50686 → 9999 [PSH, ACK] Seq=121 Ack=205 Win=42496 Len=30 TSval=4216124183 TSecr=2636979097 [TCP segment of a reassembled PDU]
32	10.530453	10.0.1.2	10.0.1.5	TCP	117	9999 → 50686 [PSH, ACK] Seq=205 Ack=151 Win=43520 Len=51 TSval=2636980099 TSecr=4216124183 [TCP segment of a reassembled PDU]
33	10.530517	10.0.1.5	10.0.1.2	TCP	66	50686 → 9999 [ACK] Seq=151 Ack=256 Win=42496 Len=0 TSval=4216124183 TSecr=2636980099
34	11.532109	10.0.1.5	10.0.1.2	TCP	96	50686 → 9999 [PSH, ACK] Seq=151 Ack=256 Win=42496 Len=30 TSval=4216125185 TSecr=2636980099 [TCP segment of a reassembled PDU]
35	11.532216	10.0.1.2	10.0.1.5	TCP	117	9999 → 50686 [PSH, ACK] Seq=256 Ack=181 Win=43520 Len=51 TSval=2636981101 TSecr=4216125185 [TCP segment of a reassembled PDU]
36	11.532219	10.0.1.5	10.0.1.2	TCP	66	50686 → 9999 [ACK] Seq=181 Ack=307 Win=42496 Len=0 TSval=4216125185 TSecr=2636981101
37	12.533511	10.0.1.5	10.0.1.2	TCP	96	50686 → 9999 [PSH, ACK] Seq=181 Ack=307 Win=42496 Len=30 TSval=4216126187 TSecr=2636981101 [TCP segment of a reassembled PDU]
38	12.533816	10.0.1.2	10.0.1.5	TCP	117	9999 → 50686 [PSH, ACK] Seq=307 Ack=211 Win=43520 Len=51 TSval=2636982103 TSecr=4216126187 [TCP segment of a reassembled PDU]
39	12.533824	10.0.1.5	10.0.1.2	TCP	66	50686 → 9999 [ACK] Seq=211 Ack=358 Win=42496 Len=0 TSval=4216126187 TSecr=2636982103
40	13.535143	10.0.1.5	10.0.1.2	TCP	96	50686 → 9999 [PSH, ACK] Seq=211 Ack=358 Win=42496 Len=30 TSval=4216127188 TSecr=2636982103 [TCP segment of a reassembled PDU]
41	13.535445	10.0.1.2	10.0.1.5	TCP	117	9999 → 50686 [PSH, ACK] Seq=358 Ack=241 Win=43520 Len=51 TSval=2636983104 TSecr=4216127188 [TCP segment of a reassembled PDU]
42	13.535549	10.0.1.5	10.0.1.2	TCP	66	50686 → 9999 [ACK] Seq=241 Ack=409 Win=42496 Len=0 TSval=4216127188 TSecr=2636983104
43	14.536915	10.0.1.5	10.0.1.2	TCP	96	50686 → 9999 [PSH, ACK] Seq=241 Ack=409 Win=42496 Len=30 TSval=4216128190 TSecr=2636983104 [TCP segment of a reassembled PDU]
44	14.537073	10.0.1.2	10.0.1.5	TCP	117	9999 → 50686 [PSH, ACK] Seq=409 Ack=271 Win=43520 Len=51 TSval=2636984106 TSecr=4216128190 [TCP segment of a reassembled PDU]
45	14.537081	10.0.1.5	10.0.1.2	TCP	66	50686 → 9999 [ACK] Seq=271 Ack=460 Win=42496 Len=0 TSval=4216128190 TSecr=2636984106
46	15.538569	10.0.1.5	10.0.1.2	TCP	96	50686 → 9999 [PSH, ACK] Seq=271 Ack=460 Win=42496 Len=30 TSval=4216129191 TSecr=2636984106 [TCP segment of a reassembled PDU]
47	15.538707	10.0.1.2	10.0.1.5	TCP	117	9999 → 50686 [PSH, ACK] Seq=460 Ack=301 Win=43520 Len=51 TSval=2636985108 TSecr=4216129191 [TCP segment of a reassembled PDU]
48	15.538715	10.0.1.5	10.0.1.2	TCP	66	50686 → 9999 [ACK] Seq=301 Ack=511 Win=42496 Len=0 TSval=4216129192 TSecr=2636985108
49	16.540283	10.0.1.5	10.0.1.2	TCP	97	50686 → 9999 [PSH, ACK] Seq=301 Ack=511 Win=42496 Len=31 TSval=4216130193 TSecr=2636985108 [TCP segment of a reassembled PDU]
50	16.540416	10.0.1.2	10.0.1.5	TCP	117	9999 → 50686 [PSH, ACK] Seq=511 Ack=332 Win=43520 Len=51 TSval=2636986109 TSecr=4216130193 [TCP segment of a reassembled PDU]
51	16.540424	10.0.1.5	10.0.1.2	TCP	66	50686 → 9999 [ACK] Seq=332 Ack=562 Win=42496 Len=0 TSval=4216130193 TSecr=2636986109
52	17.541832	10.0.1.5	10.0.1.2	TCP	97	50686 → 9999 [PSH, ACK] Seq=332 Ack=562 Win=42496 Len=31 TSval=4216131195 TSecr=2636986109 [TCP segment of a reassembled PDU]
53	17.541915	10.0.1.2	10.0.1.5	TCP	117	9999 → 50686 [PSH, ACK] Seq=562 Ack=363 Win=43520 Len=51 TSval=2636987111 TSecr=4216131195 [TCP segment of a reassembled PDU]
54	17.541919	10.0.1.5	10.0.1.2	TCP	66	50686 → 9999 [ACK] Seq=363 Ack=613 Win=42496 Len=0 TSval=4216131195 TSecr=2636987111
55	18.543303	10.0.1.5	10.0.1.2	TCP	97	50686 → 9999 [PSH, ACK] Seq=363 Ack=613 Win=42496 Len=31 TSval=4216132196 TSecr=2636987111 [TCP segment of a reassembled PDU]
56	18.543387	10.0.1.2	10.0.1.5	TCP	117	9999 → 50686 [PSH, ACK] Seq=613 Ack=394 Win=43520 Len=51 TSval=2636988112 TSecr=4216132196 [TCP segment of a reassembled PDU]
57	18.543392	10.0.1.5	10.0.1.2	TCP	66	50686 → 9999 [ACK] Seq=394 Ack=664 Win=42496 Len=0 TSval=4216132196 TSecr=2636988112
58	18.628638	10.0.1.5	10.0.1.2	TCP	66	50686 → 9999 [FIN, ACK] Seq=394 Ack=664 Win=42496 Len=0 TSval=4216132282 TSecr=2636988112
59	18.628764	10.0.1.2	10.0.1.5	TCP	66	9999 → 50686 [FIN, ACK] Seq=664 Ack=395 Win=43520 Len=0 TSval=2636988198 TSecr=4216132282
60	18.628769	10.0.1.5	10.0.1.2	TCP	66	50686 → 9999 [ACK] Seq=395 Ack=665 Win=42496 Len=0 TSval=4216132282 TSecr=2636988198