1	0.000000	10.0.1.5	10.0.1.2	TCP	74	35402 → 9999 [SYN] Seq=0 Win=42340 Len=0 MSS=1460 SACK_PERM=1 TSval=4216190281 TSecr=0 WS=512
2	0.001719	10.0.1.2	10.0.1.5	TCP	74	9999 → 35402 [SYN, ACK] Seq=0 Ack=1 Win=43440 Len=0 MSS=1460 SACK_PERM=1 TSval=2637046199 TSecr=4216190281 WS=512
3	0.001739	10.0.1.5	10.0.1.2	TCP	66	35402 → 9999 [ACK] Seq=1 Ack=1 Win=42496 Len=0 TSval=4216190283 TSecr=2637046199
4	0.001876	10.0.1.5	10.0.1.2	TCP	96	35402 → 9999 [PSH, ACK] Seq=1 Ack=1 Win=42496 Len=30 TSval=4216190283 TSecr=2637046199 [TCP segment of a reassembled PDU]
5	0.001942	10.0.1.2	10.0.1.5	TCP	66	9999 → 35402 [ACK] Seq=1 Ack=31 Win=43520 Len=0 TSval=2637046199 TSecr=4216190283
6	0.002058	10.0.1.2	10.0.1.5	TCP	117	9999 → 35402 [PSH, ACK] Seq=1 Ack=31 Win=43520 Len=51 TSval=2637046199 TSecr=4216190283 [TCP segment of a reassembled PDU]
7	0.002075	10.0.1.5	10.0.1.2	TCP	66	35402 → 9999 [ACK] Seq=31 Ack=52 Win=42496 Len=0 TSval=4216190283 TSecr=2637046199
8	0.003411	10.0.1.2	10.0.1.5	TCP	54	9999 → 35402 [RST] Seq=1 Win=0 Len=0
9	1.003531	10.0.1.5	10.0.1.2	TCP	96	35402 → 9999 [PSH, ACK] Seq=31 Ack=52 Win=42496 Len=30 TSval=4216191285 TSecr=2637046199 [TCP segment of a reassembled PDU]
10	1.003726	10.0.1.2	10.0.1.5	TCP	117	9999 → 35402 [PSH, ACK] Seq=52 Ack=61 Win=43520 Len=51 TSval=2637047201 TSecr=4216191285 [TCP segment of a reassembled PDU]
11	1.003736	10.0.1.5	10.0.1.2	TCP	66	35402 → 9999 [ACK] Seq=61 Ack=103 Win=42496 Len=0 TSval=4216191285 TSecr=2637047201
12	2.005032	10.0.1.5	10.0.1.2	TCP	96	35402 → 9999 [PSH, ACK] Seq=61 Ack=103 Win=42496 Len=30 TSval=4216192286 TSecr=2637047201 [TCP segment of a reassembled PDU]
13	2.005214	10.0.1.2	10.0.1.5	TCP	117	9999 → 35402 [PSH, ACK] Seq=103 Ack=91 Win=43520 Len=51 TSval=2637048202 TSecr=4216192286 [TCP segment of a reassembled PDU]
14	2.005220	10.0.1.5	10.0.1.2	TCP	66	35402 → 9999 [ACK] Seq=91 Ack=154 Win=42496 Len=0 TSval=4216192286 TSecr=2637048202
15	3.006577	10.0.1.5	10.0.1.2	TCP	96	35402 → 9999 [PSH, ACK] Seq=91 Ack=154 Win=42496 Len=30 TSval=4216193288 TSecr=2637048202 [TCP segment of a reassembled PDU]
16	3.006832	10.0.1.2	10.0.1.5	TCP	117	9999 → 35402 [PSH, ACK] Seq=154 Ack=121 Win=43520 Len=51 TSval=2637049204 TSecr=4216193288 [TCP segment of a reassembled PDU]
17	3.006841	10.0.1.5	10.0.1.2	TCP	66	35402 → 9999 [ACK] Seq=121 Ack=205 Win=42496 Len=0 TSval=4216193288 TSecr=2637049204
18	4.008152	10.0.1.5	10.0.1.2	TCP	96	35402 → 9999 [PSH, ACK] Seq=121 Ack=205 Win=42496 Len=30 TSval=4216194289 TSecr=2637049204 [TCP segment of a reassembled PDU]
19	4.008548	10.0.1.2	10.0.1.5	TCP	117	9999 → 35402 [PSH, ACK] Seq=205 Ack=151 Win=43520 Len=51 TSval=2637050206 TSecr=4216194289 [TCP segment of a reassembled PDU]
20	4.008562	10.0.1.5	10.0.1.2	TCP	66	35402 → 9999 [ACK] Seq=151 Ack=256 Win=42496 Len=0 TSval=4216194290 TSecr=2637050206
21	5.010046	10.0.1.5	10.0.1.2	TCP	96	35402 → 9999 [PSH, ACK] Seq=151 Ack=256 Win=42496 Len=30 TSval=4216195291 TSecr=2637050206 [TCP segment of a reassembled PDU]
22	5.010493	10.0.1.2	10.0.1.5	TCP	117	9999 → 35402 [PSH, ACK] Seq=256 Ack=181 Win=43520 Len=51 TSval=2637051208 TSecr=4216195291 [TCP segment of a reassembled PDU]
23	5.010506	10.0.1.5	10.0.1.2	TCP	66	35402 → 9999 [ACK] Seq=181 Ack=307 Win=42496 Len=0 TSval=4216195292 TSecr=2637051208
24	5.071154	00:00:00_00:00:01	00:00:00_00:00:03	ARP	42	Who has 10.0.1.5? Tell 10.0.1.2
25	5.071163	00:00:00_00:00:03	00:00:00_00:00:01	ARP	42	10.0.1.5 is at 00:00:00:00:00:03
26	6.011880	10.0.1.5	10.0.1.2	TCP	96	35402 → 9999 [PSH, ACK] Seq=181 Ack=307 Win=42496 Len=30 TSval=4216196293 TSecr=2637051208 [TCP segment of a reassembled PDU]
27	6.012157	10.0.1.2	10.0.1.5	TCP	117	9999 → 35402 [PSH, ACK] Seq=307 Ack=211 Win=43520 Len=51 TSval=2637052209 TSecr=4216196293 [TCP segment of a reassembled PDU]
28	6.012169	10.0.1.5	10.0.1.2	TCP	66	35402 → 9999 [ACK] Seq=211 Ack=358 Win=42496 Len=0 TSval=4216196293 TSecr=2637052209
29	7.013794	10.0.1.5	10.0.1.2	TCP	96	35402 → 9999 [PSH, ACK] Seq=211 Ack=358 Win=42496 Len=30 TSval=4216197295 TSecr=2637052209 [TCP segment of a reassembled PDU]
30	7.014296	10.0.1.2	10.0.1.5	TCP	117	9999 → 35402 [PSH, ACK] Seq=358 Ack=241 Win=43520 Len=51 TSval=2637053211 TSecr=4216197295 [TCP segment of a reassembled PDU]
31	7.014306	10.0.1.5	10.0.1.2	TCP	66	35402 → 9999 [ACK] Seq=241 Ack=409 Win=42496 Len=0 TSval=4216197295 TSecr=2637053211
32	8.015829	10.0.1.5	10.0.1.2	TCP	96	35402 → 9999 [PSH, ACK] Seq=241 Ack=409 Win=42496 Len=30 TSval=4216198297 TSecr=2637053211 [TCP segment of a reassembled PDU]
33	8.016082	10.0.1.2	10.0.1.5	TCP	117	9999 → 35402 [PSH, ACK] Seq=409 Ack=271 Win=43520 Len=51 TSval=2637054213 TSecr=4216198297 [TCP segment of a reassembled PDU]
34	8.016096	10.0.1.5	10.0.1.2	TCP	66	35402 → 9999 [ACK] Seq=271 Ack=460 Win=42496 Len=0 TSval=4216198297 TSecr=2637054213
35	9.017081	10.0.1.5	10.0.1.2	TCP	96	35402 → 9999 [PSH, ACK] Seq=271 Ack=460 Win=42496 Len=30 TSval=4216199298 TSecr=2637054213 [TCP segment of a reassembled PDU]
36	9.017488	10.0.1.2	10.0.1.5	TCP	117	9999 → 35402 [PSH, ACK] Seq=460 Ack=301 Win=43520 Len=51 TSval=2637055215 TSecr=4216199298 [TCP segment of a reassembled PDU]
37	9.017505	10.0.1.5	10.0.1.2	TCP	66	35402 → 9999 [ACK] Seq=301 Ack=511 Win=42496 Len=0 TSval=4216199299 TSecr=2637055215
38	10.018852	10.0.1.5	10.0.1.2	TCP	97	35402 → 9999 [PSH, ACK] Seq=301 Ack=511 Win=42496 Len=31 TSval=4216200300 TSecr=2637055215 [TCP segment of a reassembled PDU]
39	10.019197	10.0.1.2	10.0.1.5	TCP	117	9999 → 35402 [PSH, ACK] Seq=511 Ack=332 Win=43520 Len=51 TSval=2637056216 TSecr=4216200300 [TCP segment of a reassembled PDU]
40	10.019210	10.0.1.5	10.0.1.2	TCP	66	35402 → 9999 [ACK] Seq=332 Ack=562 Win=42496 Len=0 TSval=4216200300 TSecr=2637056216
41	11.020861	10.0.1.5	10.0.1.2	TCP	97	35402 → 9999 [PSH, ACK] Seq=332 Ack=562 Win=42496 Len=31 TSval=4216201302 TSecr=2637056216 [TCP segment of a reassembled PDU]
42	11.021149	10.0.1.2	10.0.1.5	TCP	117	9999 → 35402 [PSH, ACK] Seq=562 Ack=363 Win=43520 Len=51 TSval=2637057218 TSecr=4216201302 [TCP segment of a reassembled PDU]
43	11.021162	10.0.1.5	10.0.1.2	TCP	66	35402 → 9999 [ACK] Seq=363 Ack=613 Win=42496 Len=0 TSval=4216201302 TSecr=2637057218
44	12.022440	10.0.1.5	10.0.1.2	TCP	97	35402 → 9999 [PSH, ACK] Seq=363 Ack=613 Win=42496 Len=31 TSval=4216202304 TSecr=2637057218 [TCP segment of a reassembled PDU]
45	12.022547	10.0.1.2	10.0.1.5	TCP	117	9999 → 35402 [PSH, ACK] Seq=613 Ack=394 Win=43520 Len=51 TSval=2637058220 TSecr=4216202304 [TCP segment of a reassembled PDU]
46	12.022553	10.0.1.5	10.0.1.2	TCP	66	35402 → 9999 [ACK] Seq=394 Ack=664 Win=42496 Len=0 TSval=4216202304 TSecr=2637058220
47	12.375073	10.0.1.5	10.0.1.2	TCP	66	35402 → 9999 [FIN, ACK] Seq=394 Ack=664 Win=42496 Len=0 TSval=4216202656 TSecr=2637058220
48	12.375230	10.0.1.2	10.0.1.5	TCP	66	9999 → 35402 [FIN, ACK] Seq=664 Ack=395 Win=43520 Len=0 TSval=2637058572 TSecr=4216202656
49	12.375237	10.0.1.5	10.0.1.2	TCP	66	35402 → 9999 [ACK] Seq=395 Ack=665 Win=42496 Len=0 TSval=4216202656 TSecr=2637058572