1	0.000000	00:00:00_00:00:03	Broadcast	ARP	42	Who has 10.0.1.2? Tell 10.0.1.5
2	0.002018	00:00:00_00:00:01	00:00:00_00:00:03	ARP	42	10.0.1.2 is at 00:00:00:00:00:01
3	0.002020	10.0.1.5	10.0.1.2	TCP	74	44416 → 9999 [SYN] Seq=0 Win=42340 Len=0 MSS=1460 SACK_PERM=1 TSval=4223692726 TSecr=0 WS=512
4	0.005042	00:00:00_00:00:02	Broadcast	ARP	42	Who has 10.0.1.5? Tell 10.0.1.3
5	0.005046	00:00:00_00:00:03	00:00:00_00:00:02	ARP	42	10.0.1.5 is at 00:00:00:00:00:03
6	0.006015	10.0.1.2	10.0.1.5	TCP	74	9999 → 44416 [SYN, ACK] Seq=0 Ack=1 Win=43440 Len=0 MSS=1460 SACK_PERM=1 TSval=2644548646 TSecr=4223692726 WS=512
7	0.006053	10.0.1.5	10.0.1.2	TCP	66	44416 → 9999 [ACK] Seq=1 Ack=1 Win=42496 Len=0 TSval=4223692732 TSecr=2644548646
8	0.006215	10.0.1.5	10.0.1.2	TCP	96	44416 → 9999 [PSH, ACK] Seq=1 Ack=1 Win=42496 Len=30 TSval=4223692733 TSecr=2644548646 [TCP segment of a reassembled PDU]
9	0.006224	10.0.1.2	10.0.1.5	TCP	66	9999 → 44416 [ACK] Seq=1 Ack=31 Win=43520 Len=0 TSval=2644548649 TSecr=4223692733
10	0.006372	10.0.1.2	10.0.1.5	TCP	117	9999 → 44416 [PSH, ACK] Seq=1 Ack=31 Win=43520 Len=51 TSval=2644548649 TSecr=4223692733 [TCP segment of a reassembled PDU]
11	0.006389	10.0.1.5	10.0.1.2	TCP	66	44416 → 9999 [ACK] Seq=31 Ack=52 Win=42496 Len=0 TSval=4223692733 TSecr=2644548649
12	1.007891	10.0.1.5	10.0.1.2	TCP	96	44416 → 9999 [PSH, ACK] Seq=31 Ack=52 Win=42496 Len=30 TSval=4223693734 TSecr=2644548649 [TCP segment of a reassembled PDU]
13	1.008391	10.0.1.2	10.0.1.5	TCP	117	9999 → 44416 [PSH, ACK] Seq=52 Ack=61 Win=43520 Len=51 TSval=2644549651 TSecr=4223693734 [TCP segment of a reassembled PDU]
14	1.008409	10.0.1.5	10.0.1.2	TCP	66	44416 → 9999 [ACK] Seq=61 Ack=103 Win=42496 Len=0 TSval=4223693735 TSecr=2644549651
15	2.010305	10.0.1.5	10.0.1.2	TCP	96	44416 → 9999 [PSH, ACK] Seq=61 Ack=103 Win=42496 Len=30 TSval=4223694737 TSecr=2644549651 [TCP segment of a reassembled PDU]
16	2.010938	10.0.1.2	10.0.1.5	TCP	117	9999 → 44416 [PSH, ACK] Seq=103 Ack=91 Win=43520 Len=51 TSval=2644550653 TSecr=4223694737 [TCP segment of a reassembled PDU]
17	2.010966	10.0.1.5	10.0.1.2	TCP	66	44416 → 9999 [ACK] Seq=91 Ack=154 Win=42496 Len=0 TSval=4223694737 TSecr=2644550653
18	3.012816	10.0.1.5	10.0.1.2	TCP	96	44416 → 9999 [PSH, ACK] Seq=91 Ack=154 Win=42496 Len=30 TSval=4223695739 TSecr=2644550653 [TCP segment of a reassembled PDU]
19	3.013388	10.0.1.2	10.0.1.5	TCP	117	9999 → 44416 [PSH, ACK] Seq=154 Ack=121 Win=43520 Len=51 TSval=2644551656 TSecr=4223695739 [TCP segment of a reassembled PDU]
20	3.013404	10.0.1.5	10.0.1.2	TCP	66	44416 → 9999 [ACK] Seq=121 Ack=205 Win=42496 Len=0 TSval=4223695740 TSecr=2644551656
21	4.015253	10.0.1.5	10.0.1.2	TCP	96	44416 → 9999 [PSH, ACK] Seq=121 Ack=205 Win=42496 Len=30 TSval=4223696742 TSecr=2644551656 [TCP segment of a reassembled PDU]
22	4.015530	10.0.1.2	10.0.1.5	TCP	117	9999 → 44416 [PSH, ACK] Seq=205 Ack=151 Win=43520 Len=51 TSval=2644552658 TSecr=4223696742 [TCP segment of a reassembled PDU]
23	4.015546	10.0.1.5	10.0.1.2	TCP	66	44416 → 9999 [ACK] Seq=151 Ack=256 Win=42496 Len=0 TSval=4223696742 TSecr=2644552658
24	5.017151	10.0.1.5	10.0.1.2	TCP	96	44416 → 9999 [PSH, ACK] Seq=151 Ack=256 Win=42496 Len=30 TSval=4223697744 TSecr=2644552658 [TCP segment of a reassembled PDU]
25	5.017436	10.0.1.2	10.0.1.5	TCP	117	9999 → 44416 [PSH, ACK] Seq=256 Ack=181 Win=43520 Len=51 TSval=2644553660 TSecr=4223697744 [TCP segment of a reassembled PDU]
26	5.017449	10.0.1.5	10.0.1.2	TCP	66	44416 → 9999 [ACK] Seq=181 Ack=307 Win=42496 Len=0 TSval=4223697744 TSecr=2644553660
27	6.018898	10.0.1.5	10.0.1.2	TCP	96	44416 → 9999 [PSH, ACK] Seq=181 Ack=307 Win=42496 Len=30 TSval=4223698745 TSecr=2644553660 [TCP segment of a reassembled PDU]
28	6.019381	10.0.1.2	10.0.1.5	TCP	117	9999 → 44416 [PSH, ACK] Seq=307 Ack=211 Win=43520 Len=51 TSval=2644554662 TSecr=4223698745 [TCP segment of a reassembled PDU]
29	6.019400	10.0.1.5	10.0.1.2	TCP	66	44416 → 9999 [ACK] Seq=211 Ack=358 Win=42496 Len=0 TSval=4223698746 TSecr=2644554662
30	7.020752	10.0.1.5	10.0.1.2	TCP	96	44416 → 9999 [PSH, ACK] Seq=211 Ack=358 Win=42496 Len=30 TSval=4223699747 TSecr=2644554662 [TCP segment of a reassembled PDU]
31	7.021116	10.0.1.2	10.0.1.5	TCP	117	9999 → 44416 [PSH, ACK] Seq=358 Ack=241 Win=43520 Len=51 TSval=2644555663 TSecr=4223699747 [TCP segment of a reassembled PDU]
32	7.021152	10.0.1.5	10.0.1.2	TCP	66	44416 → 9999 [ACK] Seq=241 Ack=409 Win=42496 Len=0 TSval=4223699747 TSecr=2644555663
33	8.022573	10.0.1.5	10.0.1.2	TCP	96	44416 → 9999 [PSH, ACK] Seq=241 Ack=409 Win=42496 Len=30 TSval=4223700749 TSecr=2644555663 [TCP segment of a reassembled PDU]
34	8.022775	10.0.1.2	10.0.1.5	TCP	117	9999 → 44416 [PSH, ACK] Seq=409 Ack=271 Win=43520 Len=51 TSval=2644556665 TSecr=4223700749 [TCP segment of a reassembled PDU]
35	8.022780	10.0.1.5	10.0.1.2	TCP	66	44416 → 9999 [ACK] Seq=271 Ack=460 Win=42496 Len=0 TSval=4223700749 TSecr=2644556665
36	9.024086	10.0.1.5	10.0.1.2	TCP	96	44416 → 9999 [PSH, ACK] Seq=271 Ack=460 Win=42496 Len=30 TSval=4223701750 TSecr=2644556665 [TCP segment of a reassembled PDU]
37	9.024226	10.0.1.2	10.0.1.5	TCP	117	9999 → 44416 [PSH, ACK] Seq=460 Ack=301 Win=43520 Len=51 TSval=2644557667 TSecr=4223701750 [TCP segment of a reassembled PDU]
38	9.024235	10.0.1.5	10.0.1.2	TCP	66	44416 → 9999 [ACK] Seq=301 Ack=511 Win=42496 Len=0 TSval=4223701751 TSecr=2644557667
39	10.025638	10.0.1.5	10.0.1.2	TCP	97	44416 → 9999 [PSH, ACK] Seq=301 Ack=511 Win=42496 Len=31 TSval=4223702752 TSecr=2644557667 [TCP segment of a reassembled PDU]
40	10.025789	10.0.1.2	10.0.1.5	TCP	117	9999 → 44416 [PSH, ACK] Seq=511 Ack=332 Win=43520 Len=51 TSval=2644558668 TSecr=4223702752 [TCP segment of a reassembled PDU]
41	10.025794	10.0.1.5	10.0.1.2	TCP	66	44416 → 9999 [ACK] Seq=332 Ack=562 Win=42496 Len=0 TSval=4223702752 TSecr=2644558668
42	11.027202	10.0.1.5	10.0.1.2	TCP	97	44416 → 9999 [PSH, ACK] Seq=332 Ack=562 Win=42496 Len=31 TSval=4223703753 TSecr=2644558668 [TCP segment of a reassembled PDU]
43	11.027398	10.0.1.2	10.0.1.5	TCP	117	9999 → 44416 [PSH, ACK] Seq=562 Ack=363 Win=43520 Len=51 TSval=2644559670 TSecr=4223703753 [TCP segment of a reassembled PDU]
44	11.027409	10.0.1.5	10.0.1.2	TCP	66	44416 → 9999 [ACK] Seq=363 Ack=613 Win=42496 Len=0 TSval=4223703754 TSecr=2644559670
45	12.028973	10.0.1.5	10.0.1.2	TCP	97	44416 → 9999 [PSH, ACK] Seq=363 Ack=613 Win=42496 Len=31 TSval=4223704755 TSecr=2644559670 [TCP segment of a reassembled PDU]
46	12.029268	10.0.1.2	10.0.1.5	TCP	117	9999 → 44416 [PSH, ACK] Seq=613 Ack=394 Win=43520 Len=51 TSval=2644560672 TSecr=4223704755 [TCP segment of a reassembled PDU]
47	12.029280	10.0.1.5	10.0.1.2	TCP	66	44416 → 9999 [ACK] Seq=394 Ack=664 Win=42496 Len=0 TSval=4223704756 TSecr=2644560672
48	12.696814	10.0.1.5	10.0.1.2	TCP	66	44416 → 9999 [FIN, ACK] Seq=394 Ack=664 Win=42496 Len=0 TSval=4223705423 TSecr=2644560672
49	12.698473	10.0.1.2	10.0.1.5	TCP	66	9999 → 44416 [FIN, ACK] Seq=664 Ack=395 Win=43520 Len=0 TSval=2644561341 TSecr=4223705423
50	12.698489	10.0.1.5	10.0.1.2	TCP	66	44416 → 9999 [ACK] Seq=395 Ack=665 Win=42496 Len=0 TSval=4223705425 TSecr=2644561341