1	0.000000	10.0.1.5	10.0.1.2	TCP	74	53876 → 9999 [SYN] Seq=0 Win=42340 Len=0 MSS=1460 SACK_PERM=1 TSval=4215945871 TSecr=0 WS=512
2	0.001684	10.0.1.2	10.0.1.5	TCP	74	9999 → 53876 [SYN, ACK] Seq=0 Ack=1 Win=43440 Len=0 MSS=1460 SACK_PERM=1 TSval=2636801789 TSecr=4215945871 WS=512
3	0.001707	10.0.1.5	10.0.1.2	TCP	66	53876 → 9999 [ACK] Seq=1 Ack=1 Win=42496 Len=0 TSval=4215945873 TSecr=2636801789
4	0.001737	10.0.1.5	10.0.1.2	TCP	96	53876 → 9999 [PSH, ACK] Seq=1 Ack=1 Win=42496 Len=30 TSval=4215945873 TSecr=2636801789 [TCP segment of a reassembled PDU]
5	0.003730	10.0.1.2	10.0.1.5	TCP	54	9999 → 53876 [RST] Seq=1 Win=0 Len=0
6	0.004430	10.0.1.2	10.0.1.5	TCP	54	9999 → 53876 [RST] Seq=1 Win=0 Len=0
7	1.031434	10.0.1.2	10.0.1.5	TCP	74	[TCP Retransmission] 9999 → 53876 [SYN, ACK] Seq=0 Ack=1 Win=43440 Len=0 MSS=1460 SACK_PERM=1 TSval=2636802819 TSecr=4215945871 WS=512
8	1.031452	10.0.1.5	10.0.1.2	TCP	54	53876 → 9999 [RST] Seq=1 Win=0 Len=0
9	5.255443	00:00:00_00:00:03	00:00:00_00:00:01	ARP	42	Who has 10.0.1.2? Tell 10.0.1.5
10	5.256960	00:00:00_00:00:01	00:00:00_00:00:03	ARP	42	Who has 10.0.1.5? Tell 10.0.1.2
11	5.256966	00:00:00_00:00:03	00:00:00_00:00:01	ARP	42	10.0.1.5 is at 00:00:00:00:00:03
12	5.256980	00:00:00_00:00:02	00:00:00_00:00:03	ARP	42	Who has 10.0.1.5? Tell 10.0.1.3
13	5.256980	00:00:00_00:00:03	00:00:00_00:00:02	ARP	42	10.0.1.5 is at 00:00:00:00:00:03
14	5.257976	00:00:00_00:00:01	00:00:00_00:00:03	ARP	42	10.0.1.2 is at 00:00:00:00:00:01
15	11.868983	10.0.1.5	10.0.1.2	TCP	74	36234 → 9999 [SYN] Seq=0 Win=42340 Len=0 MSS=1460 SACK_PERM=1 TSval=4215957740 TSecr=0 WS=512
16	11.870934	10.0.1.2	10.0.1.5	TCP	74	9999 → 36234 [SYN, ACK] Seq=0 Ack=1 Win=43440 Len=0 MSS=1460 SACK_PERM=1 TSval=2636813658 TSecr=4215957740 WS=512
17	11.870958	10.0.1.5	10.0.1.2	TCP	66	36234 → 9999 [ACK] Seq=1 Ack=1 Win=42496 Len=0 TSval=4215957742 TSecr=2636813658
18	11.870992	10.0.1.5	10.0.1.2	TCP	96	36234 → 9999 [PSH, ACK] Seq=1 Ack=1 Win=42496 Len=30 TSval=4215957742 TSecr=2636813658 [TCP segment of a reassembled PDU]
19	11.871216	10.0.1.2	10.0.1.5	TCP	66	9999 → 36234 [ACK] Seq=1 Ack=31 Win=43520 Len=0 TSval=2636813658 TSecr=4215957742
20	11.871342	10.0.1.2	10.0.1.5	TCP	117	9999 → 36234 [PSH, ACK] Seq=1 Ack=31 Win=43520 Len=51 TSval=2636813659 TSecr=4215957742 [TCP segment of a reassembled PDU]
21	11.871356	10.0.1.5	10.0.1.2	TCP	66	36234 → 9999 [ACK] Seq=31 Ack=52 Win=42496 Len=0 TSval=4215957743 TSecr=2636813659
22	12.872626	10.0.1.5	10.0.1.2	TCP	96	36234 → 9999 [PSH, ACK] Seq=31 Ack=52 Win=42496 Len=30 TSval=4215958744 TSecr=2636813659 [TCP segment of a reassembled PDU]
23	12.872938	10.0.1.2	10.0.1.5	TCP	117	9999 → 36234 [PSH, ACK] Seq=52 Ack=61 Win=43520 Len=51 TSval=2636814660 TSecr=4215958744 [TCP segment of a reassembled PDU]
24	12.872951	10.0.1.5	10.0.1.2	TCP	66	36234 → 9999 [ACK] Seq=61 Ack=103 Win=42496 Len=0 TSval=4215958744 TSecr=2636814660
25	13.874381	10.0.1.5	10.0.1.2	TCP	96	36234 → 9999 [PSH, ACK] Seq=61 Ack=103 Win=42496 Len=30 TSval=4215959746 TSecr=2636814660 [TCP segment of a reassembled PDU]
26	13.874547	10.0.1.2	10.0.1.5	TCP	117	9999 → 36234 [PSH, ACK] Seq=103 Ack=91 Win=43520 Len=51 TSval=2636815662 TSecr=4215959746 [TCP segment of a reassembled PDU]
27	13.874555	10.0.1.5	10.0.1.2	TCP	66	36234 → 9999 [ACK] Seq=91 Ack=154 Win=42496 Len=0 TSval=4215959746 TSecr=2636815662
28	14.875808	10.0.1.5	10.0.1.2	TCP	96	36234 → 9999 [PSH, ACK] Seq=91 Ack=154 Win=42496 Len=30 TSval=4215960747 TSecr=2636815662 [TCP segment of a reassembled PDU]
29	14.875940	10.0.1.2	10.0.1.5	TCP	117	9999 → 36234 [PSH, ACK] Seq=154 Ack=121 Win=43520 Len=51 TSval=2636816663 TSecr=4215960747 [TCP segment of a reassembled PDU]
30	14.875947	10.0.1.5	10.0.1.2	TCP	66	36234 → 9999 [ACK] Seq=121 Ack=205 Win=42496 Len=0 TSval=4215960747 TSecr=2636816663
31	15.877185	10.0.1.5	10.0.1.2	TCP	96	36234 → 9999 [PSH, ACK] Seq=121 Ack=205 Win=42496 Len=30 TSval=4215961748 TSecr=2636816663 [TCP segment of a reassembled PDU]
32	15.877373	10.0.1.2	10.0.1.5	TCP	117	9999 → 36234 [PSH, ACK] Seq=205 Ack=151 Win=43520 Len=51 TSval=2636817665 TSecr=4215961748 [TCP segment of a reassembled PDU]
33	15.877380	10.0.1.5	10.0.1.2	TCP	66	36234 → 9999 [ACK] Seq=151 Ack=256 Win=42496 Len=0 TSval=4215961749 TSecr=2636817665
34	16.878563	10.0.1.5	10.0.1.2	TCP	96	36234 → 9999 [PSH, ACK] Seq=151 Ack=256 Win=42496 Len=30 TSval=4215962750 TSecr=2636817665 [TCP segment of a reassembled PDU]
35	16.878943	10.0.1.2	10.0.1.5	TCP	117	9999 → 36234 [PSH, ACK] Seq=256 Ack=181 Win=43520 Len=51 TSval=2636818666 TSecr=4215962750 [TCP segment of a reassembled PDU]
36	16.878953	10.0.1.5	10.0.1.2	TCP	66	36234 → 9999 [ACK] Seq=181 Ack=307 Win=42496 Len=0 TSval=4215962750 TSecr=2636818666
37	17.880179	10.0.1.5	10.0.1.2	TCP	96	36234 → 9999 [PSH, ACK] Seq=181 Ack=307 Win=42496 Len=30 TSval=4215963751 TSecr=2636818666 [TCP segment of a reassembled PDU]
38	17.880354	10.0.1.2	10.0.1.5	TCP	117	9999 → 36234 [PSH, ACK] Seq=307 Ack=211 Win=43520 Len=51 TSval=2636819667 TSecr=4215963751 [TCP segment of a reassembled PDU]
39	17.880363	10.0.1.5	10.0.1.2	TCP	66	36234 → 9999 [ACK] Seq=211 Ack=358 Win=42496 Len=0 TSval=4215963752 TSecr=2636819667
40	18.881575	10.0.1.5	10.0.1.2	TCP	96	36234 → 9999 [PSH, ACK] Seq=211 Ack=358 Win=42496 Len=30 TSval=4215964753 TSecr=2636819667 [TCP segment of a reassembled PDU]
41	18.881660	10.0.1.2	10.0.1.5	TCP	117	9999 → 36234 [PSH, ACK] Seq=358 Ack=241 Win=43520 Len=51 TSval=2636820669 TSecr=4215964753 [TCP segment of a reassembled PDU]
42	18.881664	10.0.1.5	10.0.1.2	TCP	66	36234 → 9999 [ACK] Seq=241 Ack=409 Win=42496 Len=0 TSval=4215964753 TSecr=2636820669
43	19.882852	10.0.1.5	10.0.1.2	TCP	96	36234 → 9999 [PSH, ACK] Seq=241 Ack=409 Win=42496 Len=30 TSval=4215965754 TSecr=2636820669 [TCP segment of a reassembled PDU]
44	19.883022	10.0.1.2	10.0.1.5	TCP	117	9999 → 36234 [PSH, ACK] Seq=409 Ack=271 Win=43520 Len=51 TSval=2636821670 TSecr=4215965754 [TCP segment of a reassembled PDU]
45	19.883031	10.0.1.5	10.0.1.2	TCP	66	36234 → 9999 [ACK] Seq=271 Ack=460 Win=42496 Len=0 TSval=4215965754 TSecr=2636821670
46	20.884317	10.0.1.5	10.0.1.2	TCP	96	36234 → 9999 [PSH, ACK] Seq=271 Ack=460 Win=42496 Len=30 TSval=4215966755 TSecr=2636821670 [TCP segment of a reassembled PDU]
47	20.884688	10.0.1.2	10.0.1.5	TCP	117	9999 → 36234 [PSH, ACK] Seq=460 Ack=301 Win=43520 Len=51 TSval=2636822672 TSecr=4215966755 [TCP segment of a reassembled PDU]
48	20.884699	10.0.1.5	10.0.1.2	TCP	66	36234 → 9999 [ACK] Seq=301 Ack=511 Win=42496 Len=0 TSval=4215966756 TSecr=2636822672
49	21.886022	10.0.1.5	10.0.1.2	TCP	97	36234 → 9999 [PSH, ACK] Seq=301 Ack=511 Win=42496 Len=31 TSval=4215967757 TSecr=2636822672 [TCP segment of a reassembled PDU]
50	21.886287	10.0.1.2	10.0.1.5	TCP	117	9999 → 36234 [PSH, ACK] Seq=511 Ack=332 Win=43520 Len=51 TSval=2636823673 TSecr=4215967757 [TCP segment of a reassembled PDU]
51	21.886295	10.0.1.5	10.0.1.2	TCP	66	36234 → 9999 [ACK] Seq=332 Ack=562 Win=42496 Len=0 TSval=4215967757 TSecr=2636823673
52	22.887467	10.0.1.5	10.0.1.2	TCP	97	36234 → 9999 [PSH, ACK] Seq=332 Ack=562 Win=42496 Len=31 TSval=4215968759 TSecr=2636823673 [TCP segment of a reassembled PDU]
53	22.887563	10.0.1.2	10.0.1.5	TCP	117	9999 → 36234 [PSH, ACK] Seq=562 Ack=363 Win=43520 Len=51 TSval=2636824675 TSecr=4215968759 [TCP segment of a reassembled PDU]
54	22.887568	10.0.1.5	10.0.1.2	TCP	66	36234 → 9999 [ACK] Seq=363 Ack=613 Win=42496 Len=0 TSval=4215968759 TSecr=2636824675
55	23.888917	10.0.1.5	10.0.1.2	TCP	97	36234 → 9999 [PSH, ACK] Seq=363 Ack=613 Win=42496 Len=31 TSval=4215969760 TSecr=2636824675 [TCP segment of a reassembled PDU]
56	23.889046	10.0.1.2	10.0.1.5	TCP	117	9999 → 36234 [PSH, ACK] Seq=613 Ack=394 Win=43520 Len=51 TSval=2636825676 TSecr=4215969760 [TCP segment of a reassembled PDU]
57	23.889054	10.0.1.5	10.0.1.2	TCP	66	36234 → 9999 [ACK] Seq=394 Ack=664 Win=42496 Len=0 TSval=4215969760 TSecr=2636825676
58	24.890260	10.0.1.5	10.0.1.2	TCP	97	36234 → 9999 [PSH, ACK] Seq=394 Ack=664 Win=42496 Len=31 TSval=4215970761 TSecr=2636825676 [TCP segment of a reassembled PDU]
59	24.890831	10.0.1.2	10.0.1.5	TCP	117	9999 → 36234 [PSH, ACK] Seq=664 Ack=425 Win=43520 Len=51 TSval=2636826678 TSecr=4215970761 [TCP segment of a reassembled PDU]
60	24.890843	10.0.1.5	10.0.1.2	TCP	66	36234 → 9999 [ACK] Seq=425 Ack=715 Win=42496 Len=0 TSval=4215970762 TSecr=2636826678
61	24.933319	10.0.1.5	10.0.1.2	TCP	66	36234 → 9999 [FIN, ACK] Seq=425 Ack=715 Win=42496 Len=0 TSval=4215970805 TSecr=2636826678
62	24.933591	10.0.1.2	10.0.1.5	TCP	66	9999 → 36234 [FIN, ACK] Seq=715 Ack=426 Win=43520 Len=0 TSval=2636826721 TSecr=4215970805
63	24.933606	10.0.1.5	10.0.1.2	TCP	66	36234 → 9999 [ACK] Seq=426 Ack=716 Win=42496 Len=0 TSval=4215970805 TSecr=2636826721