1	0.000000	10.0.1.5	10.0.1.2	TCP	74	51000 → 9999 [SYN] Seq=0 Win=42340 Len=0 MSS=1460 SACK_PERM=1 TSval=4223399471 TSecr=0 WS=512
2	0.003715	10.0.1.2	10.0.1.5	TCP	74	9999 → 51000 [SYN, ACK] Seq=0 Ack=1 Win=43440 Len=0 MSS=1460 SACK_PERM=1 TSval=2644255391 TSecr=4223399471 WS=512
3	0.003738	10.0.1.5	10.0.1.2	TCP	66	51000 → 9999 [ACK] Seq=1 Ack=1 Win=42496 Len=0 TSval=4223399475 TSecr=2644255391
4	0.003791	10.0.1.5	10.0.1.2	TCP	96	51000 → 9999 [PSH, ACK] Seq=1 Ack=1 Win=42496 Len=30 TSval=4223399475 TSecr=2644255391 [TCP segment of a reassembled PDU]
5	0.006095	10.0.1.2	10.0.1.5	TCP	54	9999 → 51000 [RST] Seq=1 Win=0 Len=0
6	0.006133	10.0.1.2	10.0.1.5	TCP	54	9999 → 51000 [RST] Seq=1 Win=0 Len=0
7	1.063720	10.0.1.2	10.0.1.5	TCP	74	[TCP Retransmission] 9999 → 51000 [SYN, ACK] Seq=0 Ack=1 Win=43440 Len=0 MSS=1460 SACK_PERM=1 TSval=2644256451 TSecr=4223399471 WS=512
8	1.063742	10.0.1.5	10.0.1.2	TCP	54	51000 → 9999 [RST] Seq=1 Win=0 Len=0
9	7.233728	10.0.1.5	10.0.1.2	TCP	74	51002 → 9999 [SYN] Seq=0 Win=42340 Len=0 MSS=1460 SACK_PERM=1 TSval=4223406705 TSecr=0 WS=512
10	7.236296	10.0.1.2	10.0.1.5	TCP	74	9999 → 51002 [SYN, ACK] Seq=0 Ack=1 Win=43440 Len=0 MSS=1460 SACK_PERM=1 TSval=2644262623 TSecr=4223406705 WS=512
11	7.236334	10.0.1.5	10.0.1.2	TCP	66	51002 → 9999 [ACK] Seq=1 Ack=1 Win=42496 Len=0 TSval=4223406707 TSecr=2644262623
12	7.236486	10.0.1.5	10.0.1.2	TCP	96	51002 → 9999 [PSH, ACK] Seq=1 Ack=1 Win=42496 Len=30 TSval=4223406708 TSecr=2644262623 [TCP segment of a reassembled PDU]
13	7.236568	10.0.1.2	10.0.1.5	TCP	66	9999 → 51002 [ACK] Seq=1 Ack=31 Win=43520 Len=0 TSval=2644262624 TSecr=4223406708
14	7.236822	10.0.1.2	10.0.1.5	TCP	117	9999 → 51002 [PSH, ACK] Seq=1 Ack=31 Win=43520 Len=51 TSval=2644262624 TSecr=4223406708 [TCP segment of a reassembled PDU]
15	7.236853	10.0.1.5	10.0.1.2	TCP	66	51002 → 9999 [ACK] Seq=31 Ack=52 Win=42496 Len=0 TSval=4223406708 TSecr=2644262624
16	7.238290	10.0.1.2	10.0.1.5	TCP	54	9999 → 51002 [RST] Seq=1 Win=0 Len=0
17	8.239089	10.0.1.5	10.0.1.2	TCP	96	51002 → 9999 [PSH, ACK] Seq=31 Ack=52 Win=42496 Len=30 TSval=4223407710 TSecr=2644262624 [TCP segment of a reassembled PDU]
18	8.239264	10.0.1.2	10.0.1.5	TCP	117	9999 → 51002 [PSH, ACK] Seq=52 Ack=61 Win=43520 Len=51 TSval=2644263626 TSecr=4223407710 [TCP segment of a reassembled PDU]
19	8.239272	10.0.1.5	10.0.1.2	TCP	66	51002 → 9999 [ACK] Seq=61 Ack=103 Win=42496 Len=0 TSval=4223407710 TSecr=2644263626
20	9.240744	10.0.1.5	10.0.1.2	TCP	96	51002 → 9999 [PSH, ACK] Seq=61 Ack=103 Win=42496 Len=30 TSval=4223408712 TSecr=2644263626 [TCP segment of a reassembled PDU]
21	9.240878	10.0.1.2	10.0.1.5	TCP	117	9999 → 51002 [PSH, ACK] Seq=103 Ack=91 Win=43520 Len=51 TSval=2644264628 TSecr=4223408712 [TCP segment of a reassembled PDU]
22	9.240883	10.0.1.5	10.0.1.2	TCP	66	51002 → 9999 [ACK] Seq=91 Ack=154 Win=42496 Len=0 TSval=4223408712 TSecr=2644264628
23	10.242309	10.0.1.5	10.0.1.2	TCP	96	51002 → 9999 [PSH, ACK] Seq=91 Ack=154 Win=42496 Len=30 TSval=4223409713 TSecr=2644264628 [TCP segment of a reassembled PDU]
24	10.242764	10.0.1.2	10.0.1.5	TCP	117	9999 → 51002 [PSH, ACK] Seq=154 Ack=121 Win=43520 Len=51 TSval=2644265630 TSecr=4223409713 [TCP segment of a reassembled PDU]
25	10.242781	10.0.1.5	10.0.1.2	TCP	66	51002 → 9999 [ACK] Seq=121 Ack=205 Win=42496 Len=0 TSval=4223409714 TSecr=2644265630
26	11.244619	10.0.1.5	10.0.1.2	TCP	96	51002 → 9999 [PSH, ACK] Seq=121 Ack=205 Win=42496 Len=30 TSval=4223410716 TSecr=2644265630 [TCP segment of a reassembled PDU]
27	11.244912	10.0.1.2	10.0.1.5	TCP	117	9999 → 51002 [PSH, ACK] Seq=205 Ack=151 Win=43520 Len=51 TSval=2644266632 TSecr=4223410716 [TCP segment of a reassembled PDU]
28	11.244927	10.0.1.5	10.0.1.2	TCP	66	51002 → 9999 [ACK] Seq=151 Ack=256 Win=42496 Len=0 TSval=4223410716 TSecr=2644266632
29	12.246269	10.0.1.5	10.0.1.2	TCP	96	51002 → 9999 [PSH, ACK] Seq=151 Ack=256 Win=42496 Len=30 TSval=4223411717 TSecr=2644266632 [TCP segment of a reassembled PDU]
30	12.246628	10.0.1.2	10.0.1.5	TCP	117	9999 → 51002 [PSH, ACK] Seq=256 Ack=181 Win=43520 Len=51 TSval=2644267634 TSecr=4223411717 [TCP segment of a reassembled PDU]
31	12.246640	10.0.1.5	10.0.1.2	TCP	66	51002 → 9999 [ACK] Seq=181 Ack=307 Win=42496 Len=0 TSval=4223411718 TSecr=2644267634
32	13.248164	10.0.1.5	10.0.1.2	TCP	96	51002 → 9999 [PSH, ACK] Seq=181 Ack=307 Win=42496 Len=30 TSval=4223412719 TSecr=2644267634 [TCP segment of a reassembled PDU]
33	13.248528	10.0.1.2	10.0.1.5	TCP	117	9999 → 51002 [PSH, ACK] Seq=307 Ack=211 Win=43520 Len=51 TSval=2644268636 TSecr=4223412719 [TCP segment of a reassembled PDU]
34	13.248542	10.0.1.5	10.0.1.2	TCP	66	51002 → 9999 [ACK] Seq=211 Ack=358 Win=42496 Len=0 TSval=4223412720 TSecr=2644268636
35	14.250270	10.0.1.5	10.0.1.2	TCP	96	51002 → 9999 [PSH, ACK] Seq=211 Ack=358 Win=42496 Len=30 TSval=4223413721 TSecr=2644268636 [TCP segment of a reassembled PDU]
36	14.250846	10.0.1.2	10.0.1.5	TCP	117	9999 → 51002 [PSH, ACK] Seq=358 Ack=241 Win=43520 Len=51 TSval=2644269638 TSecr=4223413721 [TCP segment of a reassembled PDU]
37	14.250865	10.0.1.5	10.0.1.2	TCP	66	51002 → 9999 [ACK] Seq=241 Ack=409 Win=42496 Len=0 TSval=4223413722 TSecr=2644269638
38	15.252617	10.0.1.5	10.0.1.2	TCP	96	51002 → 9999 [PSH, ACK] Seq=241 Ack=409 Win=42496 Len=30 TSval=4223414724 TSecr=2644269638 [TCP segment of a reassembled PDU]
39	15.253038	10.0.1.2	10.0.1.5	TCP	117	9999 → 51002 [PSH, ACK] Seq=409 Ack=271 Win=43520 Len=51 TSval=2644270640 TSecr=4223414724 [TCP segment of a reassembled PDU]
40	15.253056	10.0.1.5	10.0.1.2	TCP	66	51002 → 9999 [ACK] Seq=271 Ack=460 Win=42496 Len=0 TSval=4223414724 TSecr=2644270640
41	16.254803	10.0.1.5	10.0.1.2	TCP	96	51002 → 9999 [PSH, ACK] Seq=271 Ack=460 Win=42496 Len=30 TSval=4223415726 TSecr=2644270640 [TCP segment of a reassembled PDU]
42	16.255041	10.0.1.2	10.0.1.5	TCP	117	9999 → 51002 [PSH, ACK] Seq=460 Ack=301 Win=43520 Len=51 TSval=2644271642 TSecr=4223415726 [TCP segment of a reassembled PDU]
43	16.255047	10.0.1.5	10.0.1.2	TCP	66	51002 → 9999 [ACK] Seq=301 Ack=511 Win=42496 Len=0 TSval=4223415726 TSecr=2644271642
44	17.256689	10.0.1.5	10.0.1.2	TCP	97	51002 → 9999 [PSH, ACK] Seq=301 Ack=511 Win=42496 Len=31 TSval=4223416728 TSecr=2644271642 [TCP segment of a reassembled PDU]
45	17.257025	10.0.1.2	10.0.1.5	TCP	117	9999 → 51002 [PSH, ACK] Seq=511 Ack=332 Win=43520 Len=51 TSval=2644272644 TSecr=4223416728 [TCP segment of a reassembled PDU]
46	17.257035	10.0.1.5	10.0.1.2	TCP	66	51002 → 9999 [ACK] Seq=332 Ack=562 Win=42496 Len=0 TSval=4223416728 TSecr=2644272644
47	18.258742	10.0.1.5	10.0.1.2	TCP	97	51002 → 9999 [PSH, ACK] Seq=332 Ack=562 Win=42496 Len=31 TSval=4223417730 TSecr=2644272644 [TCP segment of a reassembled PDU]
48	18.259235	10.0.1.2	10.0.1.5	TCP	117	9999 → 51002 [PSH, ACK] Seq=562 Ack=363 Win=43520 Len=51 TSval=2644273646 TSecr=4223417730 [TCP segment of a reassembled PDU]
49	18.259253	10.0.1.5	10.0.1.2	TCP	66	51002 → 9999 [ACK] Seq=363 Ack=613 Win=42496 Len=0 TSval=4223417730 TSecr=2644273646
50	19.261055	10.0.1.5	10.0.1.2	TCP	97	51002 → 9999 [PSH, ACK] Seq=363 Ack=613 Win=42496 Len=31 TSval=4223418732 TSecr=2644273646 [TCP segment of a reassembled PDU]
51	19.261712	10.0.1.2	10.0.1.5	TCP	117	9999 → 51002 [PSH, ACK] Seq=613 Ack=394 Win=43520 Len=51 TSval=2644274649 TSecr=4223418732 [TCP segment of a reassembled PDU]
52	19.261732	10.0.1.5	10.0.1.2	TCP	66	51002 → 9999 [ACK] Seq=394 Ack=664 Win=42496 Len=0 TSval=4223418733 TSecr=2644274649
53	20.264203	10.0.1.5	10.0.1.2	TCP	97	51002 → 9999 [PSH, ACK] Seq=394 Ack=664 Win=42496 Len=31 TSval=4223419735 TSecr=2644274649 [TCP segment of a reassembled PDU]
54	20.264792	10.0.1.2	10.0.1.5	TCP	117	9999 → 51002 [PSH, ACK] Seq=664 Ack=425 Win=43520 Len=51 TSval=2644275652 TSecr=4223419735 [TCP segment of a reassembled PDU]
55	20.264812	10.0.1.5	10.0.1.2	TCP	66	51002 → 9999 [ACK] Seq=425 Ack=715 Win=42496 Len=0 TSval=4223419736 TSecr=2644275652
56	21.267545	10.0.1.5	10.0.1.2	TCP	97	51002 → 9999 [PSH, ACK] Seq=425 Ack=715 Win=42496 Len=31 TSval=4223420739 TSecr=2644275652 [TCP segment of a reassembled PDU]
57	21.268013	10.0.1.2	10.0.1.5	TCP	117	9999 → 51002 [PSH, ACK] Seq=715 Ack=456 Win=43520 Len=51 TSval=2644276655 TSecr=4223420739 [TCP segment of a reassembled PDU]
58	21.268033	10.0.1.5	10.0.1.2	TCP	66	51002 → 9999 [ACK] Seq=456 Ack=766 Win=42496 Len=0 TSval=4223420739 TSecr=2644276655
59	22.269992	10.0.1.5	10.0.1.2	TCP	97	51002 → 9999 [PSH, ACK] Seq=456 Ack=766 Win=42496 Len=31 TSval=4223421741 TSecr=2644276655 [TCP segment of a reassembled PDU]
60	22.270362	10.0.1.2	10.0.1.5	TCP	117	9999 → 51002 [PSH, ACK] Seq=766 Ack=487 Win=43520 Len=51 TSval=2644277657 TSecr=4223421741 [TCP segment of a reassembled PDU]
61	22.270444	10.0.1.5	10.0.1.2	TCP	66	51002 → 9999 [ACK] Seq=487 Ack=817 Win=42496 Len=0 TSval=4223421742 TSecr=2644277657
62	23.271792	10.0.1.5	10.0.1.2	TCP	97	51002 → 9999 [PSH, ACK] Seq=487 Ack=817 Win=42496 Len=31 TSval=4223422743 TSecr=2644277657 [TCP segment of a reassembled PDU]
63	23.272272	10.0.1.2	10.0.1.5	TCP	117	9999 → 51002 [PSH, ACK] Seq=817 Ack=518 Win=43520 Len=51 TSval=2644278659 TSecr=4223422743 [TCP segment of a reassembled PDU]
64	23.272287	10.0.1.5	10.0.1.2	TCP	66	51002 → 9999 [ACK] Seq=518 Ack=868 Win=42496 Len=0 TSval=4223422743 TSecr=2644278659
65	24.274084	10.0.1.5	10.0.1.2	TCP	97	51002 → 9999 [PSH, ACK] Seq=518 Ack=868 Win=42496 Len=31 TSval=4223423745 TSecr=2644278659 [TCP segment of a reassembled PDU]
66	24.274627	10.0.1.2	10.0.1.5	TCP	117	9999 → 51002 [PSH, ACK] Seq=868 Ack=549 Win=43520 Len=51 TSval=2644279662 TSecr=4223423745 [TCP segment of a reassembled PDU]
67	24.274642	10.0.1.5	10.0.1.2	TCP	66	51002 → 9999 [ACK] Seq=549 Ack=919 Win=42496 Len=0 TSval=4223423746 TSecr=2644279662
68	24.939754	10.0.1.5	10.0.1.2	TCP	66	51002 → 9999 [FIN, ACK] Seq=549 Ack=919 Win=42496 Len=0 TSval=4223424411 TSecr=2644279662
69	24.940455	10.0.1.2	10.0.1.5	TCP	66	9999 → 51002 [FIN, ACK] Seq=919 Ack=550 Win=43520 Len=0 TSval=2644280328 TSecr=4223424411
70	24.940470	10.0.1.5	10.0.1.2	TCP	66	51002 → 9999 [ACK] Seq=550 Ack=920 Win=42496 Len=0 TSval=4223424412 TSecr=2644280328
71	56.553094	fe80::200:ff:fe00:2	ff02::2	ICMPv6	70	Router Solicitation from 00:00:00:00:00:02